,data,Name,Price,Nal
186,2021-10-23,Автомагнитола штатная Gazer CM6007-XM10 для Kia Sorento (XM10) 2010-2012,20 900,Есть в наличии
187,2021-10-23,Автомагнитола штатная Gazer CM5510-A40 для Toyota RAV 4 (A40) 2013-2016,12 719,Есть в наличии
188,2021-10-23,Автомагнитола штатная Gazer CM6510-KL для Jeep Cherokee (KL) 2014-2017,16 720,Есть в наличии
189,2021-10-23,Автомагнитола штатная Gazer CM5509-QL для Kia Sportage (QL) 2015-2017,15 899,Есть в наличии
190,2021-10-23,Автомагнитола штатная Gazer CM6509-GH для Honda HRV (GH) 2013-2017,8 489,Есть в наличии
191,2021-10-23,Автомагнитола штатная Gazer CM5007-RE для Honda CRV (RE) 2006-2011,6 569,Есть в наличии
192,2021-10-23,Автомагнитола штатная Gazer CM5007-TB ё-TB для Mazda CX-9 (TB) 2006-2012,7 099,Есть в наличии
193,2021-10-23,"Автомагнитола штатная Gazer CM6008-J150H для Toyota Prado, LC150-High level 2014-2016",8 579,Есть в наличии
194,2021-10-23,Автомагнитола штатная Gazer CM5510-LF для Hyundai Sonata (LF) 2015-2017,8 119,Есть в наличии
195,2021-10-23,Автомагнитола штатная Gazer CM5006-PS для Kia Soul (PS) 2012-2014,6 329,Есть в наличии
196,2021-10-23,Автомагнитола штатная Gazer CM6008-X4 для Toyota Avalon (X4) 2014-2017,8 879,Есть в наличии
197,2021-10-23,Автомагнитола штатная Gazer CM5007-955 для Porsche Cayenne (955) 2002-2009,7 569,Есть в наличии
198,2021-10-23,Автомагнитола штатная Gazer CM5510-CR для Honda Accord (CR) 2013 - 2017,6 609,Есть в наличии
199,2021-10-23,Автомагнитола штатная Gazer CM5007-8E для AUDI A4 2002-2008,6 609,Есть в наличии
200,2021-10-23,Автомагнитола штатная Gazer CM6510-LF для Hyundai Sonata (LF) 2015-2017,9 189,Есть в наличии
201,2021-10-23,Автомагнитола штатная Gazer CM5007-263 для Fiat Doblo (263) 2015-2017,7 099,Есть в наличии
202,2021-10-23,Автомагнитола штатная Gazer CM6509-CW6 для Mitsubishi Outlander XL (CW) 2006-2012,7 969,Есть в наличии
203,2021-10-23,Автомагнитола штатная Gazer CM6007-W251 для Mercedes R (W251) 2005-2013,9 719,Есть в наличии
204,2021-10-23,Амортизатор багажника Gazer TG-W213D,25 999,Есть в наличии
205,2021-10-23,Амортизатор багажника Gazer TG-AD1,25 999,Есть в наличии
206,2021-10-23,Амортизатор багажника Gazer TG-DK,25 999,Есть в наличии
207,2021-10-23,Амортизатор багажника Gazer TG-XZ,25 999,Есть в наличии
208,2021-10-23,Амортизатор багажника Gazer TG-KF,25 999,Есть в наличии
209,2021-10-23,Амортизатор багажника Gazer TG-B8,25 999,Есть в наличии
210,2021-10-23,Амортизатор багажника Gazer TG-NU7,25 999,Есть в наличии
211,2021-10-23,Амортизатор багажника Gazer TG-5N2,25 999,Есть в наличии
212,2021-10-23,Автомагнитола штатная Gazer CM6510-KX7 для Kia Sorento (KX7) 2017-,8 269,Есть в наличии
213,2021-10-23,Автомагнитола штатная Gazer CM6510-MA для Ford Kuga (MA)-low version 2013-2017,8 089,Есть в наличии
214,2021-10-23,Автомагнитола штатная Gazer CM5007-BA для Hyundai i10 (BA) 2013-2016,7 109,Есть в наличии
215,2021-10-23,Автомагнитола штатная Gazer CM5007-PA для Hyundai i10 (PA) 2007-2013,6 269,Есть в наличии
216,2021-10-23,Автомагнитола штатная Gazer CM5006-L10 для Nissan Livina (L10) 2013-2016,6 269,Есть в наличии
217,2021-10-23,Автомагнитола штатная Gazer CM6008-J100 для Toyota LC 100 (J100) 1998-2007,7 999,Есть в наличии
218,2021-10-23,"Автомагнитола штатная Gazer CM5510-GP для Honda Fit (GP), Jazz 2014-2017",7 059,Есть в наличии
219,2021-10-23,Автомагнитола штатная Gazer CM5510-3G2 для VW Passat B8 (3G2) 2014-2017,7 159,Есть в наличии
220,2021-10-23,Автомагнитола штатная Gazer CM5510-J200 для Toyota LC 200 (J200) 2007-2015,7 169,Есть в наличии
221,2021-10-23,Автомагнитола штатная Gazer CM6007-263 для Fiat Doblo (263) 2015-2017,7 899,Есть в наличии
222,2021-10-23,Автомагнитола штатная Gazer CM6509-V9W для Mitsubishi Pajero (V9W) 2016-2017,8 529,Есть в наличии
223,2021-10-23,Автомагнитола штатная Gazer CM6007-TYT для Toyota Prado (J120) 2002-2009,9 249,Есть в наличии
224,2021-10-23,Автомагнитола штатная Gazer CM5008-JD для Kia Ceed (JD) 2011-2017,6 709,Есть в наличии
225,2021-10-23,"Автомагнитола штатная Gazer CM5510-J150H/L для Toyota Prado, LC150-High/Low level",8 169,Есть в наличии
226,2021-10-23,Автомагнитола штатная Gazer CM6008-XW50 для Toyota Prius (XW50) 2014-2017,8 249,Есть в наличии
227,2021-10-23,"Автомагнитола штатная Gazer CM6510-GP для Honda Fit (GP), Jazz 2014-2017",8 459,Есть в наличии
228,2021-10-23,Автомагнитола штатная Gazer CM6008-VST для Lada Vesta 2015-2017,7 669,Есть в наличии
229,2021-10-23,Автомагнитола штатная Gazer CM5509-N8 для Toyota Hilux (N8) 2015-2017,13 899,Есть в наличии
230,2021-10-23,Автомагнитола штатная Gazer CM6510-JK для Jeep Wrangler (JK) 2011-2014,9 919,Есть в наличии
231,2021-10-23,Автомагнитола штатная Gazer CM6007-8J для AUDI TT 2006-2011,8 859,Есть в наличии
232,2021-10-23,Автомагнитола штатная Gazer CM5008-J200 для Toyota LC 200 (J200) 2007-2015,7 429,Есть в наличии
233,2021-10-23,Автомагнитола штатная Gazer CM6008-V55 для Toyota Camry (V55) 2015-2017,7 919,Есть в наличии
234,2021-10-23,"Автомагнитола штатная Gazer CM5007-GAB для Ssang Yong Actyon, Kyron, Korando 2005-2010",7 409,Есть в наличии
235,2021-10-23,Автомагнитола штатная Gazer CM6007-955 для Porsche Cayenne (955) 2002-2009,8 779,Есть в наличии
236,2021-10-23,Автомагнитола штатная Gazer CM5008-V50USA для Toyota Camry (V50-USA) 2012-2015,6 439,Есть в наличии
237,2021-10-23,Автомагнитола штатная Gazer CM6009-XU50 для Toyota Highlander (XU50) 2015-2017,10 269,Есть в наличии
238,2021-10-23,Автомагнитола штатная Gazer CM5006-120 для Toyota Universal 2001-2012,6 289,Есть в наличии
239,2021-10-23,Автомагнитола штатная Gazer CM5006-P130 для Toyota Yaris (P130) 2011-2013,7 019,Есть в наличии
240,2021-10-23,Автомагнитола штатная Gazer CM5006-N5 для Toyota Hilux (N5) 2012-2015,6 199,Есть в наличии
241,2021-10-23,Автомагнитола штатная Gazer CM5509-TYT для Toyota Prado (J120) 2002-2009,7 109,Есть в наличии
242,2021-10-23,Автомагнитола штатная Gazer CM5509-RW для Honda CRV 2017+,6 609,Есть в наличии
243,2021-10-23,Автомагнитола штатная Gazer CM5008-UM для Kia Sorento (UM) 2015-2017,7 099,Есть в наличии
244,2021-10-23,Автомагнитола штатная Gazer CM6510-JF для Kia Optima (JF) 2015-2017,8 489,Есть в наличии
245,2021-10-23,Автомагнитола штатная Gazer CM5510-TLN для Hyundai Tucson (TLN) 2018+,6 609,Есть в наличии
246,2021-10-23,Автомагнитола штатная Gazer CM5510-A50 для Toyota RAV4 2019+,6 609,Есть в наличии
247,2021-10-23,Амортизатор багажника Gazer TG-A50,25 999,Есть в наличии
248,2021-10-23,Амортизатор багажника Gazer TG-UM,25 999,Есть в наличии
249,2021-10-23,Амортизатор багажника Gazer TG-GFW,25 999,Есть в наличии
250,2021-10-23,Амортизатор багажника Gazer TG-TLN,25 999,Есть в наличии
251,2021-10-23,Амортизатор багажника Gazer TG-DM,25 999,Есть в наличии
252,2021-10-23,Амортизатор багажника Gazer TG-A40,25 999,Есть в наличии
253,2021-10-23,Амортизатор багажника Gazer TG-GH,25 999,Есть в наличии
254,2021-10-23,Амортизатор багажника Gazer TG-TL,25 999,Есть в наличии
255,2021-10-23,Амортизатор багажника Gazer TG-7P5,25 999,Есть в наличии
256,2021-10-23,Амортизатор багажника Gazer TG-RM4,25 999,Есть в наличии
257,2021-10-23,Амортизатор багажника Gazer TG-NS7,25 999,Есть в наличии
258,2021-10-23,Амортизатор багажника Gazer TG-W212,25 999,Есть в наличии
259,2021-10-23,Амортизатор багажника Gazer TG-W639,25 999,Есть в наличии
260,2021-10-23,Автомагнитола штатная Gazer CM6510-J200 для Toyota LC 200 (J200) 2007-2015,7 979,Есть в наличии
261,2021-10-23,Автомагнитола штатная Gazer CM6007-W2 для Ssang Yong Rexton (W2) 2013-2017,16 720,Есть в наличии
262,2021-10-23,Автомагнитола штатная Gazer CM6006-120F для Toyota Universal 2001-2012,7 949,Есть в наличии
263,2021-10-23,Автомагнитола штатная Gazer CM5007-E150 для Toyota Corolla (E150) 2013-2016,7 099,Есть в наличии
264,2021-10-23,Автомагнитола штатная Gazer CM6007-QV для Kia Mohave (QV) 2007-2012,8 489,Есть в наличии
265,2021-10-23,Автомагнитола штатная Gazer CM5008-A40 для Toyota RAV 4 (A40) 2013-2016,7 109,Есть в наличии
266,2021-10-23,Автомагнитола штатная Gazer CM5510-J150 для Toyota Prado (J150) 2010-2013,7 719,Есть в наличии
267,2021-10-23,Автомагнитола штатная Gazer CM6008-UB15 для Kia Rio (UB15) 2015-2017,8 539,Есть в наличии
268,2021-10-23,Автомагнитола штатная Gazer CM5008-V55 для Toyota Camry (V55) 2015-2017,7 139,Есть в наличии
269,2021-10-23,Автомагнитола штатная Gazer CM5007-QV для Kia Mohave (QV) 2007-2012,6 679,Есть в наличии
270,2021-10-23,Автомагнитола штатная Gazer CM6007-S12 для Subaru Forester (S12) 2007-2012,7 969,Есть в наличии
271,2021-10-23,Автомагнитола штатная Gazer CM6007-A30 для Toyota RAV 4 (A30) 2006-2012,8 519,Есть в наличии
272,2021-10-23,Автомагнитола штатная Gazer CM6510-CR для Honda Accord (CR) 2013 - 2017,7 879,Есть в наличии
273,2021-10-23,Автомагнитола штатная Gazer CM5007-TA для Kia Picanto (TA) 2011-2017,6 279,Есть в наличии
274,2021-10-23,Автомагнитола штатная Gazer CM6510-J150 для Toyota Prado (J150) 2010-2013,9 479,Есть в наличии
275,2021-10-23,Автомагнитола штатная Gazer CM5008-J100 для Toyota LC 100 (J100) 1998-2007,6 729,Есть в наличии
276,2021-10-23,Автомагнитола штатная Gazer CM6509-DM для Hyundai Santa Fe (DM) 2012-2016,7 949,Есть в наличии
277,2021-10-23,"Автомагнитола штатная Gazer CM5007-B14 для Subaru Outback (B14, Legacy) 2008-2014",6 649,Есть в наличии
278,2021-10-23,Автомагнитола штатная Gazer CM5510-KX7 для Kia Sorento (KX7) 2017-,7 089,Есть в наличии
279,2021-10-23,"Автомагнитола штатная Gazer CM6509-J350 для Chevrolet Cruze (J350, Lacett i) 2013-2017",8 489,Есть в наличии
280,2021-10-23,Автомагнитола штатная Gazer CM6510-J150N для Toyota Land Cruiser Prado (J150N) 2017- 2020,9 889,Есть в наличии
281,2021-10-23,Автомагнитола штатная Gazer CM6510-TLN для Hyundai Tucson (TLN) 2018+,7 879,Есть в наличии
282,2021-10-23,Автомагнитола штатная Gazer CM5509-KHW для Mitsubishi Pajero Sport (KHW) 2008-2015,7 389,Есть в наличии
283,2021-10-23,Автомагнитола штатная Gazer CM6007-GV10 для Toyota Venza (GV10) 2008-2016,7 879,Есть в наличии
284,2021-10-23,Автомагнитола штатная Gazer CM5510-FA для Honda Civic (FA) 2006-2011,7 099,Есть в наличии
285,2021-10-23,Автомагнитола штатная Gazer CM5509-KX5 для Kia Sportage (KX5) 2018+,6 609,Есть в наличии
286,2021-10-23,Автомагнитола Gazer CM5507-100F,3 499,Нет в наличии
287,2021-10-23,Автомагнитола штатная Gazer CM6009-BK для Ford Focus (BK) 2015-2017,8 069,Нет в наличии
288,2021-10-23,Видеорегистратор Gazer F715,1 899,Нет в наличии
289,2021-10-23,Автомобильный монитор для задних пассажиров Gazer HR250,11 499,Нет в наличии
290,2021-10-23,Автомагнитола штатная Gazer CM7010-BM для Ford Focus (BM) 2012-2016,9 750,Нет в наличии
291,2021-10-23,Камера заднего вида Gazer CC120 (3695416),1 599,Нет в наличии
292,2021-10-23,Автомагнитола штатная Gazer CM6007-TA для Kia Picanto (TA) 2011-2017,19 990,Нет в наличии
293,2021-10-23,Парковочная система Gazer PA40F (3608166),2 899,Нет в наличии
294,2021-10-23,Автомагнитола Gazer CM6507-100H,5 799,Нет в наличии
295,2021-10-23,Телевизор Gazer TV43-FS2G,11 499,Нет в наличии
296,2021-10-23,Автомагнитола штатная Gazer CM6008-T5 для VW/Skoda/Seat 2008-2016,10 219,Нет в наличии
297,2021-10-23,Автомагнитола штатная Gazer CM6008-RE для Honda CRV (RE) 2006-2011,8 089,Нет в наличии
298,2021-10-23,Автомагнитола штатная Gazer CM6006-NF для Hyundai Sonata (NF) 2009-2010,19 990,Нет в наличии
299,2021-10-23,Автомагнитола штатная Gazer CM6510-UD для Hyundai Elantra (UD) 2016-2017,19 990,Нет в наличии
300,2021-10-23,"Автомагнитола штатная Gazer CM5007-1Z3 для Skoda Octavia A5, Fabia, Super b 2005-2012",14 999,Нет в наличии
301,2021-10-23,Телевизор Gazer TV32-FS2G,7 299,Нет в наличии
302,2021-10-23,Видеорегистратор Gazer F730,3 999,Нет в наличии
303,2021-10-23,Автомагнитола штатная Gazer CM5007-DZO для Renault Megane III (DZO) 2008-2016,7 419,Закончился
304,2021-10-23,Автомобильный монитор для задних пассажиров Gazer HR100,6 499,Нет в наличии
305,2021-10-23,Видеорегистратор Gazer F725,2 399,Нет в наличии
306,2021-10-23,Видеорегистратор Gazer F117,2 777,Нет в наличии
307,2021-10-23,Видеорегистратор Gazer F720,3 999,Нет в наличии
308,2021-10-23,Парковочная система Gazer PA45F (3608167),3 399,Нет в наличии
309,2021-10-23,Автомагнитола штатная Gazer CM5008-250T для Toyota Avensis 2003-2007,15 899,Нет в наличии
310,2021-10-23,Автомагнитола штатная Gazer CM5009-FS для Renault Sandero (FS) 2008-2012,13 899,Нет в наличии
311,2021-10-23,Автомагнитола штатная Gazer CM5007-A30 для Toyota RAV 4 (A30) 2006-2012,6 739,Нет в наличии
312,2021-10-23,"Автомагнитола штатная Gazer CM5509-CM для Hyundai Santa Fe (CM), 2006-2012",15 899,Нет в наличии
313,2021-10-23,Автомагнитола штатная Gazer CM6008-5E3 для Skoda Octavia A7 (5E3) 2013-2016,8 502,Нет в наличии
314,2021-10-23,Автомагнитола штатная Gazer CM5509-T5 для VW/Skoda/Seat 2008-2016,7 079,Нет в наличии
315,2021-10-23,Автомагнитола штатная Gazer CM6008-BL для Mazda 3 (BL) 2010-2014,19 990,Нет в наличии
316,2021-10-23,Автомагнитола Gazer CM5006-100D,6 399,Нет в наличии
317,2021-10-23,"Автомагнитола штатная Gazer CM6007-BA7 для Ford Mondeo (BA7), Focus (DB) 2007-2012",19 990,Нет в наличии
318,2021-10-23,"Автомагнитола штатная Gazer CM6007-L48 для Opel Astra H, Vectra C, Zafira B 2004-2009",21 990,Нет в наличии
319,2021-10-23,Автомагнитола штатная Gazer CM5008-MA для Ford Kuga (MA)-low version 2013-2017,16 999,Нет в наличии
320,2021-10-23,Автомагнитола штатная Gazer CM5008-JT для Suzuki Grand Vitara (JT) 2005-2015,12 719,Нет в наличии
321,2021-10-23,Камера заднего вида Gazer СС125,1 680,Нет в наличии
322,2021-10-23,Автомагнитола штатная Gazer CM5509-E150 для Toyota Corolla (E150) 2013-2016,15 899,Нет в наличии
323,2021-10-23,Автомагнитола штатная Gazer CM6008-CYA для Mitsubishi Lancer (CYA) 2007-2013,21 990,Нет в наличии
324,2021-10-23,Автомагнитола штатная Gazer CM6007-BM для Ford Focus (BM) 2012-2016,19 990,Нет в наличии
325,2021-10-23,Автомагнитола штатная Gazer CM6008-UD для Hyundai Elantra (UD) 2016-2017,21 990,Нет в наличии
326,2021-10-23,Автомагнитола штатная Gazer CM7010-FB4 для Honda Civic (FB4) 2016-2017,27 990,Нет в наличии
327,2021-10-23,"Автомагнитола штатная Gazer CM5006-SC11 для Nissan Tiida, Qashqai, X-Trail, Patrol",6 269,Закончился
328,2021-10-23,Автомагнитола штатная Gazer CM5007-BMO для Renault Megane (BMO) 2002-2009,15 899,Нет в наличии
329,2021-10-23,"Автомагнитола штатная Gazer CM5007-W169 для Mercedes A, B, Vito, Viano, Sprinter 2003-2012",17 899,Нет в наличии
330,2021-10-23,Автомагнитола штатная Gazer CM6008-7P5 для Volkswagen Touareg (7P5) 2010-2016,26 990,Нет в наличии
331,2021-10-23,Автомагнитола штатная Gazer CM5008-MGH для Mazda 6 (MGH) 2007-2013,15 899,Нет в наличии
332,2021-10-23,Автомагнитола штатная Gazer CM6510-XKN для Jeep Commander (XKN) 2016-2017,8 529,Нет в наличии
333,2021-10-23,Автомагнитола штатная Gazer CM5008-UD для Hyundai Elantra (UD) 2016-2017,7 109,Нет в наличии
334,2021-10-23,Автомагнитола штатная Gazer CM6510-A30 для Toyota RAV 4 (A30) 2006-2012,8 219,Нет в наличии
335,2021-10-23,Автомагнитола штатная Gazer CM5008-KHW для Mitsubishi Pajero Sport (KHW) 2008-2015,6 359,Нет в наличии
336,2021-10-23,Автомагнитола штатная Gazer CM6007-8E для AUDI A4 2002-2008,21 990,Нет в наличии
337,2021-10-23,Автомагнитола штатная Gazer CM6007-HSAM для Renault Duster (HSAM) 2010-2016,8 079,Нет в наличии
338,2021-10-23,Автомагнитола штатная Gazer CM6008-JT для Suzuki Grand Vitara (JT) 2005-2015,21 990,Нет в наличии
339,2021-10-23,Автомагнитола штатная Gazer CM6007-BMO для Renault Megane (BMO) 2002-2009,21 990,Нет в наличии
340,2021-10-23,Автомагнитола штатная Gazer CM6510-362 для VW Passat B7 (362) 2010-2014,19 990,Нет в наличии
341,2021-10-23,Автомагнитола штатная Gazer CM5006-XK для Jeep Commander (XK) 2007-2012,15 899,Нет в наличии
342,2021-10-23,Автомагнитола штатная Gazer CM5007-7L для VW Touareg (7L) 2002-2010,5 989,Нет в наличии
343,2021-10-23,"Автомагнитола штатная Gazer CM7010-BA7 для Ford Mondeo (BA7), Focus (DB) 2007-2012",10 579,Нет в наличии
344,2021-10-23,Автомагнитола штатная Gazer CM5510-ELS для Peugeot 301 2014-2017,6 899,Нет в наличии
345,2021-10-23,Автомагнитола штатная Gazer CM5510-CMF для Renault Kadjar (CMF) 2015-2017,7 099,Нет в наличии
346,2021-10-23,Автомагнитола штатная Gazer CM5509-RB для Hyundai Accent (RB) 2010-2015,6 569,Нет в наличии
347,2021-10-23,Автомагнитола штатная Gazer CM7010-WK2 для Jeep Grand Cherokee (WK2) 2011-2016,27 990,Нет в наличии
348,2021-10-23,Автомагнитола штатная Gazer CM5007-W203 для Mercedes C (W203) 2004-2007,17 899,Нет в наличии
349,2021-10-23,Автомагнитола штатная Gazer CM5007-3B для VW Passat B5 (3B) 2000-2005,12 719,Нет в наличии
350,2021-10-23,Автомагнитола штатная Gazer CM6007-W164 для Mercedes ML (W164) 2005-2013,9 679,Нет в наличии
351,2021-10-23,Автомагнитола штатная Gazer CM6510-ZD для Suzuki Swift (ZD) 2004-2010,5 229,Нет в наличии
352,2021-10-23,Пульт Gazer RC15 (5060388084301),-,Нет в наличии
353,2021-10-23,Амортизатор багажника Gazer TG-RW,2 599,Нет в наличии
354,2021-10-23,Амортизатор багажника Gazer TG-V8WS,-,Нет в наличии
355,2021-10-23,Автомагнитола штатная Gazer CM5510-J200N для Toyota LC 200 (J200N) 2016-2017,17 899,Нет в наличии
356,2021-10-23,"Автомагнитола штатная Gazer CM5009-F150 для Ford Tourneo, Transit (F150) 2013-2016",17 899,Нет в наличии
357,2021-10-23,Автомагнитола штатная Gazer CM6509-N8 для Toyota Hilux (N8) 2015-2017,19 990,Нет в наличии
358,2021-10-23,Автомагнитола штатная Gazer CM5007-W211 для Mercedes E (W211) 2002-2011,17 899,Нет в наличии
359,2021-10-23,Автомагнитола штатная Gazer CM6510-J200N для Toyota LC 200 (J200N) 2016-2017,21 500,Нет в наличии
360,2021-10-23,Автомагнитола штатная Gazer CM5509-GH для Honda HRV (GH) 2013-2017,6 569,Нет в наличии
361,2021-10-23,Автомагнитола штатная Gazer CM5007-TYT для Toyota Prado (J120) 2002-2009,15 899,Нет в наличии
362,2021-10-23,Автомагнитола штатная Gazer CM5007-ER для Mazda CX-7 (ER) 2006-2012,12 719,Нет в наличии
363,2021-10-23,"Автомагнитола штатная Gazer CM6007-W169 для Mercedes A, B, Vito, Viano, Sprinter 2003-2012",24 990,Нет в наличии
364,2021-10-23,Автомагнитола штатная Gazer CM6510-5LA для Skoda Yeti (5L) auto conditioner 2009-2013,8 499,Нет в наличии
365,2021-10-23,Автомагнитола штатная Gazer CM5008-XU40 для Toyota Highlander (XU40) 2008-2015,15 899,Нет в наличии
366,2021-10-23,Автомагнитола штатная Gazer CM6006-N5 для Toyota Hilux (N5) 2012-2015,7 999,Нет в наличии
367,2021-10-23,Автомагнитола штатная Gazer CM5008-V40 для Toyota Camry (V40) 2007-2011,15 899,Нет в наличии
368,2021-10-23,Автомагнитола штатная Gazer CM5007-E46 для BMW 3 (E46) 1998-2004,13 899,Нет в наличии
369,2021-10-23,"Автомагнитола штатная Gazer CM5509-KR0A для Renault Captur, Clio (KR0-AC) 2011-2015",6 357,Нет в наличии
370,2021-10-23,Автомагнитола штатная Gazer CM5510-UM для Kia Sorento (UM) 2015-2017,14 999,Нет в наличии
371,2021-10-23,Автомагнитола штатная Gazer CM6510-UM для Kia Sorento (UM) 2015-2017,21 990,Нет в наличии
372,2021-10-23,Автомагнитола штатная Gazer CM6007-PS17 для Kia Soul (PS17) 2014-2017,18 900,Нет в наличии
373,2021-10-23,Автомагнитола штатная Gazer CM6509-SL для Kia Sportage (SL) 2010-2015,21 990,Нет в наличии
374,2021-10-23,Автомагнитола штатная Gazer CM5510-362 для VW Passat B7 (362) 2010-2014,5 229,Нет в наличии
375,2021-10-23,Автомагнитола штатная Gazer CM5007-PS17 для Kia Soul (PS17) 2014-2017,13 899,Нет в наличии
376,2021-10-23,Автомагнитола штатная Gazer CM5008-V50 для Toyota Camry (V50) 2012-2015,15 899,Нет в наличии
