,data,Name,Price,Nal
377,2021-10-23,Автомагнитола штатная Gazer CM6510-V50 для Toyota Camry (V50) 2012-2015,21 990,Нет в наличии
378,2021-10-23,Автомагнитола штатная Gazer CM5007-JJ для Ford Fiesta (JJ) 2008-2014,12 719,Нет в наличии
379,2021-10-23,Автомагнитола штатная Gazer CM5007-GD для Hyundai i30 (GD) 2012-2016,7 099,Нет в наличии
380,2021-10-23,"Автомагнитола штатная Gazer CM5008-J11 для Nissan Qashqai, X-Trail 2013-2016",15 899,Нет в наличии
381,2021-10-23,Автомагнитола штатная Gazer CM6007-CM для Hyundai Santa Fe (CM) 2006-2012,19 300,Нет в наличии
382,2021-10-23,Автомагнитола штатная Gazer CM6007-W203 для Mercedes C (W203) 2004-2007,24 990,Нет в наличии
383,2021-10-23,"Автомагнитола штатная Gazer CM6008-J11 для Nissan Qashqai, X-Trail 2013-2016",21 990,Нет в наличии
384,2021-10-23,Автомагнитола штатная Gazer CM5007-XM10 для Kia Sorento (XM10) 2010-2012,15 899,Нет в наличии
385,2021-10-23,Автомагнитола штатная Gazer CM6008-V40F для Toyota Camry (V40) 2007-2011,19 300,Нет в наличии
386,2021-10-23,Автомагнитола штатная Gazer CM5510-V50 для Toyota Camry (V50) 2012-2015,15 899,Нет в наличии
387,2021-10-23,Автомагнитола штатная Gazer CM5008-RP для Kia Carens (FG) 2013-2017,15 899,Нет в наличии
388,2021-10-23,Автомагнитола штатная Gazer CM5007-CK для Ssang Yong Korando (CK) 2010-2013,6 979,Нет в наличии
389,2021-10-23,Автомагнитола штатная Gazer CM6510-A50 для Toyota RAV4 2019+,9 159,Нет в наличии
390,2021-10-23,Автомагнитола штатная Gazer CM6510-V70 для Toyota Camry (V70) 2018+,7 199,Нет в наличии
391,2021-10-23,Автомагнитола штатная Gazer CM6008-CKN для SsangYong Korando (CKN) 2013-2016,21 990,Нет в наличии
392,2021-10-23,Автомагнитола штатная Gazer CM5008-DM для Hyundai Santa Fe (DM) 2012-2016,15 899,Нет в наличии
393,2021-10-23,Автомагнитола штатная Gazer CM6009-J200N для Toyota LC 200 (J200N) 2016-2017,24 990,Нет в наличии
394,2021-10-23,Автомагнитола штатная Gazer CM6008-V50 для Toyota Camry (V50) 2012-2015,17 592,Нет в наличии
395,2021-10-23,Автомагнитола штатная Gazer CM5007-W220 для Mercedes S (W220) 1998-2005,17 899,Нет в наличии
396,2021-10-23,Автомагнитола штатная Gazer CM6007-3B для VW Passat B5 (3B) 2000-2005,21 990,Нет в наличии
397,2021-10-23,Автомагнитола штатная Gazer CM5007-GV10 для Toyota Venza (GV10) 2008-2016,7 119,Нет в наличии
398,2021-10-23,Автомагнитола штатная Gazer CM5007-RM4 для Honda CRV (RM4) 2012-2016,6 569,Нет в наличии
399,2021-10-23,Автомагнитола штатная Gazer CM5510-RM4 для Honda CRV (RM4) 2012-2016,6 809,Нет в наличии
400,2021-10-23,Автомагнитола штатная Gazer CM6007-ER для Mazda CX-7 (ER) 2006-2012,8 859,Нет в наличии
401,2021-10-23,Автомагнитола штатная Gazer CM5510-XU40 для Toyota Highlander (XU40) 2008-2015,7 109,Нет в наличии
402,2021-10-23,Автомагнитола штатная Gazer CM6007-DZO для Renault Megane III (DZO) 2008-2016,19 300,Нет в наличии
403,2021-10-23,Автомагнитола штатная Gazer CM5510-ZD для Suzuki Swift (ZD) 2004-2010,7 109,Нет в наличии
404,2021-10-23,Автомагнитола штатная Gazer CM6510-5N2 для VW Tiguan (5N2) 2013-2016,9 469,Нет в наличии
405,2021-10-23,Автомагнитола штатная Gazer CM5009-J200N для Toyota LC 200 (J200N) 2016-2017,8 159,Нет в наличии
406,2021-10-23,Автомагнитола штатная Gazer CM6510-5LM для Skoda Yeti (5L) manual conditioner 2009-2013,8 499,Нет в наличии
407,2021-10-23,Автомагнитола штатная Gazer CM5007-V8W для Mitsubishi Pajero (V8W) 2006-2015,7 129,Нет в наличии
408,2021-10-23,"Автомагнитола штатная Gazer CM6009-F150 для Ford Tourneo, Transit (F150) 2013-2016",9 656,Нет в наличии
409,2021-10-23,Автомагнитола штатная Gazer CM6510-L33R для Nissan Teana (L33R) 2013-2016,8 499,Нет в наличии
410,2021-10-23,Автомагнитола штатная Gazer CM5008-QL для Kia Sportage (QL) 2015-2017,7 119,Нет в наличии
411,2021-10-23,"Автомагнитола штатная Gazer CM6510-ASX10 для Mitsubishi Lancer 2007-2013, ASX 2007-2010",9 829,Нет в наличии
412,2021-10-23,Автомагнитола штатная Gazer CM6510-E150 для Toyota Corolla (E150) 2013-2016,8 669,Нет в наличии
413,2021-10-23,Автомагнитола штатная Gazer CM6007-BK для Mazda 3 (BK) 2004-2009,7 919,Нет в наличии
414,2021-10-23,Автомагнитола штатная Gazer CM6007-W220 для Mercedes S (W220) (1998-2005,9 929,Нет в наличии
415,2021-10-23,Автомагнитола штатная Gazer CM6007-JJ для Ford Fiesta (JJ) 2008-2014,21 990,Нет в наличии
416,2021-10-23,Автомагнитола штатная Gazer CM5009-XU50 для Toyota Highlander (XU50) 2015-2017,15 899,Нет в наличии
417,2021-10-23,Автомагнитола штатная Gazer CM6007-TB для Mazda CX-9 (TB) 2006-2012,19 990,Нет в наличии
418,2021-10-23,Автомагнитола штатная Gazer CM6008-QL для Kia Sportage (QL) 2015-2017,8 519,Нет в наличии
419,2021-10-23,Автомагнитола штатная Gazer CM6509-KX5 для Kia Sportage (KX5) 2018+,20 900,Нет в наличии
420,2021-10-23,Автомагнитола штатная Gazer CM6007-RE для Honda CRV (RE) 2006-2011,19 990,Нет в наличии
421,2021-10-23,Автомагнитола штатная Gazer CM6508-7P5 для VW Touareg (7P5) 2010-2016,15 440,Нет в наличии
422,2021-10-23,Автомагнитола штатная Gazer CM6510-RM4 для Honda CRV (RM4) 2012-2016,8 819,Нет в наличии
423,2021-10-23,Автомагнитола штатная Gazer CM6510-V55 для Toyota Camry (V55) 2015-2017,8 489,Нет в наличии
424,2021-10-23,Автомагнитола штатная Gazer CM7010-TL для Hyundai Tucson (TL) 2015-2017,5 299,Нет в наличии
425,2021-10-23,Автомагнитола штатная Gazer CM5008-XII для Ford F150 (XII) 2009-2014,8 099,Нет в наличии
426,2021-10-23,Автомагнитола штатная Gazer CM5007-BM для Ford Focus (BM) 2012-2016,6 329,Нет в наличии
427,2021-10-23,Автомагнитола штатная Gazer CM6510-J32 для Nissan Teana (J32) 2008-2013,19 990,Нет в наличии
428,2021-10-23,Автомагнитола штатная Gazer CM5509-SL для Kia Sportage (SL) 2010-2015,12 719,Нет в наличии
429,2021-10-23,Автомагнитола штатная Gazer CM6510-ELS для Peugeot 301 2014-2017,8 079,Нет в наличии
430,2021-10-23,Автомагнитола штатная Gazer CM6008-250T для Toyota Avensis 2003-2007,21 990,Нет в наличии
431,2021-10-23,Автомагнитола штатная Gazer CM5007-FA для Honda Civic (FA) 2006-2011,15 899,Нет в наличии
432,2021-10-23,Автомагнитола штатная Gazer CM5510-BE1 для VW Golf VII (BE1) 2014-2017,7 099,Нет в наличии
433,2021-10-23,Автомагнитола штатная Gazer CM6006-CM для Hyundai Santa Fe (CM) 2006-2012,7 869,Нет в наличии
434,2021-10-23,Автомагнитола штатная Gazer CM6510-A40 для Toyota RAV 4 (A40) 2013-2016,7 999,Нет в наличии
435,2021-10-23,Автомагнитола штатная Gazer CM6509-E140 для Toyota Corolla (E140) 2006-2012,8 489,Нет в наличии
436,2021-10-23,"Автомагнитола штатная Gazer CM5510-100U для Nissan Qashqai, X-Trail 2013-2016",9 199,Нет в наличии
437,2021-10-23,Автомагнитола штатная Gazer CM5008-GFW для Mitsubishi Outlander (GFW) 2014-2017,6 359,Нет в наличии
438,2021-10-23,Автомагнитола штатная Gazer CM6509-TYT для Toyota Prado (J120) 2002-2009,8 379,Нет в наличии
439,2021-10-23,"Автомагнитола штатная Gazer CM5510-J11 для Nissan Qashqai, X-Trail 2013-2016",14 999,Нет в наличии
440,2021-10-23,Автомагнитола штатная Gazer CM5008-CKN для Ssang Yong Korando (CKN) 2013-2016,6 689,Нет в наличии
441,2021-10-23,Автомагнитола штатная Gazer CM6509-SJ для Subaru Forester (SJ) 2013-2014,8 499,Нет в наличии
442,2021-10-23,"Автомагнитола штатная Gazer CM6007-GAB для SsangYong Actyon, Kyron, Korando 2005-2010",21 990,Нет в наличии
443,2021-10-23,"Автомагнитола штатная Gazer CM6510-J11 для Nissan Qashqai, X-Trail 2013-2016",21 990,Нет в наличии
444,2021-10-23,GPS навигатор Gazer ACG230W,999,Нет в наличии
