,data,Name,Price,Nal
0,2021-10-23,Автомагнитола Gazer CM6006-100D 2-DIN,5 699,Есть в наличии
1,2021-10-23,Видеорегистратор Gazer F125 (3694553),2 999,Есть в наличии
2,2021-10-23,Автомагнитола Gazer CM5507-100H,4 199,Есть в наличии
3,2021-10-23,Парковочная система Gazer CKR4400,7 680,Есть в наличии
4,2021-10-23,Автомагнитола Gazer CM6507-100S,3 799,Заканчивается
5,2021-10-23,Автомагнитола Gazer CM6507-100F,5 599,Заканчивается
6,2021-10-23,Телевизор Gazer TV32-HS2G,7 999,Есть в наличии
7,2021-10-23,Камера заднего вида Gazer СС100,1 399,Заканчивается
8,2021-10-23,Видеорегистратор Gazer MUW7000,8 999,Есть в наличии
9,2021-10-23,Автомагнитола штатная Gazer CM5008-MA для Ford Kuga (MA)-low version 2013-2017 (EC604024) - Уценка,11 684,Есть в наличии
10,2021-10-23,Автомагнитола штатная Gazer CM5509-E150 для Toyota Corolla (E150) 2013-2016 (FW519822) - Уценка,4 680,Есть в наличии
11,2021-10-23,"Автомагнитола штатная Gazer CM5509-CM для Hyundai Santa Fe (CM), 2006-2012 (CM5509CM2642472706) - Уценка",5 309,Есть в наличии
12,2021-10-23,Автомагнитола штатная Gazer CM6509-QL для Kia Sportage (QL) 2015-2017 (CM6509QL3417793581) - Уценка,15 699,Есть в наличии
13,2021-10-23,Автомагнитола Gazer CM6006-100D 2-DIN (CM6006100D1737519126) - Уценка,4 822,Есть в наличии
14,2021-10-23,Телевизор Gazer TV40-FS2G,10 499,Есть в наличии
15,2021-10-23,Видеорегистратор Gazer F118 (2758080),2 199,Есть в наличии
16,2021-10-23,Парковочная система Gazer PA40R,2 899,Есть в наличии
17,2021-10-23,Автомагнитола штатная Gazer CM6008-DM для Hyundai Santa Fe (DM) 2012-2016,8 119,Есть в наличии
18,2021-10-23,"Внутренняя, выносная камера Gazer CF730-IN для видеорегистратора Gazer F730",1 499,Есть в наличии
19,2021-10-23,Видеорегистратор Gazer F750w,9 999,Есть в наличии
20,2021-10-23,Телевизор Gazer TV49-US2G,16 499,Есть в наличии
21,2021-10-23,Телевизор Gazer TV24-HS2G,6 899,Есть в наличии
22,2021-10-23,Камера заднего вида Gazer СС207,1 599,Есть в наличии
23,2021-10-23,Автомагнитола штатная Gazer CM6007-7L для VW Touareg (7L) 2002-2010,8 979,Есть в наличии
24,2021-10-23,"Автомагнитола штатная Gazer CM6509-CM для Hyundai Santa Fe (CM), 2006-2012",8 839,Есть в наличии
25,2021-10-23,Парковочная система Gazer PA45R,3 399,Есть в наличии
26,2021-10-23,Автомагнитола штатная Gazer CM5008-RE для Honda CRV (RE) 2006-2011,6 719,Есть в наличии
27,2021-10-23,"Автомагнитола штатная Gazer CM6510-J150H/L для Toyota Prado, LC150-High/Low level",8 939,Есть в наличии
28,2021-10-23,Телевизор Gazer TV55-US2G,18 999,Есть в наличии
29,2021-10-23,Автомагнитола штатная Gazer CM5007-HSAM для Renault Duster (HSAM) 2010-2016,7 089,Есть в наличии
30,2021-10-23,Видеорегистратор Gazer F155,5 999,Есть в наличии
31,2021-10-23,Автомагнитола штатная Gazer CM5509-YF для Hyundai Sonata (YF) 2010-2015,6 659,Есть в наличии
32,2021-10-23,Автомагнитола штатная Gazer CM5510-UD для Hyundai Elantra (UD) 2016-2017,6 939,Есть в наличии
33,2021-10-23,Автомагнитола штатная Gazer CM6510-FA для Honda Civic (FA) 2006-2011,8 509,Есть в наличии
34,2021-10-23,Автомагнитола штатная Gazer CM6509-RE для Honda CR-V (RE) 2006-2011,21 990,Есть в наличии
35,2021-10-23,Система контроля слепых зон Gazer BA500,15 999,Есть в наличии
36,2021-10-23,Автомагнитола штатная Gazer CM5008-5E3 для Skoda Octavia A7 (5E3) 2013-2016,7 669,Есть в наличии
37,2021-10-23,"Автомагнитола штатная Gazer CM5007-L48 для Opel Astra H, Vectra C, Zafira B 2004-2009",7 109,Есть в наличии
38,2021-10-23,Видеорегистратор Gazer MUW5000,5 999,Есть в наличии
39,2021-10-23,"Автомагнитола штатная Gazer CM7012-J11 для Nissan Qashqai, X-Trail 2013-2016",10 209,Есть в наличии
40,2021-10-23,Автомагнитола штатная Gazer CM5006-TQ для Hyundai H1 (TQ) 2007-2012,6 589,Есть в наличии
41,2021-10-23,Автомагнитола штатная Gazer CM6006-GFW для Mitsubishi Outlander (GFW),8 489,Есть в наличии
42,2021-10-23,Автомагнитола штатная Gazer CM5507-TB для Mazda CX-9 (TB) 2006-2012,7 409,Есть в наличии
43,2021-10-23,Камера заднего вида Gazer CC150 (3694057),1 899,Есть в наличии
44,2021-10-23,Автомагнитола штатная Gazer CM5007-408W для Peugeot 408 2010-2013,7 089,Есть в наличии
45,2021-10-23,"Автомагнитола штатная Gazer CM6007-1Z3 для Skoda Octavia A5, Fabia, Super b 2005-2012",8 859,Есть в наличии
46,2021-10-23,Автомагнитола штатная Gazer CM5509-GV для Suzuki Grand Vitara (GV) 2015-2017,7 399,Есть в наличии
47,2021-10-23,Автомагнитола штатная Gazer CM6509-T5 для VW/Skoda/Seat 2008-2016,8 839,Есть в наличии
48,2021-10-23,Автомагнитола штатная Gazer CM5007-W164 для Mercedes ML (W164) 2005-2013,16 999,Есть в наличии
49,2021-10-23,Автомагнитола штатная Gazer CM6510-E21 для Toyota Corolla E21 2020,7 679,Есть в наличии
50,2021-10-23,Автомагнитола штатная Gazer CM6007-E46 для BMW 3 (E46) 1998-2004,19 990,Есть в наличии
51,2021-10-23,Автомагнитола штатная Gazer CM6509-FB4 для Honda Civic (FB4) 2016-2017,8 069,Есть в наличии
52,2021-10-23,"Автомагнитола штатная Gazer CM6006-SC11 для Nissan Tiida, Qashqai, X-Trail, Patrol",7 669,Есть в наличии
53,2021-10-23,Автомагнитола штатная Gazer CM6009-FS для Renault Sandero (FS) 2008-2012,8 849,Есть в наличии
54,2021-10-23,Автомагнитола штатная Gazer CM7012-BE для Ford Mondeo (BE) 2014-2017,10 199,Есть в наличии
55,2021-10-23,Автомагнитола штатная Gazer CM5510-5LM для Skoda Yeti (5L) manual conditioner 2009-2013,7 399,Есть в наличии
56,2021-10-23,Автомагнитола штатная Gazer CM5510-GFW для Mitsubishi Outlander (GFW) 2014-2017,7 459,Есть в наличии
57,2021-10-23,"Автомагнитола штатная Gazer CM5007-W163 для Mercedes A (W168), C (W203), E (W210), CLK(W209)",8 099,Есть в наличии
58,2021-10-23,Автомагнитола штатная Gazer CM6509-GV для Suzuki Grand Vitara (GV) 2015-2017,8 849,Есть в наличии
59,2021-10-23,Автомагнитола штатная Gazer CM6509-V40F для Toyota Camry (V40) 2007-2011,8 349,Есть в наличии
60,2021-10-23,Автомагнитола штатная Gazer CM6008-NK3 для Skoda Rapid (NK3) 2013-2016,9 499,Есть в наличии
61,2021-10-23,Автомагнитола штатная Gazer CM6510-5E3 для Skoda Octavia A7 (5E3) 2013-2016,8 839,Есть в наличии
62,2021-10-23,Автомагнитола штатная Gazer CM6006-120 для Toyota Universal 2001-2012,7 449,Есть в наличии
63,2021-10-23,Автомагнитола штатная Gazer CM5006-120F для Toyota Universal 2001-2012,6 289,Есть в наличии
64,2021-10-23,Автомагнитола штатная Gazer CM5510-TL для Hyundai Tucson (TL) 2015-2017,7 059,Есть в наличии
65,2021-10-23,Автомагнитола штатная Gazer CM7012-J200 для Toyota LC 200 (J200) 2007-2015,10 149,Есть в наличии
66,2021-10-23,Автомагнитола штатная Gazer CM6008-V40 для Toyota Camry (V40) 2007-2011,8 839,Есть в наличии
67,2021-10-23,Автомагнитола штатная Gazer CM5007-C6 для Audi A6 (C5) 1997-2004,5 929,Есть в наличии
68,2021-10-23,"Автомагнитола штатная Gazer CM6007-DB для Ford Focus, Mondeo, Connect, S-Max 2004-2010",8 329,Есть в наличии
69,2021-10-23,"Автомагнитола штатная Gazer CM6007-B14 для Subaru Outback (B14, Legacy) 2008-2014",7 979,Есть в наличии
70,2021-10-23,"Автомагнитола штатная Gazer CM5510-ASX10 для Mitsubishi Lancer 2007-2013, ASX 2007-2010",15 899,Есть в наличии
71,2021-10-23,Автомагнитола штатная Gazer CM5007-E180 для Toyota Auris (E180) 2006-2012,14 999,Есть в наличии
72,2021-10-23,Автомагнитола штатная Gazer CM5007-ED для Kia Ceed (ED) 2007-2012,6 669,Есть в наличии
73,2021-10-23,Автомагнитола штатная Gazer CM6509-RB для Hyundai Accent (RB) 2010-2015,7 959,Есть в наличии
74,2021-10-23,Автомагнитола штатная Gazer CM5008-BL для Mazda 3 (BL) 2010-2014,6 919,Есть в наличии
75,2021-10-23,Автомагнитола штатная Gazer CM7012-V55 для Toyota Camry (V55) 2015-2017,9 859,Есть в наличии
76,2021-10-23,Автомагнитола штатная Gazer CM6507-TB для Mazda CX-9 (TB) 2006-2012,8 899,Есть в наличии
77,2021-10-23,Автомагнитола штатная Gazer CM6510-614 для VW Polo (614) 2016-2017,8 559,Есть в наличии
78,2021-10-23,Автомагнитола штатная Gazer CM5006-NF для Hyundai Sonata (NF) 2009-2010,5 949,Есть в наличии
79,2021-10-23,Автомагнитола штатная Gazer CM6509-KE для Mazda CX-5 (KE) 2012-2016,8 169,Есть в наличии
80,2021-10-23,Автомагнитола штатная Gazer CM6007-ED для Kia Ceed (ED) 2007-2012,19 300,Есть в наличии
81,2021-10-23,Автомагнитола штатная Gazer CM5007-RB для Hyundai Accent (RB) 2010-2015,5 999,Есть в наличии
82,2021-10-23,"Автомагнитола штатная Gazer CM6509-E39 для BMW 5 (E39), X5 (E53), 1996-2004",8 779,Есть в наличии
83,2021-10-23,Автомагнитола штатная Gazer CM5009-BK для Ford Focus (BK) 2015-2017,7 139,Есть в наличии
84,2021-10-23,Амортизатор багажника Gazer TG-QL,25 999,Есть в наличии
85,2021-10-23,Автомагнитола штатная Gazer CM5007-K14 для Nissan Micra 2017+,5 929,Есть в наличии
86,2021-10-23,Автомагнитола штатная Gazer CM7012-J150 для Toyota Prado (J150) 2010-2013,9 819,Есть в наличии
87,2021-10-23,Автомагнитола штатная Gazer CM6509-S13 для Subaru Forester (S13) 2015-2017,8 269,Есть в наличии
88,2021-10-23,Автомагнитола штатная Gazer CM6007-XK для Jeep Commander (XK) 2007-2012,8 169,Есть в наличии
89,2021-10-23,Автомагнитола штатная Gazer CM6007-W211 для Mercedes E (W211) 2002-2011,9 959,Есть в наличии
90,2021-10-23,Автомагнитола штатная Gazer CM6510-TL для Hyundai Tucson (TL) 2015-2017,8 479,Есть в наличии
91,2021-10-23,Автомагнитола штатная Gazer CM5509-ER для Mazda CX-7 (ER) 2006-2012,7 019,Есть в наличии
92,2021-10-23,Автомагнитола штатная Gazer CM5510-5LA для Skoda Yeti (5L) auto conditioner 2009-2013,7 099,Есть в наличии
93,2021-10-23,Автомагнитола штатная Gazer CM5510-5N2 для VW Tiguan (5N2) 2013-2016,6 459,Есть в наличии
94,2021-10-23,Автомагнитола штатная Gazer CM6510-AD1 для VW Tiguan (AD1) 2016-2017,8 479,Есть в наличии
95,2021-10-23,Автомагнитола штатная Gazer CM5006-GFW для Mitsubishi Outlander (GFW),7 089,Есть в наличии
96,2021-10-23,Автомагнитола штатная Gazer CM6508-7P6 для VW Touareg only instead RCD550 (7P6) 2016-2017,10 489,Есть в наличии
97,2021-10-23,Автомагнитола штатная Gazer CM6007-408W для Peugeot 408 2010-2013,8 489,Есть в наличии
98,2021-10-23,"Автомагнитола штатная Gazer CM5007-T200 для Chevrolet Epica, Captiva, Aveo 2002-2011",7 069,Есть в наличии
99,2021-10-23,Автомагнитола штатная Gazer CM5509-CW6 для Mitsubishi Outlander XL (CW) 2006-2012,6 689,Есть в наличии
100,2021-10-23,Автомагнитола штатная Gazer CM6007-FA для Honda Civic (FA) 2006-2011,8 859,Есть в наличии
101,2021-10-23,Автомагнитола штатная Gazer CM6007-E180 для Toyota Auris (E180) 2006-2012,8 849,Есть в наличии
102,2021-10-23,Автомагнитола штатная Gazer CM5510-A30 для Toyota RAV4 (A30) 2006-2012,7 399,Есть в наличии
103,2021-10-23,Автомагнитола штатная Gazer CM6007-ZCS для Suzuki Swift (ZCS) 2011-2016,8 499,Есть в наличии
104,2021-10-23,Автомагнитола штатная Gazer CM5006-PB для Hyundai i20 (PB) 2008-2013,6 089,Есть в наличии
105,2021-10-23,"Автомагнитола штатная Gazer CM5007-E39 для BMW 5 (E39), X5 (E53) 1996-2004",8 089,Есть в наличии
106,2021-10-23,Автомагнитола штатная Gazer CM5008-NK3 для Skoda Rapid (NK3) 2013-2016,6 319,Есть в наличии
107,2021-10-23,Автомагнитола штатная Gazer CM6508-MGH для Mazda 6 (MGH) 2007-2013,21 990,Есть в наличии
108,2021-10-23,"Автомагнитола штатная Gazer CM6007-T200 для Chevrolet Epica, Captiva, Aveo 2002-2011",7 959,Есть в наличии
109,2021-10-23,Автомагнитола штатная Gazer CM7010-MD для Hyundai Elantra (MD) 2011-2016,10 589,Есть в наличии
110,2021-10-23,"Автомагнитола штатная Gazer CM5507-QV для Kia Mohave (QV), 2007-2012",7 409,Есть в наличии
111,2021-10-23,"Автомагнитола штатная Gazer CM5007-JU для Ford Fuison, Explorer, Mustang, Edge, Escape II",7 089,Есть в наличии
112,2021-10-23,Автомагнитола штатная Gazer CM7010-BE1 для VW Golf VII (BE1) 2014-2017,10 119,Есть в наличии
113,2021-10-23,Автомагнитола штатная Gazer CM5509-S13 для Subaru Forester (S13) 2015-2017,7 099,Есть в наличии
114,2021-10-23,Автомагнитола штатная Gazer CM6509-EL для Hyundai IX35 (EL) 2010-2015,8 379,Есть в наличии
115,2021-10-23,Автомагнитола штатная Gazer CM6008-JD для Kia Ceed (JD) 2011-2017,8 519,Есть в наличии
116,2021-10-23,Автомагнитола штатная Gazer CM5510-MA для Ford Kuga (MA)-low version 2013-2017,6 899,Есть в наличии
117,2021-10-23,Автомагнитола штатная Gazer CM6008-3G2 для VW Passat B8 (3G2) 2014-2017,8 519,Есть в наличии
118,2021-10-23,Автомагнитола штатная Gazer CM5008-T300 для Chevrolet Aveo 2011-2016,7 109,Есть в наличии
119,2021-10-23,Автомагнитола штатная Gazer CM6008-V50USA для Toyota Camry (V50-USA) 2012-2015,8 329,Есть в наличии
120,2021-10-23,Автомагнитола штатная Gazer CM6007-GD для Hyundai i30 (GD) 2012-2016,8 479,Есть в наличии
121,2021-10-23,Автомагнитола штатная Gazer CM6509-UB для Kia Rio (UB) 2012-2015,13 920,Есть в наличии
122,2021-10-23,Автомагнитола штатная Gazer CM5510-5E3 для Skoda Octavia A7 (5E3) 2013-2016,12 719,Есть в наличии
123,2021-10-23,Автомагнитола штатная Gazer CM5007-BK для Mazda 3 (BK) 2004-2009,7 109,Есть в наличии
124,2021-10-23,Автомагнитола штатная Gazer CM6007-RB для Hyundai Accent (RB) 2010-2015,7 999,Есть в наличии
125,2021-10-23,Автомагнитола штатная Gazer CM5509-EL для Hyundai IX35 (EL) 2010-2015,7 099,Есть в наличии
126,2021-10-23,Автомагнитола штатная Gazer CM6008-B1 для Opel Corsa E (B1) 2014-2017,19 990,Есть в наличии
127,2021-10-23,Автомагнитола штатная Gazer CM6007-K14 для Nissan Micra 2017+,7 199,Есть в наличии
128,2021-10-23,Автомагнитола штатная Gazer CM5509-GS для Opel Astra (K) 2014-2017,7 069,Есть в наличии
129,2021-10-23,Автомагнитола штатная Gazer CM5008-XW50 для Toyota Prius (XW50) 2014-2017,7 109,Есть в наличии
130,2021-10-23,Автомагнитола штатная Gazer CM6510-BE1 для VW Golf VII (BE1) 2014-2017,8 509,Есть в наличии
131,2021-10-23,Автомагнитола штатная Gazer CM5510-V55 для Toyota Camry (V55) 2015-2017,7 099,Есть в наличии
132,2021-10-23,Автомагнитола штатная Gazer CM6510-YD для Kia Cereato (YD) 2015-2017,8 489,Есть в наличии
133,2021-10-23,Автомагнитола штатная Gazer CM6006-L10 для Nissan Livina (L10) 2013-2016,7 679,Есть в наличии
134,2021-10-23,"Автомагнитола штатная Gazer CM5006-M11 для Chery A3 (M11 A5, Tiggo (T11) 2005-2014",6 269,Есть в наличии
135,2021-10-23,Автомагнитола штатная Gazer CM5007-ZCS для Suzuki Swift (ZCS) 2011-2016,7 089,Есть в наличии
136,2021-10-23,Автомагнитола штатная Gazer CM5508-7P6 для VW Touareg only instead RCD550 (7P6) 2016-2017,9 139,Есть в наличии
137,2021-10-23,Автомагнитола штатная Gazer CM5008-3G2 для VW Passat B8 (3G2) 2014-2017,7 119,Есть в наличии
138,2021-10-23,Автомагнитола штатная Gazer CM7012-J200N для Toyota LC 200 (J200N) 2016-2017,9 769,Есть в наличии
139,2021-10-23,Автомагнитола штатная Gazer CM6008-UM для Kia Sorento (UM) 2015-2017,8 239,Есть в наличии
140,2021-10-23,Автомагнитола штатная Gazer CM5006-CM для Hyundai Santa Fe (CM) 2006-2012,7 069,Есть в наличии
141,2021-10-23,Автомагнитола штатная Gazer CM6509-QL для Kia Sportage (QL) 2015-2017,8 629,Есть в наличии
142,2021-10-23,"Автомагнитола штатная Gazer CM5007-DB для Ford Focus, Mondeo, Connect, S-Max 2004-2010",6 869,Есть в наличии
143,2021-10-23,"Автомагнитола штатная Gazer CM6007-W163 для Mercedes A (W168), C (W203), E (W210), CLK(W209)",9 899,Есть в наличии
144,2021-10-23,Автомагнитола штатная Gazer CM5008-TF для Kia Optima (TF) 2010-2015,7 429,Есть в наличии
145,2021-10-23,Автомагнитола штатная Gazer CM5007-E140 для Toyota Corolla (E140) 2006-2012,6 449,Есть в наличии
146,2021-10-23,Автомагнитола штатная Gazer CM6007-RM4 для Honda CRV (RM4) 2012-2016,7 509,Есть в наличии
147,2021-10-23,Автомагнитола штатная Gazer CM5508-CYA для Mitsubishi Lancer (CYA) 2007-2013,7 399,Есть в наличии
148,2021-10-23,Автомагнитола штатная Gazer CM6007-V8W для Mitsubishi Pajero (V8W) 2006-2015,8 539,Есть в наличии
149,2021-10-23,Автомагнитола штатная Gazer CM6510-MK49 для Jeep Compass (MK49) 2007-2016,8 859,Есть в наличии
150,2021-10-23,Амортизатор багажника Gazer TG-UZ,25 999,Есть в наличии
151,2021-10-23,Амортизатор багажника Gazer TG-W213,25 999,Есть в наличии
152,2021-10-23,Амортизатор багажника Gazer TG-DZ,25 999,Есть в наличии
153,2021-10-23,Автомагнитола штатная Gazer CM5509-RE для Honda CR-V (RE) 2006-2011,6 609,Есть в наличии
154,2021-10-23,"Автомагнитола штатная Gazer CM6007-E39 для BMW 5 (E39), X5 (E53) 1996-2004",9 169,Есть в наличии
155,2021-10-23,Автомагнитола штатная Gazer CM5006-BF3 для BYD F3 2007-2012,7 059,Есть в наличии
156,2021-10-23,Автомагнитола штатная Gazer CM5510-614 для VW Polo (614) 2016-2017,7 159,Есть в наличии
157,2021-10-23,Автомагнитола штатная Gazer CM6008-J200 для Toyota LC 200 (J200) 2007-2015,8 579,Есть в наличии
158,2021-10-23,"Автомагнитола штатная Gazer CM5007-BA7 для Ford Mondeo (BA7), Focus (DB) 2007-2012",7 399,Есть в наличии
159,2021-10-23,Автомагнитола штатная Gazer CM6006-TQ для Hyundai H1 (TQ) 2007-2012,8 479,Есть в наличии
160,2021-10-23,Автомагнитола штатная Gazer CM6510-XU40 для Toyota Highlander (XU40) 2008-2015,8 839,Есть в наличии
161,2021-10-23,Автомагнитола штатная Gazer CM6007-BA для Hyundai i10 (BA) 2013-2016,8 509,Есть в наличии
162,2021-10-23,Автомагнитола штатная Gazer CM5510-J150N для Toyota Land Cruiser Prado (J150N) 2017- 2020,8 329,Есть в наличии
163,2021-10-23,Автомагнитола штатная Gazer CM5007-8J для AUDI TT 2006-2011,7 059,Есть в наличии
164,2021-10-23,Автомагнитола штатная Gazer CM7012-U387 для Ford Edge (U387) 2015-2017,10 869,Есть в наличии
165,2021-10-23,Автомагнитола штатная Gazer CM6510-Z52R для Nissan Murano (Z52R) 2015-2017,8 489,Есть в наличии
166,2021-10-23,Автомагнитола штатная Gazer CM6509-TF для Kia Optima (TF) 2010-2015,8 469,Есть в наличии
167,2021-10-23,Автомагнитола штатная Gazer CM5510-MK49 для Jeep Compass (MK49) 2007-2016,7 409,Есть в наличии
168,2021-10-23,Автомагнитола штатная Gazer CM6509-RW для Honda CRV 2017+,7 879,Есть в наличии
169,2021-10-23,Автомагнитола штатная Gazer CM6509-YF для Hyundai Sonata (YF) 2010-2015,8 099,Есть в наличии
170,2021-10-23,Автомагнитола штатная Gazer CM6508-Y62 для Nissan Patrol (Y62) 2010-2015,9 539,Есть в наличии
171,2021-10-23,Автомагнитола штатная Gazer CM6509-P170 для Toyota Yaris (P170) 2016-2017,8 509,Есть в наличии
172,2021-10-23,Автомагнитола штатная Gazer CM6007-E150 для Toyota Corolla (E150) 2013-2016,8 499,Есть в наличии
173,2021-10-23,Автомагнитола штатная Gazer CM5509-FB4 для Honda Civic (FB4) 2016-2017,7 059,Есть в наличии
174,2021-10-23,Автомагнитола штатная Gazer CM6510-5T1 для VW Touran (5T1) 2016-2017,8 589,Есть в наличии
175,2021-10-23,Автомагнитола штатная Gazer CM5510-AD1 для VW Tiguan (AD1) 2016-2017,7 079,Есть в наличии
176,2021-10-23,"Автомагнитола штатная Gazer CM6509-KR0A для Renault Captur, Clio (KR0-AC) 2011-2015",8 859,Есть в наличии
177,2021-10-23,Автомагнитола штатная Gazer CM6510-CMF для Renault Kadjar (CMF) 2015-2017,8 559,Есть в наличии
178,2021-10-23,Автомагнитола штатная Gazer CM6008-T300 для Chevrolet Aveo (T300) 2011-2016,8 499,Есть в наличии
179,2021-10-23,Автомагнитола штатная Gazer CM5509-KE для Mazda CX-5 (KE) 2012-2016,6 619,Есть в наличии
180,2021-10-23,Автомагнитола штатная Gazer CM6510-3G2 для VW Passat B8 (3G2) 2014-2017,8 859,Есть в наличии
181,2021-10-23,"Автомагнитола штатная Gazer CM6007-JUF для Ford Fuison, Explorer, Mustang, Edge, Escape II",8 479,Есть в наличии
182,2021-10-23,Автомагнитола штатная Gazer CM5008-UB15 для Kia Rio (UB15) 2015-2017,7 439,Есть в наличии
183,2021-10-23,Автомагнитола штатная Gazer CM6008-A40 для Toyota RAV 4 (A40) 2013-2016,8 269,Есть в наличии
184,2021-10-23,Автомагнитола штатная Gazer CM6509-GS для Opel Astra (K) 2014-2017,8 469,Есть в наличии
185,2021-10-23,Автомагнитола штатная Gazer CM5008-VST для Lada Vesta 2015-2017,6 269,Есть в наличии
