,Date,Name,Price,Nal
272,16:03_24-11-2021, Gazer Hyundai i30 (GD) (2012-2016) (CM6007-GD),19990,нет в наличии
273,16:03_24-11-2021, Gazer Chevrolet Aveo (T300) (2011-2016) (CM6008-T300),8499,нет в наличии
274,16:03_24-11-2021,Null,-,-
275,16:03_24-11-2021, Gazer Mitsubishi Outlander (GFW) (20 14-2017) (CM5008-GFW),15899,нет в наличии
276,16:03_24-11-2021, Gazer ММ-система Gazer Fiat Doblo (152) (2009-2014) (CM5006-152),13899,нет в наличии
277,16:03_24-11-2021, Gazer СM6509-E39,24990,нет в наличии
278,16:03_24-11-2021, Gazer Skoda Rapid (NK3) (2013-2016) (CM6008-NK3),9499,нет в наличии
279,16:03_24-11-2021, Gazer VW/Skoda/Seat (2008-2016) (CM6008-T5),21990,нет в наличии
280,16:03_24-11-2021, Gazer VW/Skoda/Seat (2008-2016) (CM5509-T5),15288,нет в наличии
281,16:03_24-11-2021, Gazer Mitsubishi Pajero (V8W) (2006- 2015) (CM6007-V8W),17592,нет в наличии
282,16:03_24-11-2021," Gazer Subaru Outback (B14), Legacy ( 2008-2014) (CM6007-B14)",21990,нет в наличии
283,16:03_24-11-2021, Gazer CM5510-CR,6609,нет в наличии
284,16:03_24-11-2021, к фото/видео Gazer Gazer AB302 (AB302),205,нет в наличии
285,16:03_24-11-2021, Gazer CM5007-C6,15899,нет в наличии
286,16:03_24-11-2021,Парктроник Gazer PA45F,3399,нет в наличии
287,16:03_24-11-2021, Gazer F730,4058,нет в наличии
288,16:03_24-11-2021," Gazer Chevrolet Cruze (J300), Lacett i, (2008-2012) (CM6007-J300)",8129,нет в наличии
289,16:03_24-11-2021, Gazer Kia Sorento (UM) (2015-2017) (CM5008-UM),7099,нет в наличии
290,16:03_24-11-2021," Gazer ММ-система Gazer Opel Astra H, Vectra C, Zafira B (2004-2009 (CM5007-L48)",15230,нет в наличии
291,16:03_24-11-2021, Gazer Hyundai Elantra (MD) (2011-2016) (CM6007-MD),19990,нет в наличии
292,16:03_24-11-2021, Gazer ММ-система Gazer Hyundai i30 (GD) (2012-2016) (CM5007-GD),13899,нет в наличии
293,16:03_24-11-2021, Gazer Skoda Fabia (NJ) (2015-2017) (CM5509-NJ),7069,нет в наличии
294,16:03_24-11-2021," Gazer Chery A3 (M11) A5, Tiggo (T11) (2005-2014) (CM5006-M11)",6269,нет в наличии
295,16:03_24-11-2021, Gazer Toyota Venza (GV10) (2008-2016) (CM6007-GV10),21990,нет в наличии
296,16:03_24-11-2021, Gazer Kia Optima (TF) (2010-2015) (CM6509-TF),8469,нет в наличии
297,16:03_24-11-2021, Gazer Nissan Teana (J32) (2008-2013) (CM6510-J32),19990,нет в наличии
298,16:03_24-11-2021, Gazer Toyota LC 200 (J200) (2007-2015) (CM6008-J200),8579,нет в наличии
299,16:03_24-11-2021,Null,-,-
300,16:03_24-11-2021, Gazer Toyota Prado (J120) (2002-2009) (CM6509-TYT),19990,нет в наличии
301,16:03_24-11-2021, Gazer ММ-система Gazer Fiat Doblo (263) (2015-2017) (CM5007-263),15899,нет в наличии
302,16:03_24-11-2021, Gazer Hyundai Sonata (YF) (2010-2015) (CM6509-YF),21990,нет в наличии
303,16:03_24-11-2021, Gazer Universal 6.95 Full touch - 178x100 (CM6507-100F),13000,нет в наличии
304,16:03_24-11-2021, Gazer VW Passat B7 (362) (2010-2014) (CM6510-362),19990,нет в наличии
305,16:03_24-11-2021, Gazer CM6509-RW,21990,нет в наличии
306,16:03_24-11-2021, Gazer TV65-US2G,26999,нет в наличии
307,16:03_24-11-2021, Gazer Ford Focus (BK) (2015-2017) (CM6009-BK),19990,нет в наличии
308,16:03_24-11-2021, Gazer ММ-система Gazer Hyundai Sonata (NF) (2009-2010 ) (CM5006-NF),5949,нет в наличии
309,16:03_24-11-2021, Gazer VW Tiguan (5N2) (2013-2016) (CM5510-5N2),13899,нет в наличии
310,16:03_24-11-2021, Gazer CM5508-CYA CM5508-CYA (CM5508-CYA),17027,нет в наличии
311,16:03_24-11-2021, Gazer ММ-система Gazer Mazda CX-9 (TB) (2006-2012) (CM5007-TB),7099,нет в наличии
312,16:03_24-11-2021, Gazer Renault Sandero (FS) (2008-2012) (CM5009-FS),7130,нет в наличии
313,16:03_24-11-2021, Gazer F117,2777,нет в наличии
314,16:03_24-11-2021, Gazer Kia Picanto (TA) (2011-2017) (CM6007-TA),7689,нет в наличии
315,16:03_24-11-2021, Gazer Mitsubishi Pajero Sport (KHW) (2008-2015) (CM6509-KHW),19990,нет в наличии
316,16:03_24-11-2021, Gazer ММ-система Gazer Renault Megane III (DZO) (2008 -2016) (CM5007-DZO),14999,нет в наличии
317,16:03_24-11-2021, Gazer Subaru Forester (S13) (2015-2017) (CM5509-S13),13899,нет в наличии
318,16:03_24-11-2021, Gazer Hyundai Elantra (UD) (2016-2017) (CM5510-UD),13899,нет в наличии
319,16:03_24-11-2021, Gazer Toyota Corolla (E150) (2013-2016) (CM5509-E150),15899,нет в наличии
320,16:03_24-11-2021,GPS-модуль Gazer ACG230W,999,нет в наличии
321,16:03_24-11-2021, Gazer Chevrolet Malibu (V350) (2013- 2016) (CM5008-V350),13899,нет в наличии
322,16:03_24-11-2021," Gazer ММ-система Gazer Ford Mondeo (BA7), Focus (DB) (2007-2012) (CM5007-BA7)",13899,нет в наличии
323,16:03_24-11-2021, Gazer Toyota Corolla (E150) (2013-2016) (CM5009-E150),15899,нет в наличии
324,16:03_24-11-2021,Null,-,-
325,16:03_24-11-2021, Gazer S514,907,нет в наличии
326,16:03_24-11-2021," Gazer Ford Mondeo (BA7), Focus (DB) (2007-2012) (CM6007-BA7)",19990,нет в наличии
327,16:03_24-11-2021, Gazer Jeep Compass (MK49) (2007-2016) (CM6510-MK49),20900,нет в наличии
328,16:03_24-11-2021, Gazer VW/Skoda/Seat (2008-2016) (CM6509-T5),21990,нет в наличии
329,16:03_24-11-2021, Gazer CM6509-CW6,21990,нет в наличии
330,16:03_24-11-2021, Gazer ММ-система Gazer Universal 6.2 - 170x96 (CM5006-100D),9590,нет в наличии
331,16:03_24-11-2021, Gazer Honda HRV (GH) (2013-2017) (CM6509-GH),17300,нет в наличии
332,16:03_24-11-2021, Gazer Hyundai Sonata (YF) (2010-2015) (CM7015-YF),22392,нет в наличии
333,16:03_24-11-2021, Gazer H521,1339,нет в наличии
334,16:03_24-11-2021, Gazer F735g,3999,нет в наличии
335,16:03_24-11-2021, видеонаблюдения Gazer SVC CF200/4 (CF200/4),1993,нет в наличии
336,16:03_24-11-2021, видеонаблюдения Gazer SVC CF200/8 (CF200/8),2174,нет в наличии
337,16:03_24-11-2021, видеонаблюдения Gazer SVC CF220/4 (CF220/4),1923,нет в наличии
338,16:03_24-11-2021, видеонаблюдения Gazer SVC CF231 (CF231),2142,нет в наличии
339,16:03_24-11-2021, видеонаблюдения Gazer SVC CI201/8 (CI201/8),2044,нет в наличии
340,16:03_24-11-2021, видеонаблюдения Gazer SVC CI213 (CI213),3302,нет в наличии
341,16:03_24-11-2021, видеонаблюдения Gazer SVC CI222/4 (CI222/4),2521,нет в наличии
342,16:03_24-11-2021, видеонаблюдения Gazer SVC CI233 (CI233),3193,нет в наличии
343,16:03_24-11-2021, видеонаблюдения Gazer SVC CS105 (CS105),1029,нет в наличии
344,16:03_24-11-2021, видеонаблюдения Gazer CS137,2290,нет в наличии
345,16:03_24-11-2021, для видеонаблюдения Gazer NS208rp,3587,нет в наличии
346,16:03_24-11-2021, для видеонаблюдения Gazer NS216rp,5345,нет в наличии
347,16:03_24-11-2021, для видеонаблюдения Gazer NS2216re,5702,нет в наличии
348,16:03_24-11-2021, для видеонаблюдения Gazer NF304s,1876,нет в наличии
349,16:03_24-11-2021,Null,-,-
350,16:03_24-11-2021, для видеонаблюдения Gazer NF308m,8023,нет в наличии
351,16:03_24-11-2021, для видеонаблюдения Gazer NF316m,21966,нет в наличии
352,16:03_24-11-2021, для видеонаблюдения Gazer NI416mp,6038,нет в наличии
353,16:03_24-11-2021, для видеонаблюдения Gazer NS104,4585,нет в наличии
354,16:03_24-11-2021, Gazer AUDI A4 (2002-2008) (CM6007-8E),7874,нет в наличии
355,16:03_24-11-2021, Gazer Ford Kuga (MA) - low version ( 2013-2017) (CM6008-MA),23500,нет в наличии
356,16:03_24-11-2021, Gazer ММ-система Gazer Honda Civic (FA) (2006-2011) (CM5007-FA),15899,нет в наличии
357,16:03_24-11-2021, Gazer Honda Civic (FB4) (2016-2017) (CM7010-FB4),10542,нет в наличии
358,16:03_24-11-2021, Gazer Hyundai Elantra (UD) (2016-2017) (CM6008-UD),21990,нет в наличии
359,16:03_24-11-2021, Gazer Hyundai Elantra (UD) (2016-2017) (CM6510-UD),19990,нет в наличии
360,16:03_24-11-2021, Gazer ММ-система Gazer Hyundai Santa Fe (CM) (2006-20 12) (CM5007-CM),13000,нет в наличии
361,16:03_24-11-2021, Gazer Hyundai Tucson (TL) (2015-2017) (CM7010-TL),15769,нет в наличии
362,16:03_24-11-2021, Gazer ММ-система Gazer Jeep Commander (XK) (2007-2012 ) (CM5006-XK),15899,нет в наличии
363,16:03_24-11-2021, Gazer Jeep Grand Cherokee (WK2) (2011-2016) (CM7010-WK2),27990,нет в наличии
364,16:03_24-11-2021, Gazer ММ-система Gazer Kia Picanto (TA) (2011-2017) (CM5007-TA),6279,нет в наличии
365,16:03_24-11-2021, Gazer ММ-система Gazer Kia Soul (PS17) (2014-2017) (CM5007-PS17),13899,нет в наличии
366,16:03_24-11-2021, Gazer Mercedes E (W211) (2002-2011) (CM5007-W211),17899,нет в наличии
367,16:03_24-11-2021," Gazer Nissan Qashqai, X-Trail (2013- 2016) (CM6510-J11)",21990,нет в наличии
368,16:03_24-11-2021," Gazer ММ-система Gazer SsangYong Actyon, Kyron, Koran do (2005-201 (CM5007-GAB)",15899,нет в наличии
369,16:03_24-11-2021, Gazer Suzuki Grand Vitara (JT) (2005 -2015) (CM5008-JT),14999,нет в наличии
370,16:03_24-11-2021, Gazer Toyota Auris (E180) (2006-2012) (CM6007-E180),20355,нет в наличии
371,16:03_24-11-2021, Gazer ММ-система Gazer Toyota Corolla (E140) (2006-20 12) (CM5007-E140),14387,нет в наличии
372,16:03_24-11-2021, Gazer Toyota Highlander (XU50) (2015 -2017) (CM5009-XU50),15899,нет в наличии
373,16:03_24-11-2021, Gazer Toyota Highlander (XU50) (2015 -2017) (CM5510-XU50),15899,нет в наличии
374,16:03_24-11-2021,Null,-,-
375,16:03_24-11-2021, Gazer Toyota LC 200 (J200) (2007-2015) (CM5008-J200),13899,нет в наличии
376,16:03_24-11-2021, Gazer Toyota Tundra (XK50) (2014-2017) (CM6008-XK50),19300,нет в наличии
377,16:03_24-11-2021, Gazer VW Passat B5 (3B) (2000-2005) (CM6007-3B),21990,нет в наличии
378,16:03_24-11-2021, Gazer VW Touareg (7L) (2002-2010) (CM6007-7L),19990,нет в наличии
379,16:03_24-11-2021, Gazer Honda Civic (FB2) (2013-2016) (CM6008-FB2),21990,нет в наличии
380,16:03_24-11-2021, Gazer CM5008-MGH,6670,нет в наличии
381,16:03_24-11-2021, Gazer CM6509-RE,14539,нет в наличии
382,16:03_24-11-2021, Gazer Mitsubishi Outlander (GFW) (2014-2017) CM5510-GFW (CM5510-GFW),19161,нет в наличии
383,16:03_24-11-2021, Gazer Mitsubishi Pajero Sport (KHW) CM5509-KHW (CM5509-KHW),19161,нет в наличии
384,16:03_24-11-2021, Gazer CM5509-GV CM5509-GV (CM5509-GV),17027,нет в наличии
385,16:03_24-11-2021, Gazer CM6509-GV CM6509-GV (CM6509-GV),23525,нет в наличии
386,16:03_24-11-2021, видеонаблюдения Gazer SVC CF211 (CF211),2142,нет в наличии
387,16:03_24-11-2021, видеонаблюдения Gazer SVC CI102 (CI102),2922,нет в наличии
388,16:03_24-11-2021, видеонаблюдения Gazer SVC CS215 (CS215),1324,нет в наличии
389,16:03_24-11-2021, видеонаблюдения Gazer SVC CS225 (CS225),1061,нет в наличии
390,16:03_24-11-2021, видеонаблюдения Gazer SVC CS236 (CS236),1061,нет в наличии
391,16:03_24-11-2021, для видеонаблюдения Gazer NS2208re,3451,нет в наличии
392,16:03_24-11-2021, для видеонаблюдения Gazer NS2216r,9977,нет в наличии
393,16:03_24-11-2021, для видеонаблюдения Gazer NS2232r,16899,нет в наличии
394,16:03_24-11-2021, для видеонаблюдения Gazer NF704r,2008,нет в наличии
395,16:03_24-11-2021, для видеонаблюдения Gazer NI404mp,3714,нет в наличии
396,16:03_24-11-2021, для видеонаблюдения Gazer NP408mp,6850,нет в наличии
397,16:03_24-11-2021, для видеонаблюдения Gazer NF304r,4104,нет в наличии
398,16:03_24-11-2021, Gazer F121,3885,нет в наличии
399,16:03_24-11-2021,Null,-,-
400,16:03_24-11-2021, Gazer H714 + MC135,3271,нет в наличии
401,16:03_24-11-2021, Gazer F230w,3555,нет в наличии
402,16:03_24-11-2021,Чехол для планшета Gazer Tegra Slide Cover 7,107,нет в наличии
403,16:03_24-11-2021," Gazer Ford Tourneo, Transit (F150) ( 2013-2016) (CM5009-F150)",16999,нет в наличии
404,16:03_24-11-2021, Gazer Hyundai Sonata (YF) (2010-2015) (CM5008-YF),13899,нет в наличии
405,16:03_24-11-2021, Gazer ММ-система Gazer Ford Focus (BM) (2012-2016) (CM5007-BM),13899,нет в наличии
406,16:03_24-11-2021, Gazer Ford Focus (BM) (2012-2016) (CM6007-BM),8527,нет в наличии
407,16:03_24-11-2021, Gazer Ford Kuga (MA) - low version ( 2013-2017) (CM5008-MA),16999,нет в наличии
408,16:03_24-11-2021, Gazer Honda CRV (RE) (2006-2011) (CM6007-RE),19990,нет в наличии
409,16:03_24-11-2021, Gazer ММ-система Gazer Hyundai IX35 (EL) (2010-2015) (CM5007-EL),13899,нет в наличии
410,16:03_24-11-2021, Gazer Hyundai Santa Fe (DM) (2012-2016) (CM5008-DM),15899,нет в наличии
411,16:03_24-11-2021, Gazer Hyundai Tucson (TL) (2015-2017) (CM6510-TL),19990,нет в наличии
412,16:03_24-11-2021, Gazer Jeep Wrangler (JK) (2011-2014) (CM6510-JK),24990,нет в наличии
413,16:03_24-11-2021, Gazer Kia Sorento (XM10) (2010-2012) (CM5007-XM10),14547,нет в наличии
414,16:03_24-11-2021, Gazer Kia Soul (PS17) (2014-2017) (CM6007-PS17),18900,нет в наличии
415,16:03_24-11-2021, Gazer Kia Sportage (QL) (2015-2017) (CM5008-QL),15899,нет в наличии
416,16:03_24-11-2021, Gazer Kia Sportage (SL) (2010-2015) (CM6509-SL),21990,нет в наличии
417,16:03_24-11-2021, Gazer Mercedes C (W203) (2004-2007) (CM5007-W203),17899,нет в наличии
418,16:03_24-11-2021, Gazer Opel Corsa E (B1) (2014-2017) (CM6008-B1),15749,нет в наличии
419,16:03_24-11-2021, Gazer Peugeot 301 (2014-2017) (CM6510-ELS),21990,нет в наличии
420,16:03_24-11-2021, Gazer Renault Sandero (FS) (2008-2012) (CM6009-FS),22129,нет в наличии
421,16:03_24-11-2021, Gazer Skoda Octavia A7 (5E3) (2013-2 016) (CM6008-5E3),8502,нет в наличии
422,16:03_24-11-2021, Gazer Suzuki Grand Vitara (JT) (2005 -2015) (CM6008-JT),21990,нет в наличии
423,16:03_24-11-2021, Gazer Toyota Avalon (X4) (2014-2017) (CM6008-X4),21990,нет в наличии
424,16:03_24-11-2021,Null,-,-
425,16:03_24-11-2021, Gazer Toyota Camry (V50) (2012-2015) (CM5008-V50),15899,нет в наличии
426,16:03_24-11-2021, Gazer Toyota Camry (V50) (2012-2015) (CM6510-V50),21990,нет в наличии
427,16:03_24-11-2021, Gazer Toyota Hilux (N8) (2015-2017) (CM6509-N8),15709,нет в наличии
428,16:03_24-11-2021, Gazer Toyota LC 200 (J200N) (2016-2017) (CM5510-J200N),17899,нет в наличии
429,16:03_24-11-2021, Gazer ММ-система Gazer Toyota RAV 4 (A30) (2006-2012) (CM5007-A30),13899,нет в наличии
430,16:03_24-11-2021, Gazer Toyota RAV 4 (A30) (2006-2012) (CM6007-A30),19990,нет в наличии
431,16:03_24-11-2021, Gazer ММ-система Gazer Toyota Universal (2001-2012) (CM5006-120),6289,нет в наличии
432,16:03_24-11-2021, Gazer ММ-система Gazer Toyota Venza (GV10) (2008-2016 ) (CM5007-GV10),15899,нет в наличии
433,16:03_24-11-2021, Gazer VW Touareg (7P5) (2010-2016) (CM5508-7P5),19990,нет в наличии
434,16:03_24-11-2021, Gazer ММ-система Gazer CM6507-100S (CM6507-100S),8888,нет в наличии
435,16:03_24-11-2021, Gazer CM6008-7P5,26990,нет в наличии
436,16:03_24-11-2021, Gazer CM5008-250T,15899,нет в наличии
437,16:03_24-11-2021, Gazer CM6007-C6,21990,нет в наличии
438,16:03_24-11-2021, Gazer CM6008-CKN,17592,нет в наличии
439,16:03_24-11-2021, Gazer Mazda CX-9 (TB) (2006-2012) CM5507-TB (CM5507-TB),17027,нет в наличии
440,16:03_24-11-2021, Gazer Mazda CX-9 (TB) (2006-2012) CM6507-TB (CM6507-TB),23525,нет в наличии
441,16:03_24-11-2021, Gazer Toyota RAV 4 (A30) (2006-2012) CM5510-A30 (CM5510-A30),19161,нет в наличии
442,16:03_24-11-2021,бель питания Gazer ACG121g/122 GPS cable (ACG121G/122),999,нет в наличии
443,16:03_24-11-2021,Парктроник Gazer PA45R,3399,нет в наличии
444,16:03_24-11-2021, видеонаблюдения Gazer SVC CF224/4 (CF224/4),995,нет в наличии
445,16:03_24-11-2021, видеонаблюдения Gazer SVC CI201/4 (CI201/4),2044,нет в наличии
446,16:03_24-11-2021, видеонаблюдения Gazer SVC CI202/4 (CI202/4),2539,нет в наличии
447,16:03_24-11-2021, видеонаблюдения Gazer SVC CI212 (CI212),4644,нет в наличии
448,16:03_24-11-2021, видеонаблюдения Gazer SVC CI215 (CI215),5369,нет в наличии
449,16:03_24-11-2021,Null,-,-
450,16:03_24-11-2021, видеонаблюдения Gazer SVC CS135 (CS135),1092,нет в наличии
451,16:03_24-11-2021, видеонаблюдения Gazer SVC CS235 (CS235),1483,нет в наличии
452,16:03_24-11-2021, видеонаблюдения Gazer CS206,2320,нет в наличии
453,16:03_24-11-2021, видеонаблюдения Gazer CI224,2650,нет в наличии
454,16:03_24-11-2021, для видеонаблюдения Gazer NS204r,1425,нет в наличии
455,16:03_24-11-2021, для видеонаблюдения Gazer NS2224r,12993,нет в наличии
456,16:03_24-11-2021, для видеонаблюдения Gazer NF708r,3510,нет в наличии
457,16:03_24-11-2021, для видеонаблюдения Gazer NF344rh,4472,нет в наличии
458,16:03_24-11-2021, для видеонаблюдения Gazer NI404m,2258,нет в наличии
459,16:03_24-11-2021, Gazer F525,2449,нет в наличии
460,16:03_24-11-2021, Gazer F122,4329,нет в наличии
461,16:03_24-11-2021, Gazer F725,2799,нет в наличии
462,16:03_24-11-2021, Gazer BMW 3 (E46) (1998-2004) (CM6007-E46),7886,нет в наличии
463,16:03_24-11-2021, Gazer Honda Civic (FG) (2011-2013) (CM6510-FG),8175,нет в наличии
464,16:03_24-11-2021, Gazer Honda HRV (GH) (2013-2017) (CM5509-GH),6569,нет в наличии
465,16:03_24-11-2021, Gazer Kia Rio (UB) (2012-2015) (CM5008-UB),6258,нет в наличии
466,16:03_24-11-2021, Gazer Kia Sorento (UM) (2015-2017) (CM5510-UM),14999,нет в наличии
467,16:03_24-11-2021, Gazer Kia Sportage (SL) (2010-2015) (CM6008-SL),19990,нет в наличии
468,16:03_24-11-2021, Gazer Mazda 3 (BL) (2010-2014) (CM6008-BL),19990,нет в наличии
469,16:03_24-11-2021," Gazer Mazda CX-5 (KE), 6 (GJ) (2012- 2016) (CM6008-KE)",7989,нет в наличии
470,16:03_24-11-2021, Gazer Mazda CX-7 (ER) (2006-2012) (CM6007-ER),21990,нет в наличии
471,16:03_24-11-2021," Gazer Mercedes A, B, Vito, Viano, Sp rinter (2003-2012) (CM6007-W169)",24990,нет в наличии
472,16:03_24-11-2021," Gazer ММ-система Gazer Nissan Tiida, Qashqai, X-Trail , Patrol (CM5006-SC11)",13899,нет в наличии
473,16:03_24-11-2021, Gazer Renault Megane (BMO) (2002-2009) (CM6007-BMO),20900,нет в наличии
474,16:03_24-11-2021,Null,-,-
475,16:03_24-11-2021," Gazer Skoda Octavia A5, Fabia, Super b (2005-2012) (CM6007-1Z3)",21990,нет в наличии
476,16:03_24-11-2021, Gazer Suzuki SX-4 (JY) (2013-2016) (CM5008-JY),15612,нет в наличии
477,16:03_24-11-2021, Gazer ММ-система Gazer СM5510-V70 (CM5510-V70),15899,нет в наличии
478,16:03_24-11-2021, Gazer Toyota LC 200 (J200N) (2016-2017) (CM5009-J200N),17899,нет в наличии
479,16:03_24-11-2021, Gazer VW Passat B8 (3G2) (2014-2017) (CM6510-3G2),20900,нет в наличии
480,16:03_24-11-2021, Gazer CM5509-KX5,15899,нет в наличии
481,16:03_24-11-2021, Gazer CM6008-250T,13279,нет в наличии
482,16:03_24-11-2021, Gazer CM6509-KX5,20900,нет в наличии
483,16:03_24-11-2021, Gazer CM5510-100U CM5510-100U (CM5510-100U),11801,нет в наличии
484,16:03_24-11-2021, Gazer CM6510-E21 CM6510-E21 (CM6510-E21),23525,нет в наличии
485,16:03_24-11-2021, заднего вида Gazer CC125,1169,нет в наличии
486,16:03_24-11-2021, Gazer TV32-FS2G,8399,нет в наличии
487,16:03_24-11-2021, Gazer F115,1925,нет в наличии
488,16:03_24-11-2021, Gazer H515,1178,нет в наличии
489,16:03_24-11-2021, Gazer H714,1999,нет в наличии
490,16:03_24-11-2021, Gazer F150g,4840,нет в наличии
491,16:03_24-11-2021, Gazer F720,3999,нет в наличии
492,16:03_24-11-2021, видеонаблюдения Gazer SVC CF204/4 (CF204/4),1567,нет в наличии
493,16:03_24-11-2021, видеонаблюдения Gazer SVC CF214 (CF214),3778,нет в наличии
494,16:03_24-11-2021, видеонаблюдения Gazer SVC CF234 (CF234),1806,нет в наличии
495,16:03_24-11-2021, видеонаблюдения Gazer CS226,2381,нет в наличии
496,16:03_24-11-2021, для видеонаблюдения Gazer NF308me,10203,нет в наличии
497,16:03_24-11-2021, для видеонаблюдения Gazer NP404m,3253,нет в наличии
498,16:03_24-11-2021, для видеонаблюдения Gazer NP416mp,8091,нет в наличии
499,16:03_24-11-2021,Null,-,-
500,16:03_24-11-2021, для видеонаблюдения Gazer MS504rw/MS504re,10610,нет в наличии
501,16:03_24-11-2021, для видеонаблюдения Gazer NS108,4619,нет в наличии
502,16:03_24-11-2021, Gazer AUDI A3 (2003-2008) (CM5007-8P),15899,нет в наличии
503,16:03_24-11-2021, Gazer BMW 3 (E46) (1998-2004) (CM5007-E46),13899,нет в наличии
504,16:03_24-11-2021, Gazer Fiat Doblo (152) (2009-2014) (CM6006-152),7875,нет в наличии
505,16:03_24-11-2021, Gazer Ford F150 (XII) (2009-2014) (CM5008-XII),17899,нет в наличии
506,16:03_24-11-2021, Gazer Ford F150 (XII) (2009-2014) (CM6008-XII),23398,нет в наличии
507,16:03_24-11-2021, Gazer Ford Fiesta (JJ) (2008-2014) (CM6007-JJ),21990,нет в наличии
508,16:03_24-11-2021, Gazer Ford Focus (BM) (2012-2016) (CM7010-BM),9750,нет в наличии
509,16:03_24-11-2021," Gazer Ford Mondeo (BA7), Focus (DB) (2007-2012) (CM7010-BA7)",27990,нет в наличии
510,16:03_24-11-2021," Gazer Ford Tourneo, Transit (F150) ( 2013-2016) (CM6009-F150)",24990,нет в наличии
511,16:03_24-11-2021, Gazer ММ-система Gazer Honda CRV (RE) (2006-2011) (CM5007-RE),11119,нет в наличии
512,16:03_24-11-2021, Gazer Honda CRV (RE) (2006-2011) (CM5008-RE),15899,нет в наличии
513,16:03_24-11-2021, Gazer Honda CRV (RE) (2006-2011) (CM6008-RE),21990,нет в наличии
514,16:03_24-11-2021, Gazer Honda Civic (FA) (2006-2011) (CM6007-FA),19300,нет в наличии
515,16:03_24-11-2021, Gazer Hyundai Accent (RB) (2010-2015) (CM6007-RB),17400,нет в наличии
516,16:03_24-11-2021, Gazer ММ-система Gazer Hyundai Santa Fe (CM) (2006-20 12) (CM5006-CM),7069,нет в наличии
517,16:03_24-11-2021, Gazer Hyundai Sonata (NF) (2009-2010) (CM6006-NF),7473,нет в наличии
518,16:03_24-11-2021, Gazer Jeep Compass (MK49) (2007-2016) (CM5510-MK49),15589,нет в наличии
519,16:03_24-11-2021, Gazer Kia Carens (FG) (2013-2017) (CM5008-RP),15899,нет в наличии
520,16:03_24-11-2021, Gazer ММ-система Gazer Kia Optima (JF) (2015-2017) (CM5007-JF),15899,нет в наличии
521,16:03_24-11-2021, Gazer Kia Sorento (XM) (2013-2015) (CM5008-XM),7079,нет в наличии
522,16:03_24-11-2021, Gazer Kia Sorento (XM) (2013-2015) (CM6008-XM),19990,нет в наличии
523,16:03_24-11-2021, Gazer Mazda CX-9 (TB) (2006-2012) (CM6007-TB),19990,нет в наличии
524,16:03_24-11-2021,Null,-,-
525,16:03_24-11-2021," Gazer Mercedes A, B, Vito, Viano, Sp rinter (2003-2012) (CM5007-W169)",17899,нет в наличии
526,16:03_24-11-2021, Gazer Mercedes E (W211) (2002-2011) (CM6007-W211),24990,нет в наличии
527,16:03_24-11-2021, Gazer Mercedes ML (W164) (2005-2013) (CM6007-W164),24990,нет в наличии
528,16:03_24-11-2021, Gazer ММ-система Gazer Mitsubishi Pajero (V8W) (2006- 2015) (CM5007-V8W),15899,нет в наличии
529,16:03_24-11-2021," Gazer Nissan Qashqai, X-Trail (2013- 2016) (CM5008-J11)",15899,нет в наличии
530,16:03_24-11-2021," Gazer Nissan Qashqai, X-Trail (2013-2016) (CM5510-J11)",14999,нет в наличии
