,Date,Name,Price,Nal
0,16:02_24-11-2021, Gazer Kia Sportage (SL) (2010-2015) (CM5008-SL),6849,в наличии
1,16:02_24-11-2021, Gazer TV32-HS2G,6199,в наличии
2,16:02_24-11-2021, Gazer TV24-HS2G,4999,в наличии
3,16:02_24-11-2021, Gazer Mazda 6 (GJ) (2012-2016) (CM6509-GJ),8529,в наличии
4,16:02_24-11-2021, Gazer TV43-US2G,9999,в наличии
5,16:02_24-11-2021,GPS-модуль Gazer ACG750,999,в наличии
6,16:02_24-11-2021, Gazer VW Passat B8 (3G2) (2014-2017) (CM7010-3G2),10239,в наличии
7,16:02_24-11-2021, Gazer ММ-система Gazer Hyundai Elantra (MD) (2011-2016) (CM5007-MD),7139,в наличии
8,16:02_24-11-2021, Gazer F125 (3694553),2599,в наличии
9,16:02_24-11-2021, Gazer Ford Focus (BK) (2015-2017) (CM5009-BK),7139,в наличии
10,16:02_24-11-2021, Gazer Hyundai IX35 (EL) (2010-2015) (CM5509-EL),7099,в наличии
11,16:02_24-11-2021, Gazer Skoda Octavia A7 (5E3) (2013-2 016) (CM5008-5E3),7669,в наличии
12,16:02_24-11-2021, Gazer Mazda 3 (BL) (2010-2014) (CM5008-BL),6919,в наличии
13,16:02_24-11-2021," Gazer Nissan Qashqai, X-Trail (2013- 2016) (CM7012-J11)",10209,в наличии
14,16:02_24-11-2021, Gazer Toyota Prado (J120) (2002-2009) (CM5509-TYT),7109,в наличии
15,16:02_24-11-2021, Gazer Kia Sorento (UM) (2015-2017) (CM6008-UM),8239,в наличии
16,16:02_24-11-2021, Gazer AUDI A3 (2003-2008) (CM6007-8P),8829,в наличии
17,16:02_24-11-2021, Gazer F715,1699,в наличии
18,16:02_24-11-2021," Gazer Chevrolet Epica, Captiva, Aveo (2002-2011) (CM5007-T200)",7069,в наличии
19,16:02_24-11-2021, Gazer Porsche Macan (2014-2017) (CM7010-MCN),10199,в наличии
20,16:02_24-11-2021," Gazer Nissan Tiida, Qashqai, X-Trail , Patrol (CM6006-SC11)",7669,в наличии
21,16:02_24-11-2021, Gazer MUW5000,5999,в наличии
22,16:02_24-11-2021, Gazer Toyota Camry (V50) - USA (2012 -2015) (CM5008-V50USA),6439,в наличии
23,16:02_24-11-2021, Gazer F750w,7499,в наличии
24,16:02_24-11-2021,Null,-,-
25,16:02_24-11-2021, Gazer Система кругового обзора CKR4400 (CKR4400),11599,в наличии
26,16:02_24-11-2021, Gazer Fiat Doblo (263) (2015-2017) (CM6007-263),7899,в наличии
27,16:02_24-11-2021, Gazer Toyota Camry (V40) (2007-2011) (CM6008-V40),8839,в наличии
28,16:02_24-11-2021, Gazer VW Golf VII (BE1) (2014-2017) (CM5510-BE1),7099,в наличии
29,16:02_24-11-2021, Gazer Nissan Murano (Z52R) (2015-2017) (CM6510-Z52R),8489,в наличии
30,16:02_24-11-2021, Gazer Kia Optima (JF) (2015-2017) (CM6510-JF),8489,в наличии
31,16:02_24-11-2021, Gazer Mazda CX-5 (KE) (2012-2016) (CM5509-KE),6619,в наличии
32,16:02_24-11-2021, Gazer VW Passat B8 (3G2) (2014-2017) (CM6008-3G2),8519,в наличии
33,16:02_24-11-2021, Gazer Hyundai Accent (RB) (2010-2015) (CM5509-RB),11119,в наличии
34,16:02_24-11-2021, Gazer Jeep Commander (XK) (2007-2012) (CM6007-XK),8169,в наличии
35,16:02_24-11-2021, Gazer VW Tiguan (5N2) (2013-2016) (CM6510-5N2),9469,в наличии
36,16:02_24-11-2021, Gazer CM5007-K14,5929,в наличии
37,16:02_24-11-2021, Gazer Hyundai Tucson (TL) (2015-2017) (CM5510-TL),7059,в наличии
38,16:02_24-11-2021, Gazer Mercedes ML (W164) (2005-2013) (CM5007-W164),16999,в наличии
39,16:02_24-11-2021, Gazer Subaru Forester (S13) (2015-2017) (CM6509-S13),8269,в наличии
40,16:02_24-11-2021, Gazer TV40-FS2G,10699,в наличии
41,16:02_24-11-2021, Gazer F118 (2758080),1799,в наличии
42,16:02_24-11-2021, Gazer Toyota LC 100 (J100) (1998-2007) (CM5008-J100),6729,в наличии
43,16:02_24-11-2021," Gazer Ford Focus, Mondeo, Connect, S -Max (2004-2010) (CM6007-DB)",8329,в наличии
44,16:02_24-11-2021, Gazer Jeep Cherokee (KL) (2014-2017) (CM6510-KL),16720,в наличии
45,16:02_24-11-2021, Gazer ММ-система Gazer CM5007-B14 (CM5007-B14),6649,в наличии
46,16:02_24-11-2021, Gazer Toyota Prado (J120) (2002-2009) (CM6007-TYT),9249,в наличии
47,16:02_24-11-2021, Gazer Toyota LC 200 (J200) (2007-2015) (CM7012-J200),10149,в наличии
48,16:02_24-11-2021," Gazer Mitsubishi Lancer (2007-2013), ASX (2007-2010) (CM5510-ASX10)",15899,в наличии
49,16:02_24-11-2021,Null,-,-
50,16:02_24-11-2021, Gazer MUW7000,8999,в наличии
51,16:02_24-11-2021, Gazer ММ-система Gazer Kia Cerato (LD) (2003-2009) (CM5006-LD),12719,в наличии
52,16:02_24-11-2021, Gazer Peugeot 301 (2014-2017) (CM5510-ELS),6899,в наличии
53,16:02_24-11-2021, Gazer Honda Civic (FA) (2006-2011) (CM6510-FA),8509,в наличии
54,16:02_24-11-2021, Gazer ММ-система Gazer Renault Duster (HSAM) (2010-20 16) (CM5007-HSAM),7089,в наличии
55,16:02_24-11-2021, Gazer ММ-система Gazer Fiat Bravo (198) (2007-2015) (CM5007-198),7079,в наличии
56,16:02_24-11-2021," Gazer Renault Captur, Clio (KR0) - A C (2011-2015) (CM5509-KR0A)",7079,в наличии
57,16:02_24-11-2021, Gazer Ford Kuga (MA) - low version (2013-2017) (CM7012-MA),9869,в наличии
58,16:02_24-11-2021," Gazer BMW 5 (E39), X5 (E53) (1996-2004) (CM6007-E39)",9169,в наличии
59,16:02_24-11-2021, Gazer ММ-система Gazer Mazda CX-7 (ER) (2006-2012) CM5509-ER (CM5509-ER),7019,в наличии
60,16:02_24-11-2021, Gazer ММ-система Gazer Mazda 3 (BK) (2004-2009) (CM5007-BK),7109,в наличии
61,16:02_24-11-2021, Gazer Ford Kuga (MA) - low version ( 2013-2017) (CM5510-MA),6899,в наличии
62,16:02_24-11-2021, Gazer ММ-система Gazer Hyundai i40 (VF) (2011-2016) (CM5007-VF),6809,в наличии
63,16:02_24-11-2021," Gazer VW Touareg (7P6), 2016-2017(on ly instead RCD550) (CM5508-7P6)",9139,в наличии
64,16:02_24-11-2021, Gazer CF730-IN,1499,в наличии
65,16:02_24-11-2021, Gazer Honda CRV (RM4) (2012-2016) (CM6007-RM4),7509,в наличии
66,16:02_24-11-2021, Gazer Hyundai Elantra (UD) (2016-2017) (CM7010-UD),10209,в наличии
67,16:02_24-11-2021, Gazer Suzuki SX-4 (JY) (2013-2016) (CM6008-JY),16720,в наличии
68,16:02_24-11-2021," Gazer BMW 5 (E39), X5 (E53) (1996-2004) (CM5007-E39)",8089,в наличии
69,16:02_24-11-2021, Gazer Kia Ceed (JD) (2011-2017) (CM6008-JD),8519,в наличии
70,16:02_24-11-2021, Gazer Kia Rio (UB) (2012-2015) (CM6509-UB),13920,в наличии
71,16:02_24-11-2021, Gazer ММ-система Gazer Ford Fiesta (JJ) (2008-2014) (CM5007-JJ),12719,в наличии
72,16:02_24-11-2021," Gazer ММ-система Gazer Ford Focus, Mondeo, Connect, S -Max (2004-2 (CM5007-DB)",6869,в наличии
73,16:02_24-11-2021, Gazer Opel Astra (K) (2014-2017) (CM5509-GS),7069,в наличии
74,16:02_24-11-2021,Null,-,-
75,16:02_24-11-2021, Gazer Toyota Highlander (XU40) (2008 -2015) (CM6510-XU40),8839,в наличии
76,16:02_24-11-2021, Gazer Hyundai Santa Fe (DM) (2012-2016) (CM6008-DM),8119,в наличии
77,16:02_24-11-2021, Gazer Toyota RAV 4 (A40) (2013-2016) (CM5510-A40),12719,в наличии
78,16:02_24-11-2021, Gazer VW Polo (614) (2016-2017) (CM6510-614),8559,в наличии
79,16:02_24-11-2021, Gazer Hyundai Tucson (TL) (2015-2017) (CM6008-TL),8529,в наличии
80,16:02_24-11-2021, Gazer ММ-система Gazer Mazda CX-7 (ER) (2006-2012) (CM5007-ER),12719,в наличии
81,16:02_24-11-2021, Gazer Toyota Camry 2018+ (CM6510-V70),7199,в наличии
82,16:02_24-11-2021, Gazer VW Touareg (7P6) (2016-2017)(only instead RCD550) (CM6508-7P6),10489,в наличии
83,16:02_24-11-2021, Gazer Porsche Cayenne (955) (2002-2009) (CM6007-955),8779,в наличии
84,16:02_24-11-2021, Gazer Suzuki SX-4 (EYB) (2006-2013) (CM5008-EYB),12719,в наличии
85,16:02_24-11-2021, Gazer Opel Astra (K) (2014-2017) (CM6509-GS),8469,в наличии
86,16:02_24-11-2021, Gazer Kia Sportage (QL) (2015-2017) (CM6008-QL),8519,в наличии
87,16:02_24-11-2021, Gazer VW Jetta (162) (2013-2016) (CM6510-162),8119,в наличии
88,16:02_24-11-2021, Gazer Toyota Camry (V55) (2015-2017) (CM5008-V55),7139,в наличии
89,16:02_24-11-2021, Gazer ММ-система Gazer Honda Jazz (GE6) (2007-2013) (CM5007-GE6),7099,в наличии
90,16:02_24-11-2021, Gazer Hyundai Santa Fe (DM) (2012-2016) (CM5509-DM),7079,в наличии
91,16:02_24-11-2021, Gazer ММ-система Gazer SsangYong Korando (CK) (2010-2 013) (CM5007-CK),6979,в наличии
92,16:02_24-11-2021, Gazer Toyota Corolla (E150) (2013-2016) (CM6007-E150),8499,в наличии
93,16:02_24-11-2021," Gazer Mitsubishi Outlander (GFW), AS X, Lancer, 2013 (CM6006-GFW)",8489,в наличии
94,16:02_24-11-2021, Gazer Subaru Forester (S12) (2007-2012) (CM6007-S12),7969,в наличии
95,16:02_24-11-2021, Gazer Skoda Yeti (5L) - auto conditi oner (2009-2013) (CM5510-5LA),7099,в наличии
96,16:02_24-11-2021," Gazer Toyota Prado, LC150 - High level, (2014-2016) (CM6008-J150H)",8579,в наличии
97,16:02_24-11-2021, Gazer Toyota Prius (XW50) (2014-2017) (CM6008-XW50),8249,в наличии
98,16:02_24-11-2021, Gazer ММ-система Gazer Toyota Yaris (P130) (2011-2013 ) (CM5006-P130),7019,в наличии
99,16:02_24-11-2021,Null,-,-
100,16:02_24-11-2021, Gazer TV55-US2G,17999,в наличии
101,16:02_24-11-2021, Gazer Suzuki Swift (ZD) (2004-2010) (CM6510-ZD),5229,в наличии
102,16:02_24-11-2021, Gazer ММ-система Gazer Hyundai H1 (TQ) (2007-2012) (CM5006-TQ),6589,в наличии
103,16:02_24-11-2021, Gazer Hyundai Santa Fe (CM) (2006-2012) (CM6006-CM),7869,в наличии
104,16:02_24-11-2021," Gazer Ford Fuison, Explorer, Mustang , Edge, Escape II (CM6007-JUF)",8479,в наличии
105,16:02_24-11-2021, Gazer Hyundai H1 (TQ) (2007-2012) (CM6006-TQ),8479,в наличии
106,16:02_24-11-2021, Gazer Nissan Teana (L33R) (2013-2016) (CM6510-L33R),8499,в наличии
107,16:02_24-11-2021, Gazer SsangYong Rexton (W2) (2013-2017) (CM6007-W2),16720,в наличии
108,16:02_24-11-2021, Gazer VW Golf VII (BE1) (2014-2017) (CM7010-BE1),10119,в наличии
109,16:02_24-11-2021, Gazer CM5509-CW6,6689,в наличии
110,16:02_24-11-2021, Gazer Honda Civic (FB4) (2016-2017) (CM6509-FB4),8069,в наличии
111,16:02_24-11-2021, Gazer Kia Ceed (JD) (2011-2017) (CM5008-JD),6709,в наличии
112,16:02_24-11-2021, Gazer Peugeot 408 (2010-2013) (CM6007-408W),8489,в наличии
113,16:02_24-11-2021, Gazer Toyota Prado (J150) (2010-2013) (CM6008-J150),8529,в наличии
114,16:02_24-11-2021," Gazer Toyota Prado, LC150 - High/Low level (CM6510-J150H/L)",8939,в наличии
115,16:02_24-11-2021, Gazer ММ-система Gazer VW Passat B5 (3B) (2000-2005) (CM5007-3B),12719,в наличии
116,16:02_24-11-2021, Gazer Kia Sorento (XM10) (2010-2012) (CM6007-XM10),20900,в наличии
117,16:02_24-11-2021, Gazer Mercedes S (W220) (1998-2005) (CM6007-W220),9519,в наличии
118,16:02_24-11-2021, Gazer Suzuki Swift (ZD) (2004-2010) (CM5510-ZD),7109,в наличии
119,16:02_24-11-2021, Gazer Toyota Camry (V55) (2015-2017) (CM5510-V55),7099,в наличии
120,16:02_24-11-2021, Gazer Toyota Prius (XW50) (2014-2017) (CM5008-XW50),7109,в наличии
121,16:02_24-11-2021, Gazer VW Touran (5T1) (2016-2017) (CM6510-5T1),8589,в наличии
122,16:02_24-11-2021, Gazer Honda Civic (FB4) (2016-2017) (CM5509-FB4),7059,в наличии
123,16:02_24-11-2021, Gazer Kia Cereato (YD) (2015-2017) (CM5008-YD),7109,в наличии
124,16:02_24-11-2021,Null,-,-
125,16:02_24-11-2021, Gazer Kia Sportage (QL) (2015-2017) (CM6509-QL),8629,в наличии
126,16:02_24-11-2021, Gazer Suzuki Swift (ZCS) (2011-2016) (CM6007-ZCS),8499,в наличии
127,16:02_24-11-2021, Gazer Toyota RAV 4 (A40) (2013-2016) (CM5008-A40),7109,в наличии
128,16:02_24-11-2021, Gazer VW Passat B8 (3G2) (2014-2017) (CM5510-3G2),7159,в наличии
129,16:02_24-11-2021, Gazer VW Touareg (7P5) (2010-2016) (CM6508-7P5),9999,в наличии
130,16:02_24-11-2021, Gazer CM6509-V40F,8349,в наличии
131,16:02_24-11-2021, заднего вида Gazer CC100,1399,в наличии
132,16:02_24-11-2021, Gazer Lada Vesta (2015-2017) (CM6008-VST),7669,в наличии
133,16:02_24-11-2021, Gazer Kia Mohave (QV) (2007-2012) (CM6007-QV),8489,в наличии
134,16:02_24-11-2021, Gazer ММ-система Gazer Peugeot 408 (2010-2013) (CM5007-408W),7089,в наличии
135,16:02_24-11-2021, Gazer Toyota LC 200 (J200N) (2016-2017) (CM7012-J200N),9769,в наличии
136,16:02_24-11-2021, Gazer VW Polo (614) (2016-2017) (CM5510-614),7159,в наличии
137,16:02_24-11-2021, Gazer CM5510-TLN,6609,в наличии
138,16:02_24-11-2021, Gazer Skoda Octavia A7 (5E3) (2013-2016) (CM5510-5E3),12719,в наличии
139,16:02_24-11-2021, Gazer Toyota Highlander (XU50) (2015 -2017) (CM6009-XU50),10269,в наличии
140,16:02_24-11-2021, Gazer Toyota RAV 4 (A30) (2006-2012) (CM6510-A30),8219,в наличии
141,16:02_24-11-2021, Gazer VW Golf VII (BE1) (2014-2017) (CM6510-BE1),8509,в наличии
142,16:02_24-11-2021, Gazer TV49-US2G,14499,в наличии
143,16:02_24-11-2021, Gazer Kia Sportage (QL) (2015-2017) (CM5509-QL),15899,в наличии
144,16:02_24-11-2021, Gazer Renault Duster (HSAM) (2010-2016) (CM6007-HSAM),8079,в наличии
145,16:02_24-11-2021, Gazer Renault Kadjar (CMF) (2015-2017) (CM6510-CMF),8559,в наличии
146,16:02_24-11-2021, Gazer Toyota Hilux (N5) (2012-2015) (CM6006-N5),15120,в наличии
147,16:02_24-11-2021, Gazer Hyundai Santa Fe (DM) (2012-2016) (CM6509-DM),7949,в наличии
148,16:02_24-11-2021, Gazer Toyota Universal (2001-2012) (CM6006-120),7449,в наличии
149,16:02_24-11-2021,Null,-,-
150,16:02_24-11-2021, Gazer Ford Kuga (MA) - low version (2013-2017) (CM6510-MA),8089,в наличии
151,16:02_24-11-2021, Gazer Hyundai IX35 (EL) (2010-2015) (CM6007-EL),8489,в наличии
152,16:02_24-11-2021, Gazer Hyundai i10 (BA) (2013-2016) (CM6007-BA),8509,в наличии
153,16:02_24-11-2021, Gazer Mazda 3 (BK) (2004-2009) (CM6007-BK),7919,в наличии
154,16:02_24-11-2021, Gazer ММ-система Gazer Porsche Cayenne (955) (2002-20 09) (CM5007-955),7569,в наличии
155,16:02_24-11-2021, Gazer Suzuki Swift (ZCS) (2011-2016) (CM5007-ZCS),7089,в наличии
156,16:02_24-11-2021, Gazer Toyota Camry (V55) (2015-2017) (CM7012-V55),9859,в наличии
157,16:02_24-11-2021, Gazer Toyota LC 200 (J200) (2007-2015) (CM5510-J200),7169,в наличии
158,16:02_24-11-2021, заднего вида Gazer СС150,1899,в наличии
159,16:02_24-11-2021, Gazer BYD F3 (2007-2012) (CM5006-BF3),7059,в наличии
160,16:02_24-11-2021," Gazer Chevrolet Cruze (J350), Lacett i (2013-2017) (CM5008-J350)",6839,в наличии
161,16:02_24-11-2021, Gazer Lada Vesta (2015-2017) (CM5008-VST),6269,в наличии
162,16:02_24-11-2021, Gazer Skoda Octavia A7 (5E3) (2013-2016) (CM6510-5E3),8839,в наличии
163,16:02_24-11-2021, Gazer Toyota Camry (V55) (2015-2017) (CM6008-V55),7919,в наличии
164,16:02_24-11-2021, Gazer Toyota Highlander (XU50) (2015 -2017) (CM6510-XU50),8419,в наличии
165,16:02_24-11-2021, Gazer CM5509-RE,6609,в наличии
166,16:02_24-11-2021," Gazer Chevrolet Cruze (J350), Lacett i (2013-2017) (CM6509-J350)",8489,в наличии
167,16:02_24-11-2021, Gazer Kia Rio (UB15) (2015-2017) (CM6008-UB15),8539,в наличии
168,16:02_24-11-2021, Gazer Toyota Camry (V50) (2012-2015) (CM6008-V50),17592,в наличии
169,16:02_24-11-2021," Gazer Toyota Prado, LC150 - High/Low level (CM5510-J150H/L)",8169,в наличии
170,16:02_24-11-2021, Gazer Toyota Prius C (NHP10) (2011-2014) (CM6006-NHP10),8519,в наличии
171,16:02_24-11-2021, Gazer Toyota Yaris (P150) (2013-2016) (CM6510-P150),8259,в наличии
172,16:02_24-11-2021, Gazer Gazer AUDI TT (2006-2011) (CM5007-8J),7059,в наличии
173,16:02_24-11-2021, Gazer ММ-система Gazer Hyundai i20 (PB) (2008-2013) (CM5006-PB),6089,в наличии
174,16:02_24-11-2021,Null,-,-
175,16:02_24-11-2021, Gazer Mitsubishi Lancer (CYA) (2007- 2013) (CM5008-CYA),10122,в наличии
176,16:02_24-11-2021, Gazer Skoda Fabia (NJ) (2015-2017) (CM6509-NJ),8179,в наличии
177,16:02_24-11-2021, Gazer ММ-система Gazer Toyota Hilux (N5) (2012-2015) (CM5006-N5),6199,в наличии
178,16:02_24-11-2021, Gazer Toyota RAV 4 (A40) (2013-2016) (CM6510-A40),7999,в наличии
179,16:02_24-11-2021, Gazer VW Tiguan (AD1) (2016-2017) (CM6510-AD1),8479,в наличии
180,16:02_24-11-2021, Gazer CM5509-CM,15899,в наличии
181,16:02_24-11-2021, Gazer Kia Cereato (YD) (2015-2017) (CM6510-YD),8489,в наличии
182,16:02_24-11-2021, Gazer Kia Sorento (KX7) (2017) (CM5510-KX7),7089,в наличии
183,16:02_24-11-2021," Gazer ММ-система Gazer Mitsubishi Outlander (GFW), AS X, Lancer, 2 (CM5006-GFW)",7089,в наличии
184,16:02_24-11-2021, Gazer Nissan Patrol (Y62) (2010-2015) (CM6008-Y62),9539,в наличии
185,16:02_24-11-2021, Gazer Kia Carens (FG) (2013-2017) (CM6509-RP),8469,в наличии
186,16:02_24-11-2021, Gazer Toyota LC 100 (J100) (1998-2007) (CM6008-J100),7999,в наличии
187,16:02_24-11-2021, Gazer Toyota LC 200 (J200) (2007-2015) (CM6510-J200),7979,в наличии
188,16:02_24-11-2021, Gazer ММ-система Gazer Toyota Auris (E180) (2006-2012 ) (CM5007-E180),14999,в наличии
189,16:02_24-11-2021, Gazer Toyota Corolla (E150) (2013-2016) (CM6510-E150),8669,в наличии
190,16:02_24-11-2021, Gazer Toyota Prado (J150) (2010-2013) (CM7012-J150),9819,в наличии
191,16:02_24-11-2021," Gazer Toyota Prado, LC150 - Low leve l (2014-2016) (CM5009-J150L)",6619,в наличии
192,16:02_24-11-2021, Gazer Toyota RAV 4 (A40) (2013-2016) (CM6008-A40),8269,в наличии
193,16:02_24-11-2021, Gazer Toyota Universal (2001-2012) (CM6006-120F),7949,в наличии
194,16:02_24-11-2021, Gazer Toyota Yaris (P170) (2016-2017) (CM5009-P170),6719,в наличии
195,16:02_24-11-2021, Gazer Toyota Yaris (P170) (2016-2017) (CM6009-P170),7989,в наличии
196,16:02_24-11-2021," Gazer Mazda CX-5 (KE), 6 (GJ) (2012- 2016) (CM5008-KE)",6679,в наличии
197,16:02_24-11-2021, Gazer Mitsubishi Outlander (GFW) (20 14-2017) (CM6008-GFW),19300,в наличии
198,16:02_24-11-2021, Gazer CM5509-RW,6609,в наличии
199,16:03_24-11-2021,Null,-,-
200,16:03_24-11-2021," Gazer ММ-система Gazer Ford Fuison, Explorer, Mustang , Edge, Esca (CM5007-JU)",7089,в наличии
201,16:03_24-11-2021, Gazer ММ-система Gazer Hyundai i10 (BA) (2013-2016) (CM5007-BA),7109,в наличии
202,16:03_24-11-2021, Gazer ММ-система для Chevrolet Aveo (2011-2016) (CM5008-T300),7109,в наличии
203,16:03_24-11-2021, Gazer CM6508-MGH,21990,в наличии
204,16:03_24-11-2021, Gazer Mitsubishi Pajero (V9W) (2016-2017) (CM6509-V9W),8529,в наличии
205,16:03_24-11-2021, Gazer Toyota Camry (V50) (2012-2015) (CM5510-V50),15899,в наличии
206,16:03_24-11-2021, Gazer ММ-система Gazer Toyota Corolla (E150) (2013-2016) (CM5007-E150),7099,в наличии
207,16:03_24-11-2021, Gazer VW Passat B8 (3G2) (2014-2017) (CM5008-3G2),7119,в наличии
208,16:03_24-11-2021, Gazer Kia Sportage (SL) (2010-2015) (CM5509-SL),12719,в наличии
209,16:03_24-11-2021, Gazer Mitsubishi Pajero (V9W) (2016- 2017) (CM5008-V9W),6639,в наличии
210,16:03_24-11-2021, Gazer Nissan Navara (D40) (2014-2017) (CM6008-D40),8519,в наличии
211,16:03_24-11-2021, Gazer Toyota Prado (J150) (2010-2013) (CM5510-J150),7719,в наличии
212,16:03_24-11-2021, Gazer Nissan Livina (L10) (2013-2016) (CM6006-L10),7679,в наличии
213,16:03_24-11-2021, Gazer CM5510-A50,6609,в наличии
214,16:03_24-11-2021, Gazer Honda CRV (RM4) (2012-2016) (CM6510-RM4),8819,в наличии
215,16:03_24-11-2021, Gazer VW Jetta (162) (2013-2016) (CM5510-162),7109,в наличии
216,16:03_24-11-2021, Gazer VW Tiguan (AD1) (2016-2017) (CM5510-AD1),7079,в наличии
217,16:03_24-11-2021, Gazer Mercedes R (W251) (2005-2013) (CM6007-W251),9719,в наличии
218,16:03_24-11-2021, Gazer ММ-система Gazer Honda CRV (RM4) (2012-2016) (CM5007-RM4),11119,в наличии
219,16:03_24-11-2021, Gazer Honda CRV (RM4) (2012-2016) (CM5510-RM4),6809,в наличии
220,16:03_24-11-2021, Gazer Hyundai IX35 (EL) (2010-2015) (CM6509-EL),8379,в наличии
221,16:03_24-11-2021, Gazer ММ-система Gazer Kia Mohave (QV) (2007-2012) (CM5007-QV),6679,в наличии
222,16:03_24-11-2021, Gazer Renault Kadjar (CMF) (2015-2017) (CM5510-CMF),7099,в наличии
223,16:03_24-11-2021, Gazer Skoda Yeti (5L) - auto conditi oner (2009-2013) (CM6510-5LA),8499,в наличии
224,16:03_24-11-2021,Null,-,-
225,16:03_24-11-2021, Gazer Kia Carens (FG) (2013-2017) (CM6008-RP),16572,в наличии
226,16:03_24-11-2021, Gazer Hyundai i20 (GB) (2014-2017) (CM6008-GB),8509,в наличии
227,16:03_24-11-2021, Gazer Toyota Camry (V55) (2015-2017) (CM6510-V55),8489,в наличии
228,16:03_24-11-2021, Gazer ММ-система Gazer CM7012-J150H (CM7012-J150H),9849,в наличии
229,16:03_24-11-2021, Gazer CM5510-J150N,8329,в наличии
230,16:03_24-11-2021, Gazer CM6510-TLN,7879,в наличии
231,16:03_24-11-2021," Gazer Honda Fit (GP), Jazz (2014-2017) (CM6510-GP)",8459,в наличии
232,16:03_24-11-2021, Gazer Skoda Yeti (5L) - manual condi tioner (2009-2013) (CM6510-5LM),8499,в наличии
233,16:03_24-11-2021, Gazer CM6509-CM,8839,в наличии
234,16:03_24-11-2021, Gazer CM6510-J150N,9889,в наличии
235,16:03_24-11-2021, Gazer ММ-система Gazer Hyundai i10 (PA) (2007-2013) (CM5007-PA),6269,в наличии
236,16:03_24-11-2021, Gazer Hyundai i20 (GB) (2014-2017) (CM5008-GB),7109,в наличии
237,16:03_24-11-2021, Gazer Kia Sorento (KX7) (2017) (CM6510-KX7),8269,в наличии
238,16:03_24-11-2021, Gazer ММ-система Gazer Nissan Livina (L10) (2013-2016 ) (CM5006-L10),6269,в наличии
239,16:03_24-11-2021, Gazer ММ-система Gazer Toyota Universal (2001-2012) (CM5006-120F),6289,в наличии
240,16:03_24-11-2021, Gazer ММ-система Gazer Toyota Yaris (P170) (2016-2017) CM6509-P170 (CM6509-P170),8509,в наличии
241,16:03_24-11-2021, Gazer Honda Civic (FB2) (2013-2016) (CM6509-FB2),13540,в наличии
242,16:03_24-11-2021," Gazer Honda Fit (GP), Jazz (2014-2017) (CM5510-GP)",7059,в наличии
243,16:03_24-11-2021, Gazer Toyota Hilux (N8) (2015-2017) (CM5509-N8),13899,в наличии
244,16:03_24-11-2021, Gazer ММ-система Gazer Toyota Yaris (P150) (2013-2016 ) (CM5007-P150),6929,в наличии
245,16:03_24-11-2021, Gazer CM6007-K14,7199,в наличии
246,16:03_24-11-2021, Gazer ММ-система Gazer Nissan Patrol (Y62) (2010-2015) CM6508-Y62 (CM6508-Y62),9539,в наличии
247,16:03_24-11-2021, Gazer Toyota Corolla (E150) (2013-2016) (CM6009-E150),13270,в наличии
248,16:03_24-11-2021, Gazer AUDI A4 (2002-2008) (CM5007-8E),6609,нет в наличии
249,16:03_24-11-2021,Null,-,-
250,16:03_24-11-2021, Gazer ММ-система Gazer CM7012-BE (CM7012-BE),10199,нет в наличии
251,16:03_24-11-2021," Gazer Chevrolet Cruze (J300), Lacetti (2008-2011) (CM5007-J300)",6609,нет в наличии
252,16:03_24-11-2021, Gazer Kia Ceed (ED) (2007-2012) (CM6007-ED),19300,нет в наличии
253,16:03_24-11-2021, Gazer Ford Edge (U387) (2015-2017) (CM7012-U387),22392,нет в наличии
254,16:03_24-11-2021," Gazer Mercedes A (W168), C (W203), E (W210), CLK(W209) (CM5007-W163)",8099,нет в наличии
255,16:03_24-11-2021, Gazer VW Passat B7 (362) (2010-2014) (CM5510-362),5229,нет в наличии
256,16:03_24-11-2021, к фото/видео Gazer 40c (3.7V 500mAh) (40c),368,нет в наличии
257,16:03_24-11-2021, Gazer Hyundai i40 (VF) (2011-2016) (CM6007-VF),8219,нет в наличии
258,16:03_24-11-2021, Gazer ММ-система Gazer Hyundai Accent (RB) (2010-2015 ) (CM5007-RB),13899,нет в наличии
259,16:03_24-11-2021, Gazer Skoda Rapid (NK3) (2013-2016) (CM5008-NK3),6319,нет в наличии
260,16:03_24-11-2021, Gazer SsangYong Korando (CKN) (2013- 2016) (CM5008-CKN),6689,нет в наличии
261,16:03_24-11-2021," Gazer Chevrolet Epica, Captiva, Aveo (2002-2011) (CM6007-T200)",15992,нет в наличии
262,16:03_24-11-2021, Gazer Hyundai Sonata (LF) (2015-2017) (CM5510-LF),8119,нет в наличии
263,16:03_24-11-2021, Gazer Hyundai Sonata (LF) (2015-2017) (CM6510-LF),9189,нет в наличии
264,16:03_24-11-2021, Gazer Toyota Camry (V50) - USA (2012 -2015) (CM6008-V50USA),8329,нет в наличии
265,16:03_24-11-2021, Gazer Mazda CX-5 (KE) (2012-2016) (CM6509-KE),8169,нет в наличии
266,16:03_24-11-2021, Gazer Hyundai Elantra (MD) (2011-2016) (CM7010-MD),10589,нет в наличии
267,16:03_24-11-2021, Gazer F155,4199,нет в наличии
268,16:03_24-11-2021, Gazer Toyota Corolla (E140) (2006-2012) (CM6509-E140),8489,нет в наличии
269,16:03_24-11-2021, Gazer ММ-система Gazer VW Touareg (7L) (2002-2010) (CM5007-7L),5989,нет в наличии
270,16:03_24-11-2021, Gazer ММ-система Gazer Subaru Forester (S12) (2007-2012) (CM5007-S12),6809,нет в наличии
271,16:03_24-11-2021, Gazer Honda Civic (FA) (2006-2011) (CM5510-FA),7099,нет в наличии
