Name,Data,,Price,Nal
 Gazer TV32-HS2G,11:41_17-12-2021,,6499,в наличии
 Gazer TV24-HS2G,11:41_17-12-2021,,5599,в наличии
 Gazer TV43-US2G,11:41_17-12-2021,,14599,в наличии
" Gazer Nissan Qashqai, X-Trail (2013- 2016) (CM7012-J11)",11:41_17-12-2021,,9079,в наличии
 Gazer Toyota Camry (V40) (2007-2011) (CM6008-V40),11:41_17-12-2021,,9169,в наличии
 Gazer F125 (3694553),11:41_17-12-2021,,2599,в наличии
 Gazer Ford Kuga (MA) - low version (2013-2017) (CM7012-MA),11:41_17-12-2021,,10239,в наличии
 Gazer Mercedes ML (W164) (2005-2013) (CM5007-W164),11:41_17-12-2021,,8619,в наличии
 Gazer F750w,11:41_17-12-2021,,9999,в наличии
 Gazer Kia Sportage (SL) (2010-2015) (CM5008-SL),11:41_17-12-2021,,7109,в наличии
" Gazer Nissan Tiida, Qashqai, X-Trail , Patrol (CM6006-SC11)",11:41_17-12-2021,,7949,в наличии
GPS-модуль Gazer ACG750,11:41_17-12-2021,,999,в наличии
 Gazer AUDI A3 (2003-2008) (CM6007-8P),11:41_17-12-2021,,7329,в наличии
 Gazer Kia Ceed (JD) (2011-2017) (CM5008-JD),11:41_17-12-2021,,5219,в наличии
 Gazer Toyota Camry (V50) - USA (2012 -2015) (CM5008-V50USA),11:41_17-12-2021,,5009,в наличии
 Gazer Система кругового обзора CKR4400 (CKR4400),11:41_17-12-2021,,9999,в наличии
 Gazer MUW5000,11:41_17-12-2021,,5999,в наличии
 Gazer Toyota Prado (J120) (2002-2009) (CM6007-TYT),11:41_17-12-2021,,6709,в наличии
 Gazer Toyota Prado (J120) (2002-2009) (CM5509-TYT),11:41_17-12-2021,,7359,в наличии
 Gazer TV55-US2G,11:41_17-12-2021,,17999,в наличии
 Gazer CF730-IN,11:41_17-12-2021,,1499,в наличии
 Gazer F118 (2758080),11:41_17-12-2021,,1799,в наличии
 Gazer VW Passat B8 (3G2) (2014-2017) (CM7010-3G2),11:41_17-12-2021,,10619,в наличии
 Gazer Hyundai Accent (RB) (2010-2015) (CM5509-RB),11:41_17-12-2021,,6639,в наличии
Null,11:41_17-12-2021,,-,-
 Gazer Toyota LC 200 (J200) (2007-2015) (CM7012-J200),11:41_17-12-2021,,10519,в наличии
 Gazer ММ-система Gazer Kia Cerato (LD) (2003-2009) (CM5006-LD),11:41_17-12-2021,,5679,в наличии
 Gazer Toyota Highlander (XU40) (2008 -2015) (CM6510-XU40),11:41_17-12-2021,,9169,в наличии
 Gazer VW Touareg (7P5) (2010-2016) (CM6508-7P5),11:41_17-12-2021,,7759,в наличии
 Gazer F155,11:41_17-12-2021,,4989,в наличии
 Gazer Kia Ceed (JD) (2011-2017) (CM6008-JD),11:41_17-12-2021,,8829,в наличии
 Gazer Kia Optima (JF) (2015-2017) (CM6510-JF),11:41_17-12-2021,,8809,в наличии
 Gazer CM5007-K14,11:41_17-12-2021,,6149,в наличии
 Gazer Hyundai Tucson (TL) (2015-2017) (CM5510-TL),11:41_17-12-2021,,7319,в наличии
 Gazer Hyundai Tucson (TL) (2015-2017) (CM6008-TL),11:41_17-12-2021,,8849,в наличии
 Gazer ММ-система Gazer Mazda 3 (BK) (2004-2009) (CM5007-BK),11:41_17-12-2021,,7359,в наличии
 Gazer Toyota Camry 2018+ (CM6510-V70),11:41_17-12-2021,,7489,в наличии
 Gazer Skoda Octavia A7 (5E3) (2013-2 016) (CM5008-5E3),11:41_17-12-2021,,7949,в наличии
 Gazer Subaru Forester (S13) (2015-2017) (CM6509-S13),11:41_17-12-2021,,7289,в наличии
 Gazer VW Tiguan (AD1) (2016-2017) (CM6510-AD1),11:41_17-12-2021,,8799,в наличии
 Gazer Hyundai Santa Fe (DM) (2012-2016) (CM6008-DM),11:41_17-12-2021,,8459,в наличии
 Gazer Hyundai Santa Fe (CM) (2006-2012) (CM6006-CM),11:41_17-12-2021,,8169,в наличии
 Gazer ММ-система Gazer Nissan Livina (L10) (2013-2016 ) (CM5006-L10),11:41_17-12-2021,,4879,в наличии
 Gazer Skoda Octavia A7 (5E3) (2013-2016) (CM5510-5E3),11:41_17-12-2021,,7489,в наличии
 Gazer Toyota RAV 4 (A40) (2013-2016) (CM5008-A40),11:41_17-12-2021,,5529,в наличии
 Gazer VW Passat B8 (3G2) (2014-2017) (CM6008-3G2),11:41_17-12-2021,,8839,в наличии
 Gazer ММ-система Gazer Renault Duster (HSAM) (2010-20 16) (CM5007-HSAM),11:41_17-12-2021,,7349,в наличии
 Gazer Kia Sorento (UM) (2015-2017) (CM6008-UM),11:41_17-12-2021,,8539,в наличии
 Gazer Subaru Forester (S12) (2007-2012) (CM6007-S12),11:41_17-12-2021,,8259,в наличии
Null,11:41_17-12-2021,,-,-
 Gazer F715,11:41_17-12-2021,,1699,в наличии
 Gazer MUW7000,11:41_17-12-2021,,8999,в наличии
" Gazer BMW 5 (E39), X5 (E53) (1996-2004) (CM6007-E39)",11:41_17-12-2021,,9509,в наличии
 Gazer ММ-система Gazer Hyundai H1 (TQ) (2007-2012) (CM5006-TQ),11:41_17-12-2021,,6839,в наличии
 Gazer Mazda 3 (BK) (2004-2009) (CM6007-BK),11:41_17-12-2021,,8189,в наличии
" Gazer Chevrolet Cruze (J350), Lacett i (2013-2017) (CM5008-J350)",11:41_17-12-2021,,7089,в наличии
 Gazer Hyundai IX35 (EL) (2010-2015) (CM5509-EL),11:41_17-12-2021,,7359,в наличии
 Gazer Kia Sportage (QL) (2015-2017) (CM6008-QL),11:41_17-12-2021,,7379,в наличии
" Gazer Renault Captur, Clio (KR0) - A C (2011-2015) (CM5509-KR0A)",11:41_17-12-2021,,5509,в наличии
 Gazer VW Golf VII (BE1) (2014-2017) (CM6510-BE1),11:41_17-12-2021,,8809,в наличии
 Gazer ММ-система Gazer VW Passat B5 (3B) (2000-2005) (CM5007-3B),11:41_17-12-2021,,8839,в наличии
 Gazer Opel Astra (K) (2014-2017) (CM5509-GS),11:41_17-12-2021,,7349,в наличии
 Gazer Toyota Camry (V50) - USA (2012 -2015) (CM6008-V50USA),11:41_17-12-2021,,8629,в наличии
 Gazer Porsche Macan (2014-2017) (CM7010-MCN),11:41_17-12-2021,,10579,в наличии
 Gazer Suzuki SX-4 (EYB) (2006-2013) (CM5008-EYB),11:41_17-12-2021,,8699,в наличии
 Gazer Toyota RAV 4 (A40) (2013-2016) (CM5510-A40),11:41_17-12-2021,,5649,в наличии
 Gazer VW Passat B8 (3G2) (2014-2017) (CM5510-3G2),11:41_17-12-2021,,7409,в наличии
" Gazer ММ-система Gazer Skoda Octavia A5, Fabia, Super b (2005-2012 (CM5007-1Z3)",11:41_17-12-2021,,15129,в наличии
 Gazer Jeep Commander (XK) (2007-2012) (CM6007-XK),11:41_17-12-2021,,8479,в наличии
 Gazer VW Golf VII (BE1) (2014-2017) (CM5510-BE1),11:41_17-12-2021,,7359,в наличии
 Gazer VW Jetta (162) (2013-2016) (CM5510-162),11:41_17-12-2021,,7369,в наличии
 Gazer VW Jetta (162) (2013-2016) (CM6510-162),11:41_17-12-2021,,12999,в наличии
 Gazer ММ-система Gazer Ford Fiesta (JJ) (2008-2014) (CM5007-JJ),11:41_17-12-2021,,8809,в наличии
 Gazer Honda Civic (FB4) (2016-2017) (CM6509-FB4),11:41_17-12-2021,,8369,в наличии
Null,11:41_17-12-2021,,-,-
 Gazer ММ-система Gazer Hyundai i40 (VF) (2011-2016) (CM5007-VF),11:41_17-12-2021,,8969,в наличии
" Gazer VW Touareg (7P6), 2016-2017(on ly instead RCD550) (CM5508-7P6)",11:41_17-12-2021,,9479,в наличии
 Gazer TV49-US2G,11:41_17-12-2021,,14999,в наличии
 Gazer Mazda CX-5 (KE) (2012-2016) (CM5509-KE),11:41_17-12-2021,,5149,в наличии
 Gazer Toyota LC 100 (J100) (1998-2007) (CM5008-J100),11:41_17-12-2021,,6979,в наличии
 Gazer Porsche Cayenne (955) (2002-2009) (CM6007-955),11:41_17-12-2021,,9109,в наличии
 Gazer VW Polo (614) (2016-2017) (CM6510-614),11:41_17-12-2021,,8879,в наличии
 Gazer Honda Civic (FA) (2006-2011) (CM6510-FA),11:41_17-12-2021,,8909,в наличии
 Gazer Nissan Murano (Z52R) (2015-2017) (CM6510-Z52R),11:41_17-12-2021,,8809,в наличии
 Gazer Toyota Camry (V55) (2015-2017) (CM7012-V55),11:41_17-12-2021,,10239,в наличии
 Gazer ММ-система Gazer Peugeot 408 (2010-2013) (CM5007-408W),11:41_17-12-2021,,7349,в наличии
 Gazer Toyota Prius C (NHP10) (2011-2014) (CM6006-NHP10),11:41_17-12-2021,,8849,в наличии
 Gazer Kia Sorento (XM10) (2010-2012) (CM6007-XM10),11:41_17-12-2021,,18029,в наличии
 Gazer Renault Duster (HSAM) (2010-2016) (CM6007-HSAM),11:41_17-12-2021,,8379,в наличии
 Gazer Toyota Camry (V50) (2012-2015) (CM5510-V50),11:41_17-12-2021,,8819,в наличии
 Gazer ММ-система Gazer Toyota Hilux (N5) (2012-2015) (CM5006-N5),11:41_17-12-2021,,4819,в наличии
" Gazer ММ-система Gazer Mitsubishi Outlander (GFW), AS X, Lancer, 2 (CM5006-GFW)",11:41_17-12-2021,,7349,в наличии
 Gazer Hyundai Elantra (UD) (2016-2017) (CM7010-UD),11:41_17-12-2021,,7939,в наличии
 Gazer Opel Astra (K) (2014-2017) (CM6509-GS),11:41_17-12-2021,,8779,в наличии
 Gazer Suzuki SX-4 (JY) (2013-2016) (CM6008-JY),11:41_17-12-2021,,9019,в наличии
 Gazer Toyota Prado (J150) (2010-2013) (CM7012-J150),11:41_17-12-2021,,10179,в наличии
" Gazer BMW 5 (E39), X5 (E53) (1996-2004) (CM5007-E39)",11:41_17-12-2021,,8389,в наличии
 Gazer VW Polo (614) (2016-2017) (CM5510-614),11:41_17-12-2021,,7429,в наличии
 Gazer Mercedes R (W251) (2005-2013) (CM6007-W251),11:41_17-12-2021,,10079,в наличии
Null,11:41_17-12-2021,,-,-
 Gazer ММ-система для Chevrolet Aveo (2011-2016) (CM5008-T300),11:41_17-12-2021,,5529,в наличии
" Gazer Toyota Prado, LC150 - High/Low level (CM6510-J150H/L)",11:41_17-12-2021,,6959,в наличии
 Gazer Toyota Prius (XW50) (2014-2017) (CM6008-XW50),11:41_17-12-2021,,6419,в наличии
 Gazer Toyota RAV 4 (A30) (2006-2012) (CM6510-A30),11:41_17-12-2021,,8529,в наличии
 Gazer Honda CRV (RM4) (2012-2016) (CM6007-RM4),11:41_17-12-2021,,7789,в наличии
 Gazer Hyundai Sonata (LF) (2015-2017) (CM5510-LF),11:41_17-12-2021,,8429,в наличии
 Gazer Renault Kadjar (CMF) (2015-2017) (CM6510-CMF),11:41_17-12-2021,,8869,в наличии
 Gazer Suzuki Swift (ZD) (2004-2010) (CM5510-ZD),11:41_17-12-2021,,7369,в наличии
 Gazer Toyota Camry (V55) (2015-2017) (CM5008-V55),11:41_17-12-2021,,7409,в наличии
 Gazer Honda Civic (FB4) (2016-2017) (CM5509-FB4),11:41_17-12-2021,,7319,в наличии
 Gazer CM6509-V40F,11:41_17-12-2021,,6489,в наличии
" Gazer Mitsubishi Outlander (GFW), AS X, Lancer, 2013 (CM6006-GFW)",11:41_17-12-2021,,8149,в наличии
 Gazer Toyota Yaris (P170) (2016-2017) (CM6009-P170),11:41_17-12-2021,,8279,в наличии
 Gazer ММ-система Gazer Fiat Bravo (198) (2007-2015) (CM5007-198),11:41_17-12-2021,,7339,в наличии
 Gazer Hyundai H1 (TQ) (2007-2012) (CM6006-TQ),11:41_17-12-2021,,8789,в наличии
 Gazer Skoda Octavia A7 (5E3) (2013-2016) (CM6510-5E3),11:41_17-12-2021,,9169,в наличии
 Gazer SsangYong Rexton (W2) (2013-2017) (CM6007-W2),11:41_17-12-2021,,8979,в наличии
 Gazer Toyota Camry (V55) (2015-2017) (CM6008-V55),11:41_17-12-2021,,6159,в наличии
 Gazer Toyota Highlander (XU50) (2015 -2017) (CM6510-XU50),11:41_17-12-2021,,8739,в наличии
 Gazer VW Golf VII (BE1) (2014-2017) (CM7010-BE1),11:41_17-12-2021,,10499,в наличии
 Gazer Mitsubishi Outlander (GFW) (20 14-2017) (CM6008-GFW),11:41_17-12-2021,,18039,в наличии
" Gazer Chevrolet Cruze (J350), Lacett i (2013-2017) (CM6509-J350)",11:41_17-12-2021,,8809,в наличии
" Gazer Mitsubishi Lancer (2007-2013), ASX (2007-2010) (CM5510-ASX10)",11:41_17-12-2021,,15789,в наличии
 Gazer Mitsubishi Pajero (V9W) (2016-2017) (CM6509-V9W),11:41_17-12-2021,,8849,в наличии
Null,11:41_17-12-2021,,-,-
 Gazer Gazer AUDI TT (2006-2011) (CM5007-8J),11:41_17-12-2021,,7319,в наличии
 Gazer Toyota Hilux (N5) (2012-2015) (CM6006-N5),11:41_17-12-2021,,8129,в наличии
 Gazer Kia Sportage (QL) (2015-2017) (CM6509-QL),11:41_17-12-2021,,9659,в наличии
 Gazer Toyota LC 100 (J100) (1998-2007) (CM6008-J100),11:41_17-12-2021,,6909,в наличии
 Gazer Toyota LC 200 (J200) (2007-2015) (CM6510-J200),11:41_17-12-2021,,8269,в наличии
 Gazer ММ-система Gazer Porsche Cayenne (955) (2002-20 09) (CM5007-955),11:41_17-12-2021,,7869,в наличии
 Gazer ММ-система Gazer Toyota Auris (E180) (2006-2012 ) (CM5007-E180),11:41_17-12-2021,,15099,в наличии
 Gazer Toyota Corolla (E150) (2013-2016) (CM6510-E150),11:41_17-12-2021,,8979,в наличии
 Gazer Toyota RAV 4 (A40) (2013-2016) (CM6008-A40),11:41_17-12-2021,,8569,в наличии
 Gazer Toyota Universal (2001-2012) (CM6006-120F),11:41_17-12-2021,,6179,в наличии
 Gazer Ford Kuga (MA) - low version ( 2013-2017) (CM5510-MA),11:41_17-12-2021,,7149,в наличии
 Gazer VW Tiguan (AD1) (2016-2017) (CM5510-AD1),11:41_17-12-2021,,7339,в наличии
 Gazer CM5510-TLN,11:41_17-12-2021,,6849,в наличии
 Gazer ММ-система Gazer Honda CRV (RM4) (2012-2016) (CM5007-RM4),11:41_17-12-2021,,6719,в наличии
 Gazer Hyundai IX35 (EL) (2010-2015) (CM6509-EL),11:41_17-12-2021,,8689,в наличии
 Gazer Kia Rio (UB15) (2015-2017) (CM6008-UB15),11:41_17-12-2021,,8849,в наличии
 Gazer Renault Kadjar (CMF) (2015-2017) (CM5510-CMF),11:41_17-12-2021,,7359,в наличии
 Gazer Skoda Yeti (5L) - auto conditi oner (2009-2013) (CM5510-5LA),11:41_17-12-2021,,7359,в наличии
 Gazer Toyota Highlander (XU50) (2015 -2017) (CM6009-XU50),11:41_17-12-2021,,10649,в наличии
" Gazer Toyota Prado, LC150 - High/Low level (CM5510-J150H/L)",11:41_17-12-2021,,8469,в наличии
 Gazer Toyota Yaris (P150) (2013-2016) (CM6510-P150),11:41_17-12-2021,,6429,в наличии
 Gazer CM6508-MGH,11:41_17-12-2021,,18139,в наличии
 Gazer Toyota Camry (V55) (2015-2017) (CM5510-V55),11:41_17-12-2021,,7359,в наличии
 Gazer Toyota RAV 4 (A40) (2013-2016) (CM6510-A40),11:41_17-12-2021,,6229,в наличии
Null,11:41_17-12-2021,,-,-
 Gazer VW Touran (5T1) (2016-2017) (CM6510-5T1),11:41_17-12-2021,,8909,в наличии
 Gazer BMW 3 (E46) (1998-2004) (CM6007-E46),11:41_17-12-2021,,8299,в наличии
 Gazer Hyundai Santa Fe (DM) (2012-2016) (CM5509-DM),11:41_17-12-2021,,5509,в наличии
 Gazer Mitsubishi Pajero (V9W) (2016- 2017) (CM5008-V9W),11:41_17-12-2021,,6889,в наличии
 Gazer Nissan Navara (D40) (2014-2017) (CM6008-D40),11:41_17-12-2021,,8829,в наличии
 Gazer Renault Megane (BMO) (2002-2009) (CM6007-BMO),11:41_17-12-2021,,20900,в наличии
 Gazer Toyota Prado (J150) (2010-2013) (CM5510-J150),11:41_17-12-2021,,5999,в наличии
 Gazer Toyota Universal (2001-2012) (CM6006-120),11:41_17-12-2021,,5789,в наличии
 Gazer Kia Sorento (KX7) (2017) (CM6510-KX7),11:41_17-12-2021,,6439,в наличии
 Gazer ММ-система Gazer Mazda CX-7 (ER) (2006-2012) (CM5007-ER),11:41_17-12-2021,,12719,в наличии
 Gazer BYD F3 (2007-2012) (CM5006-BF3),11:41_17-12-2021,,7329,в наличии
 Gazer Kia Mohave (QV) (2007-2012) (CM6007-QV),11:41_17-12-2021,,8809,в наличии
" Gazer Mazda CX-5 (KE), 6 (GJ) (2012- 2016) (CM5008-KE)",11:41_17-12-2021,,6929,в наличии
 Gazer Toyota LC 200 (J200N) (2016-2017) (CM7012-J200N),11:41_17-12-2021,,7649,в наличии
 Gazer CM5509-RE,11:41_17-12-2021,,6609,в наличии
" Gazer ММ-система Gazer Ford Fuison, Explorer, Mustang , Edge, Esca (CM5007-JU)",11:41_17-12-2021,,7349,в наличии
 Gazer Honda CRV (RM4) (2012-2016) (CM5510-RM4),11:41_17-12-2021,,4539,в наличии
 Gazer Honda Civic (FB4) (2016-2017) (CM7010-FB4),11:41_17-12-2021,,10939,в наличии
 Gazer ММ-система Gazer Hyundai i10 (BA) (2013-2016) (CM5007-BA),11:41_17-12-2021,,7369,в наличии
 Gazer ММ-система Gazer Kia Mohave (QV) (2007-2012) (CM5007-QV),11:41_17-12-2021,,6939,в наличии
 Gazer Toyota Prado (J150) (2010-2013) (CM6008-J150),11:41_17-12-2021,,8849,в наличии
 Gazer ММ-система Gazer Hyundai i20 (PB) (2008-2013) (CM5006-PB),11:41_17-12-2021,,4739,в наличии
 Gazer Kia Sportage (QL) (2015-2017) (CM5509-QL),11:41_17-12-2021,,15109,в наличии
 Gazer Skoda Fabia (NJ) (2015-2017) (CM6509-NJ),11:41_17-12-2021,,8489,в наличии
Null,11:41_17-12-2021,,-,-
 Gazer Toyota Camry (V55) (2015-2017) (CM6510-V55),11:41_17-12-2021,,8809,в наличии
 Gazer ММ-система Gazer CM7012-J150H (CM7012-J150H),11:41_17-12-2021,,10209,в наличии
 Gazer VW Touareg (7P6) (2016-2017)(only instead RCD550) (CM6508-7P6),11:41_17-12-2021,,10879,в наличии
 Gazer Honda Civic (FG) (2011-2013) (CM6510-FG),11:41_17-12-2021,,8479,в наличии
 Gazer ММ-система Gazer Honda Jazz (GE6) (2007-2013) (CM5007-GE6),11:41_17-12-2021,,7359,в наличии
 Gazer Kia Cereato (YD) (2015-2017) (CM5008-YD),11:41_17-12-2021,,7379,в наличии
 Gazer Kia Cereato (YD) (2015-2017) (CM6510-YD),11:41_17-12-2021,,8799,в наличии
 Gazer Kia Sorento (KX7) (2017) (CM5510-KX7),11:41_17-12-2021,,7349,в наличии
 Gazer Skoda Yeti (5L) - manual condi tioner (2009-2013) (CM6510-5LM),11:41_17-12-2021,,8809,в наличии
 Gazer CM6510-J150N,11:41_17-12-2021,,8279,в наличии
 Gazer Hyundai i10 (BA) (2013-2016) (CM6007-BA),11:41_17-12-2021,,8829,в наличии
 Gazer Lada Vesta (2015-2017) (CM6008-VST),11:41_17-12-2021,,7949,в наличии
 Gazer Nissan Livina (L10) (2013-2016) (CM6006-L10),11:41_17-12-2021,,7959,в наличии
 Gazer Suzuki Swift (ZCS) (2011-2016) (CM5007-ZCS),11:41_17-12-2021,,7359,в наличии
 Gazer Toyota LC 200 (J200) (2007-2015) (CM5510-J200),11:41_17-12-2021,,5579,в наличии
" Gazer Toyota Prado, LC150 - Low leve l (2014-2016) (CM5009-J150L)",11:41_17-12-2021,,6859,в наличии
 Gazer ММ-система Gazer Toyota Universal (2001-2012) (CM5006-120F),11:41_17-12-2021,,4889,в наличии
 Gazer CM5510-A50,11:41_17-12-2021,,6849,в наличии
 Gazer Honda Civic (FB2) (2013-2016) (CM6509-FB2),11:41_17-12-2021,,13741,в наличии
 Gazer Honda CRV (RM4) (2012-2016) (CM6510-RM4),11:41_17-12-2021,,9149,в наличии
 Gazer Peugeot 408 (2010-2013) (CM6007-408W),11:41_17-12-2021,,8809,в наличии
 Gazer Skoda Yeti (5L) - auto conditi oner (2009-2013) (CM6510-5LA),11:41_17-12-2021,,8809,в наличии
 Gazer Toyota LC 200 (J200) (2007-2015) (CM5008-J200),11:41_17-12-2021,,12989,в наличии
 Gazer CM6509-RE,11:41_17-12-2021,,14539,в наличии
Null,11:41_17-12-2021,,-,-
 Gazer Kia Carens (FG) (2013-2017) (CM6008-RP),11:41_17-12-2021,,16572,в наличии
 Gazer Hyundai i20 (GB) (2014-2017) (CM6008-GB),11:41_17-12-2021,,6619,в наличии
 Gazer Kia Sorento (UM) (2015-2017) (CM5008-UM),11:41_17-12-2021,,11029,в наличии
 Gazer Opel Corsa E (B1) (2014-2017) (CM6008-B1),11:41_17-12-2021,,15749,в наличии
 Gazer ММ-система Gazer Toyota Corolla (E150) (2013-2016) (CM5007-E150),11:41_17-12-2021,,7359,в наличии
 Gazer Toyota Prius (XW50) (2014-2017) (CM5008-XW50),11:41_17-12-2021,,7379,в наличии
 Gazer ММ-система Gazer Toyota Venza (GV10) (2008-2016 ) (CM5007-GV10),11:41_17-12-2021,,15899,в наличии
 Gazer CM5510-J150N,11:41_17-12-2021,,13479,в наличии
" Gazer Honda Fit (GP), Jazz (2014-2017) (CM6510-GP)",11:41_17-12-2021,,8769,в наличии
 Gazer Kia Sportage (SL) (2010-2015) (CM5509-SL),11:41_17-12-2021,,8619,в наличии
 Gazer Nissan Patrol (Y62) (2010-2015) (CM6008-Y62),11:41_17-12-2021,,9899,в наличии
 Gazer Suzuki Swift (ZCS) (2011-2016) (CM6007-ZCS),11:41_17-12-2021,,8809,в наличии
 Gazer Toyota Corolla (E150) (2013-2016) (CM6007-E150),11:41_17-12-2021,,8819,в наличии
 Gazer CM5509-KX5,11:41_17-12-2021,,12269,в наличии
 Gazer CM6509-KX5,11:41_17-12-2021,,18729,в наличии
 Gazer Ford F150 (XII) (2009-2014) (CM5008-XII),11:41_17-12-2021,,17899,в наличии
 Gazer Ford Kuga (MA) - low version (2013-2017) (CM6510-MA),11:41_17-12-2021,,8449,в наличии
 Gazer ММ-система Gazer Hyundai i10 (PA) (2007-2013) (CM5007-PA),11:41_17-12-2021,,6499,в наличии
 Gazer Hyundai i20 (GB) (2014-2017) (CM5008-GB),11:41_17-12-2021,,5529,в наличии
 Gazer Toyota Yaris (P170) (2016-2017) (CM5009-P170),11:41_17-12-2021,,6969,в наличии
 Gazer ММ-система Gazer Toyota Yaris (P170) (2016-2017) CM6509-P170 (CM6509-P170),11:41_17-12-2021,,8819,в наличии
 заднего вида Gazer CC207,11:41_17-12-2021,,1599,в наличии
 Gazer ММ-система Gazer Universal 6.2 - 170x96 (CM5006-100D),11:41_17-12-2021,,9776,в наличии
" Gazer Honda Fit (GP), Jazz (2014-2017) (CM5510-GP)",11:41_17-12-2021,,7319,в наличии
Null,11:41_17-12-2021,,-,-
 Gazer Jeep Commander (XKN) (2016-2017) (CM6510-XKN),11:41_17-12-2021,,8849,в наличии
 Gazer Lada Vesta (2015-2017) (CM5008-VST),11:41_17-12-2021,,6499,в наличии
 Gazer Nissan Teana (L33R) (2013-2016) (CM6510-L33R),11:41_17-12-2021,,8809,в наличии
 Gazer Toyota Hilux (N8) (2015-2017) (CM5509-N8),11:41_17-12-2021,,14629,в наличии
 Gazer ММ-система Gazer Toyota Yaris (P150) (2013-2016 ) (CM5007-P150),11:41_17-12-2021,,5389,в наличии
 Gazer CM6007-K14,11:41_17-12-2021,,7469,в наличии
 Gazer ММ-система Gazer Nissan Patrol (Y62) (2010-2015) CM6508-Y62 (CM6508-Y62),11:41_17-12-2021,,9889,в наличии
 Gazer Toyota Corolla (E150) (2013-2016) (CM6009-E150),11:41_17-12-2021,,13270,в наличии
 к фото/видео Gazer 40c (3.7V 500mAh) (40c),11:41_17-12-2021,,368,нет в наличии
" Gazer Ford Focus, Mondeo, Connect, S -Max (2004-2010) (CM6007-DB)",11:41_17-12-2021,,8639,нет в наличии
 Gazer Fiat Doblo (263) (2015-2017) (CM6007-263),11:41_17-12-2021,,8199,нет в наличии
 Gazer Ford Focus (BK) (2015-2017) (CM5009-BK),11:41_17-12-2021,,7409,нет в наличии
" Gazer Chevrolet Cruze (J300), Lacetti (2008-2011) (CM5007-J300)",11:41_17-12-2021,,6609,нет в наличии
 Gazer Suzuki Swift (ZD) (2004-2010) (CM6510-ZD),11:41_17-12-2021,,9149,нет в наличии
 Gazer Mazda 3 (BL) (2010-2014) (CM5008-BL),11:41_17-12-2021,,7179,нет в наличии
 заднего вида Gazer CC100,11:41_17-12-2021,,1399,нет в наличии
 Gazer ММ-система Gazer Hyundai Elantra (MD) (2011-2016) (CM5007-MD),11:41_17-12-2021,,7409,нет в наличии
 Gazer Peugeot 301 (2014-2017) (CM5510-ELS),11:41_17-12-2021,,6899,нет в наличии
 Gazer ММ-система Gazer CM7012-BE (CM7012-BE),11:41_17-12-2021,,10199,нет в наличии
 Gazer Mazda 6 (GJ) (2012-2016) (CM6509-GJ),11:41_17-12-2021,,8529,нет в наличии
 Gazer TV40-FS2G,11:41_17-12-2021,,10499,нет в наличии
 Gazer ММ-система Gazer CM5007-B14 (CM5007-B14),11:41_17-12-2021,,6649,нет в наличии
" Gazer Ford Fuison, Explorer, Mustang , Edge, Escape II (CM6007-JUF)",11:41_17-12-2021,,8789,нет в наличии
 Gazer CM5509-CW6,11:41_17-12-2021,,6939,нет в наличии
Null,11:41_17-12-2021,,-,-
 Gazer VW Passat B7 (362) (2010-2014) (CM5510-362),11:41_17-12-2021,,5229,нет в наличии
 Gazer Ford Edge (U387) (2015-2017) (CM7012-U387),11:41_17-12-2021,,22392,нет в наличии
 Gazer Jeep Cherokee (KL) (2014-2017) (CM6510-KL),11:41_17-12-2021,,8979,нет в наличии
 Gazer Kia Rio (UB) (2012-2015) (CM6509-UB),11:41_17-12-2021,,8129,нет в наличии
 Gazer Toyota Corolla (E140) (2006-2012) (CM6509-E140),11:41_17-12-2021,,8489,нет в наличии
 Gazer Kia Ceed (ED) (2007-2012) (CM6007-ED),11:41_17-12-2021,,19300,нет в наличии
 Gazer ММ-система Gazer Toyota Yaris (P130) (2011-2013 ) (CM5006-P130),11:41_17-12-2021,,7279,нет в наличии
 Gazer AUDI A4 (2002-2008) (CM5007-8E),11:41_17-12-2021,,6609,нет в наличии
 заднего вида Gazer СС150,11:41_17-12-2021,,1899,нет в наличии
" Gazer Chevrolet Epica, Captiva, Aveo (2002-2011) (CM5007-T200)",11:41_17-12-2021,,7069,нет в наличии
" Gazer Chevrolet Epica, Captiva, Aveo (2002-2011) (CM6007-T200)",11:41_17-12-2021,,15992,нет в наличии
" Gazer Mercedes A (W168), C (W203), E (W210), CLK(W209) (CM5007-W163)",11:41_17-12-2021,,8099,нет в наличии
 Gazer Mitsubishi Lancer (CYA) (2007- 2013) (CM5008-CYA),11:41_17-12-2021,,10122,нет в наличии
 Gazer ММ-система Gazer Mazda CX-7 (ER) (2006-2012) CM5509-ER (CM5509-ER),11:41_17-12-2021,,8829,нет в наличии
 к фото/видео Gazer Gazer AB302 (AB302),11:41_17-12-2021,,205,нет в наличии
 Gazer VW Tiguan (5N2) (2013-2016) (CM6510-5N2),11:41_17-12-2021,,9469,нет в наличии
 Gazer Hyundai i30 (GD) (2012-2016) (CM6007-GD),11:41_17-12-2021,,19990,нет в наличии
 Gazer Mercedes S (W220) (1998-2005) (CM6007-W220),11:41_17-12-2021,,9519,нет в наличии
 Gazer ММ-система Gazer SsangYong Korando (CK) (2010-2 013) (CM5007-CK),11:41_17-12-2021,,7239,нет в наличии
 Gazer VW/Skoda/Seat (2008-2016) (CM6509-T5),11:41_17-12-2021,,21990,нет в наличии
 Gazer Mazda CX-5 (KE) (2012-2016) (CM6509-KE),11:41_17-12-2021,,8169,нет в наличии
 Gazer Toyota Camry (V50) (2012-2015) (CM6008-V50),11:41_17-12-2021,,17592,нет в наличии
 Gazer F230w,11:41_17-12-2021,,3555,нет в наличии
 Gazer Hyundai Elantra (MD) (2011-2016) (CM7010-MD),11:41_17-12-2021,,10589,нет в наличии
Null,11:41_17-12-2021,,-,-
 Gazer SsangYong Korando (CKN) (2013- 2016) (CM5008-CKN),11:41_17-12-2021,,6689,нет в наличии
 Gazer CM6509-CM,11:41_17-12-2021,,9169,нет в наличии
 Gazer CM5510-100U CM5510-100U (CM5510-100U),11:41_17-12-2021,,11801,нет в наличии
Парктроник Gazer PA45F,11:41_17-12-2021,,3399,нет в наличии
 заднего вида Gazer СС120,11:41_17-12-2021,,1599,нет в наличии
