Name,Data,,Price,Nal
" Gazer ММ-система Gazer Ford Focus, Mondeo, Connect, S -Max (2004-2 (CM5007-DB)",11:41_17-12-2021,,7109,нет в наличии
" Gazer Toyota Prado, LC150 - High level, (2014-2016) (CM6008-J150H)",11:41_17-12-2021,,8889,нет в наличии
 Gazer ММ-система Gazer VW Touareg (7L) (2002-2010) (CM5007-7L),11:41_17-12-2021,,5989,нет в наличии
 Gazer VW/Skoda/Seat (2008-2016) (CM5509-T5),11:41_17-12-2021,,15584,нет в наличии
 Gazer ММ-система Gazer Fiat Doblo (152) (2009-2014) (CM5006-152),11:41_17-12-2021,,13899,нет в наличии
 Gazer VW Passat B7 (362) (2010-2014) (CM6510-362),11:41_17-12-2021,,19990,нет в наличии
 Gazer VW Passat B8 (3G2) (2014-2017) (CM5008-3G2),11:41_17-12-2021,,7359,нет в наличии
 Gazer CM5509-CM,11:41_17-12-2021,,15899,нет в наличии
 Gazer CM5510-CR,11:41_17-12-2021,,6609,нет в наличии
 Gazer TV32-FS2G,11:41_17-12-2021,,8399,нет в наличии
 Gazer Toyota Highlander (XU40) (2008 -2015) (CM6008-XU40),11:41_17-12-2021,,19124,нет в наличии
" Gazer Mitsubishi Lancer (2007-2013), ASX (2007-2010) (CM6510-ASX10)",11:41_17-12-2021,,21990,нет в наличии
 Gazer Kia Optima (TF) (2010-2015) (CM6509-TF),11:41_17-12-2021,,8469,нет в наличии
 Gazer Toyota Prado (J120) (2002-2009) (CM6509-TYT),11:41_17-12-2021,,19990,нет в наличии
Парктроник Gazer PA40F,11:41_17-12-2021,,2899,нет в наличии
 для видеонаблюдения Gazer NF304s,11:41_17-12-2021,,1904,нет в наличии
 Gazer F730,11:41_17-12-2021,,4454,нет в наличии
" Gazer Ford Tourneo, Transit (F150) ( 2013-2016) (CM5009-F150)",11:41_17-12-2021,,16999,нет в наличии
" Gazer Chevrolet Cruze (J300), Lacett i, (2008-2012) (CM6007-J300)",11:41_17-12-2021,,8129,нет в наличии
Null,11:41_17-12-2021,,-,-
 Gazer ММ-система Gazer Fiat Doblo (263) (2015-2017) (CM5007-263),11:41_17-12-2021,,15899,нет в наличии
 Gazer Toyota Corolla (E150) (2013-2016) (CM5509-E150),11:41_17-12-2021,,15899,нет в наличии
 Gazer CM6510-TLN,11:41_17-12-2021,,7879,нет в наличии
 Gazer Mazda CX-9 (TB) (2006-2012) CM5507-TB (CM5507-TB),11:41_17-12-2021,,17027,нет в наличии
 Gazer TV65-US2G,11:41_17-12-2021,,26999,нет в наличии
 Gazer Hyundai Elantra (MD) (2011-2016) (CM6007-MD),11:41_17-12-2021,,19990,нет в наличии
 Gazer Hyundai Santa Fe (DM) (2012-2016) (CM6509-DM),11:41_17-12-2021,,7949,нет в наличии
" Gazer Mercedes A, B, Vito, Viano, Sp rinter (2003-2012) (CM6007-W169)",11:41_17-12-2021,,24990,нет в наличии
 Gazer VW Passat B8 (3G2) (2014-2017) (CM6510-3G2),11:41_17-12-2021,,20900,нет в наличии
 Gazer CM6008-250T,11:41_17-12-2021,,13279,нет в наличии
GPS-модуль Gazer ACG230W,11:41_17-12-2021,,999,нет в наличии
 Gazer F115,11:41_17-12-2021,,1925,нет в наличии
 Gazer H515,11:41_17-12-2021,,1178,нет в наличии
 Gazer Fiat Doblo (152) (2009-2014) (CM6006-152),11:41_17-12-2021,,7875,нет в наличии
 Gazer Ford Focus (BK) (2015-2017) (CM6009-BK),11:41_17-12-2021,,19990,нет в наличии
 Gazer Honda CRV (RE) (2006-2011) (CM5008-RE),11:41_17-12-2021,,15899,нет в наличии
 Gazer Hyundai Accent (RB) (2010-2015) (CM6007-RB),11:41_17-12-2021,,17400,нет в наличии
 Gazer Hyundai IX35 (EL) (2010-2015) (CM6007-EL),11:41_17-12-2021,,8489,нет в наличии
 Gazer ММ-система Gazer Kia Optima (JF) (2015-2017) (CM5007-JF),11:41_17-12-2021,,15899,нет в наличии
 Gazer Skoda Rapid (NK3) (2013-2016) (CM5008-NK3),11:41_17-12-2021,,6319,нет в наличии
 Gazer Universal 7 Full touch - 178x100 (CM5507-100H),11:41_17-12-2021,,10015,нет в наличии
Парктроник Gazer PA40R,11:41_17-12-2021,,2899,нет в наличии
 для видеонаблюдения Gazer NA208f,11:41_17-12-2021,,6028,нет в наличии
 Gazer F140,11:41_17-12-2021,,4120,нет в наличии
Null,11:41_17-12-2021,,-,-
 Gazer Hyundai Sonata (YF) (2010-2015) (CM6008-YF),11:41_17-12-2021,,8243,нет в наличии
 Gazer Honda HRV (GH) (2013-2017) (CM6509-GH),11:41_17-12-2021,,17300,нет в наличии
 Gazer Toyota Highlander (XU40) (2008 -2015) (CM5008-XU40),11:41_17-12-2021,,15899,нет в наличии
 Gazer Mitsubishi Outlander (GFW) (20 14-2017) (CM5008-GFW),11:41_17-12-2021,,15899,нет в наличии
 Gazer CM5509-RW,11:41_17-12-2021,,6609,нет в наличии
GPS-модуль Gazer ACG-OBD,11:41_17-12-2021,,1199,нет в наличии
 Gazer AUDI A4 (2002-2008) (CM6007-8E),11:41_17-12-2021,,7874,нет в наличии
 Gazer Ford Kuga (MA) - low version ( 2013-2017) (CM6008-MA),11:41_17-12-2021,,23500,нет в наличии
 Gazer ММ-система Gazer Honda Civic (FA) (2006-2011) (CM5007-FA),11:41_17-12-2021,,15899,нет в наличии
 Gazer Honda Civic (FA) (2006-2011) (CM5510-FA),11:41_17-12-2021,,7099,нет в наличии
 Gazer Hyundai Elantra (UD) (2016-2017) (CM6008-UD),11:41_17-12-2021,,21990,нет в наличии
 Gazer Hyundai Elantra (UD) (2016-2017) (CM6510-UD),11:41_17-12-2021,,19990,нет в наличии
 Gazer ММ-система Gazer Hyundai Santa Fe (CM) (2006-20 12) (CM5007-CM),11:41_17-12-2021,,13000,нет в наличии
 Gazer Hyundai Tucson (TL) (2015-2017) (CM7010-TL),11:41_17-12-2021,,15769,нет в наличии
 Gazer Hyundai i40 (VF) (2011-2016) (CM6007-VF),11:41_17-12-2021,,8219,нет в наличии
 Gazer ММ-система Gazer Jeep Commander (XK) (2007-2012 ) (CM5006-XK),11:41_17-12-2021,,15899,нет в наличии
 Gazer Jeep Grand Cherokee (WK2) (2011-2016) (CM7010-WK2),11:41_17-12-2021,,27990,нет в наличии
 Gazer ММ-система Gazer Kia Picanto (TA) (2011-2017) (CM5007-TA),11:41_17-12-2021,,6279,нет в наличии
 Gazer Kia Picanto (TA) (2011-2017) (CM6007-TA),11:41_17-12-2021,,7689,нет в наличии
 Gazer ММ-система Gazer Kia Soul (PS17) (2014-2017) (CM5007-PS17),11:41_17-12-2021,,13899,нет в наличии
 Gazer Mercedes E (W211) (2002-2011) (CM5007-W211),11:41_17-12-2021,,17899,нет в наличии
" Gazer Nissan Qashqai, X-Trail (2013- 2016) (CM6510-J11)",11:41_17-12-2021,,21990,нет в наличии
 Gazer Mitsubishi Pajero Sport (KHW) (2008-2015) (CM6509-KHW),11:41_17-12-2021,,19990,нет в наличии
 Gazer ММ-система Gazer Renault Megane III (DZO) (2008 -2016) (CM5007-DZO),11:41_17-12-2021,,14999,нет в наличии
Null,11:41_17-12-2021,,-,-
" Gazer ММ-система Gazer SsangYong Actyon, Kyron, Koran do (2005-201 (CM5007-GAB)",11:41_17-12-2021,,15899,нет в наличии
 Gazer Subaru Forester (S13) (2015-2017) (CM5509-S13),11:41_17-12-2021,,13899,нет в наличии
 Gazer Suzuki Grand Vitara (JT) (2005 -2015) (CM5008-JT),11:41_17-12-2021,,14999,нет в наличии
 Gazer Toyota Auris (E180) (2006-2012) (CM6007-E180),11:41_17-12-2021,,20355,нет в наличии
 Gazer ММ-система Gazer Toyota Corolla (E140) (2006-20 12) (CM5007-E140),11:41_17-12-2021,,14387,нет в наличии
 Gazer Toyota Highlander (XU50) (2015 -2017) (CM5009-XU50),11:42_17-12-2021,,15899,нет в наличии
 Gazer Toyota Highlander (XU50) (2015 -2017) (CM5510-XU50),11:42_17-12-2021,,15899,нет в наличии
 Gazer Toyota Tundra (XK50) (2014-2017) (CM6008-XK50),11:42_17-12-2021,,19300,нет в наличии
 Gazer VW Passat B5 (3B) (2000-2005) (CM6007-3B),11:42_17-12-2021,,21990,нет в наличии
 Gazer VW Touareg (7L) (2002-2010) (CM6007-7L),11:42_17-12-2021,,19990,нет в наличии
 Gazer Honda Civic (FB2) (2013-2016) (CM6008-FB2),11:42_17-12-2021,,21990,нет в наличии
 Gazer CM5008-MGH,11:42_17-12-2021,,6670,нет в наличии
 Gazer Mitsubishi Outlander (GFW) (2014-2017) CM5510-GFW (CM5510-GFW),11:42_17-12-2021,,19161,нет в наличии
 Gazer Mitsubishi Pajero Sport (KHW) CM5509-KHW (CM5509-KHW),11:42_17-12-2021,,19161,нет в наличии
 Gazer CM5509-GV CM5509-GV (CM5509-GV),11:42_17-12-2021,,17027,нет в наличии
 Gazer CM6509-GV CM6509-GV (CM6509-GV),11:42_17-12-2021,,23525,нет в наличии
 для видеонаблюдения Gazer NS208rp,11:42_17-12-2021,,3641,нет в наличии
 для видеонаблюдения Gazer NS216rp,11:42_17-12-2021,,5425,нет в наличии
 для видеонаблюдения Gazer NS2216re,11:42_17-12-2021,,5787,нет в наличии
 для видеонаблюдения Gazer NF308m,11:42_17-12-2021,,8143,нет в наличии
 для видеонаблюдения Gazer NF316m,11:42_17-12-2021,,22294,нет в наличии
 для видеонаблюдения Gazer NI416mp,11:42_17-12-2021,,6128,нет в наличии
 для видеонаблюдения Gazer NS104,11:42_17-12-2021,,4653,нет в наличии
 видеонаблюдения Gazer SVC CF200/4 (CF200/4),11:42_17-12-2021,,1993,нет в наличии
Null,11:42_17-12-2021,,-,-
 видеонаблюдения Gazer SVC CF200/8 (CF200/8),11:42_17-12-2021,,2174,нет в наличии
 видеонаблюдения Gazer SVC CF220/4 (CF220/4),11:42_17-12-2021,,1951,нет в наличии
 видеонаблюдения Gazer SVC CF231 (CF231),11:42_17-12-2021,,2174,нет в наличии
 видеонаблюдения Gazer SVC CI201/8 (CI201/8),11:42_17-12-2021,,2074,нет в наличии
 видеонаблюдения Gazer SVC CI213 (CI213),11:42_17-12-2021,,3351,нет в наличии
 видеонаблюдения Gazer SVC CI222/4 (CI222/4),11:42_17-12-2021,,2558,нет в наличии
 видеонаблюдения Gazer SVC CI233 (CI233),11:42_17-12-2021,,3241,нет в наличии
 видеонаблюдения Gazer SVC CS105 (CS105),11:42_17-12-2021,,1045,нет в наличии
 видеонаблюдения Gazer CS137,11:42_17-12-2021,,2290,нет в наличии
 Gazer H521,11:42_17-12-2021,,1339,нет в наличии
 Gazer F117,11:42_17-12-2021,,2777,нет в наличии
 Gazer F735g,11:42_17-12-2021,,3999,нет в наличии
 для видеонаблюдения Gazer NS2208re,11:42_17-12-2021,,3503,нет в наличии
 для видеонаблюдения Gazer NS2216r,11:42_17-12-2021,,10126,нет в наличии
 для видеонаблюдения Gazer NS2232r,11:42_17-12-2021,,17151,нет в наличии
 для видеонаблюдения Gazer NF704r,11:42_17-12-2021,,2038,нет в наличии
 для видеонаблюдения Gazer NI404mp,11:42_17-12-2021,,3770,нет в наличии
 для видеонаблюдения Gazer NP408mp,11:42_17-12-2021,,6952,нет в наличии
 для видеонаблюдения Gazer NF304r,11:42_17-12-2021,,4165,нет в наличии
 видеонаблюдения Gazer SVC CF211 (CF211),11:42_17-12-2021,,2174,нет в наличии
 видеонаблюдения Gazer SVC CI102 (CI102),11:42_17-12-2021,,2966,нет в наличии
 видеонаблюдения Gazer SVC CS215 (CS215),11:42_17-12-2021,,1344,нет в наличии
 видеонаблюдения Gazer SVC CS225 (CS225),11:42_17-12-2021,,1077,нет в наличии
 видеонаблюдения Gazer SVC CS236 (CS236),11:42_17-12-2021,,1077,нет в наличии
Null,11:42_17-12-2021,,-,-
 Gazer F121,11:42_17-12-2021,,3885,нет в наличии
 Gazer H714 + MC135,11:42_17-12-2021,,3271,нет в наличии
Чехол для планшета Gazer Tegra Slide Cover 7,11:42_17-12-2021,,109,нет в наличии
 Gazer Hyundai Sonata (YF) (2010-2015) (CM5008-YF),11:42_17-12-2021,,13899,нет в наличии
 Gazer ММ-система Gazer Ford Focus (BM) (2012-2016) (CM5007-BM),11:42_17-12-2021,,13899,нет в наличии
 Gazer Ford Focus (BM) (2012-2016) (CM6007-BM),11:42_17-12-2021,,8527,нет в наличии
 Gazer Ford Kuga (MA) - low version ( 2013-2017) (CM5008-MA),11:42_17-12-2021,,16999,нет в наличии
 Gazer Honda CRV (RE) (2006-2011) (CM6007-RE),11:42_17-12-2021,,19990,нет в наличии
 Gazer Hyundai Elantra (UD) (2016-2017) (CM5510-UD),11:42_17-12-2021,,13899,нет в наличии
 Gazer ММ-система Gazer Hyundai IX35 (EL) (2010-2015) (CM5007-EL),11:42_17-12-2021,,13899,нет в наличии
 Gazer Hyundai Santa Fe (DM) (2012-2016) (CM5008-DM),11:42_17-12-2021,,15899,нет в наличии
 Gazer Hyundai Sonata (LF) (2015-2017) (CM6510-LF),11:42_17-12-2021,,9189,нет в наличии
 Gazer Hyundai Sonata (YF) (2010-2015) (CM6509-YF),11:42_17-12-2021,,21990,нет в наличии
 Gazer Hyundai Tucson (TL) (2015-2017) (CM6510-TL),11:42_17-12-2021,,19990,нет в наличии
 Gazer Jeep Wrangler (JK) (2011-2014) (CM6510-JK),11:42_17-12-2021,,24990,нет в наличии
 Gazer Kia Sorento (XM10) (2010-2012) (CM5007-XM10),11:42_17-12-2021,,14547,нет в наличии
 Gazer Kia Soul (PS17) (2014-2017) (CM6007-PS17),11:42_17-12-2021,,18900,нет в наличии
 Gazer Kia Sportage (QL) (2015-2017) (CM5008-QL),11:42_17-12-2021,,15899,нет в наличии
 Gazer Kia Sportage (SL) (2010-2015) (CM6509-SL),11:42_17-12-2021,,21990,нет в наличии
 Gazer Mercedes C (W203) (2004-2007) (CM5007-W203),11:42_17-12-2021,,17899,нет в наличии
 Gazer Mitsubishi Pajero (V8W) (2006- 2015) (CM6007-V8W),11:42_17-12-2021,,17592,нет в наличии
" Gazer ММ-система Gazer Opel Astra H, Vectra C, Zafira B (2004-2009 (CM5007-L48)",11:42_17-12-2021,,15230,нет в наличии
 Gazer Peugeot 301 (2014-2017) (CM6510-ELS),11:42_17-12-2021,,21990,нет в наличии
 Gazer Renault Sandero (FS) (2008-2012) (CM6009-FS),11:42_17-12-2021,,22129,нет в наличии
Null,11:42_17-12-2021,,-,-
 Gazer Skoda Octavia A7 (5E3) (2013-2 016) (CM6008-5E3),11:42_17-12-2021,,8502,нет в наличии
" Gazer Subaru Outback (B14), Legacy ( 2008-2014) (CM6007-B14)",11:42_17-12-2021,,21990,нет в наличии
 Gazer Suzuki Grand Vitara (JT) (2005 -2015) (CM6008-JT),11:42_17-12-2021,,21990,нет в наличии
 Gazer Toyota Avalon (X4) (2014-2017) (CM6008-X4),11:42_17-12-2021,,21990,нет в наличии
 Gazer Toyota Camry (V50) (2012-2015) (CM5008-V50),11:42_17-12-2021,,15899,нет в наличии
 Gazer Toyota Camry (V50) (2012-2015) (CM6510-V50),11:42_17-12-2021,,21990,нет в наличии
 Gazer Toyota Hilux (N8) (2015-2017) (CM6509-N8),11:42_17-12-2021,,15709,нет в наличии
 Gazer Toyota LC 200 (J200N) (2016-2017) (CM5510-J200N),11:42_17-12-2021,,17899,нет в наличии
 Gazer ММ-система Gazer Toyota RAV 4 (A30) (2006-2012) (CM5007-A30),11:42_17-12-2021,,13899,нет в наличии
 Gazer Toyota RAV 4 (A30) (2006-2012) (CM6007-A30),11:42_17-12-2021,,19990,нет в наличии
 Gazer ММ-система Gazer Toyota Universal (2001-2012) (CM5006-120),11:42_17-12-2021,,6289,нет в наличии
 Gazer Universal 6.95 Full touch - 178x100 (CM6507-100F),11:42_17-12-2021,,13000,нет в наличии
 Gazer VW Touareg (7P5) (2010-2016) (CM5508-7P5),11:42_17-12-2021,,19990,нет в наличии
 Gazer ММ-система Gazer CM6507-100S (CM6507-100S),11:42_17-12-2021,,8888,нет в наличии
 Gazer CM6008-7P5,11:42_17-12-2021,,26990,нет в наличии
 Gazer CM5008-250T,11:42_17-12-2021,,15899,нет в наличии
 Gazer CM6007-C6,11:42_17-12-2021,,21990,нет в наличии
 Gazer СM6509-E39,11:42_17-12-2021,,15889,нет в наличии
 Gazer CM6008-CKN,11:42_17-12-2021,,17592,нет в наличии
 Gazer CM6509-RW,11:42_17-12-2021,,21990,нет в наличии
 Gazer Mazda CX-9 (TB) (2006-2012) CM6507-TB (CM6507-TB),11:42_17-12-2021,,23525,нет в наличии
 Gazer Toyota RAV 4 (A30) (2006-2012) CM5510-A30 (CM5510-A30),11:42_17-12-2021,,19161,нет в наличии
бель питания Gazer ACG121g/122 GPS cable (ACG121G/122),11:42_17-12-2021,,999,нет в наличии
Парктроник Gazer PA45R,11:42_17-12-2021,,3399,нет в наличии
Null,11:42_17-12-2021,,-,-
 видеонаблюдения Gazer CI224,11:42_17-12-2021,,2650,нет в наличии
 для видеонаблюдения Gazer NS204r,11:42_17-12-2021,,1446,нет в наличии
 для видеонаблюдения Gazer NS2224r,11:42_17-12-2021,,13186,нет в наличии
 для видеонаблюдения Gazer NF708r,11:42_17-12-2021,,3563,нет в наличии
 для видеонаблюдения Gazer NF344rh,11:42_17-12-2021,,4538,нет в наличии
 для видеонаблюдения Gazer NI404m,11:42_17-12-2021,,2292,нет в наличии
 видеонаблюдения Gazer SVC CF224/4 (CF224/4),11:42_17-12-2021,,1010,нет в наличии
 видеонаблюдения Gazer SVC CI201/4 (CI201/4),11:42_17-12-2021,,2074,нет в наличии
 видеонаблюдения Gazer SVC CI202/4 (CI202/4),11:42_17-12-2021,,2577,нет в наличии
 видеонаблюдения Gazer SVC CI212 (CI212),11:42_17-12-2021,,4713,нет в наличии
 видеонаблюдения Gazer SVC CI215 (CI215),11:42_17-12-2021,,5449,нет в наличии
 видеонаблюдения Gazer SVC CS135 (CS135),11:42_17-12-2021,,1109,нет в наличии
 видеонаблюдения Gazer SVC CS235 (CS235),11:42_17-12-2021,,1505,нет в наличии
 видеонаблюдения Gazer CS206,11:42_17-12-2021,,2320,нет в наличии
 Gazer F525,11:42_17-12-2021,,2449,нет в наличии
 Gazer F122,11:42_17-12-2021,,4329,нет в наличии
 Gazer F725,11:42_17-12-2021,,2999,нет в наличии
 заднего вида Gazer CC125,11:42_17-12-2021,,1187,нет в наличии
 Gazer Chevrolet Malibu (V350) (2013- 2016) (CM5008-V350),11:42_17-12-2021,,13899,нет в наличии
" Gazer ММ-система Gazer Ford Mondeo (BA7), Focus (DB) (2007-2012) (CM5007-BA7)",11:42_17-12-2021,,13899,нет в наличии
 Gazer Honda HRV (GH) (2013-2017) (CM5509-GH),11:42_17-12-2021,,6809,нет в наличии
 Gazer ММ-система Gazer Hyundai i30 (GD) (2012-2016) (CM5007-GD),11:42_17-12-2021,,13899,нет в наличии
 Gazer Kia Rio (UB) (2012-2015) (CM5008-UB),11:42_17-12-2021,,6258,нет в наличии
 Gazer Kia Sorento (UM) (2015-2017) (CM5510-UM),11:42_17-12-2021,,14999,нет в наличии
Null,11:42_17-12-2021,,-,-
 Gazer Kia Sportage (SL) (2010-2015) (CM6008-SL),11:42_17-12-2021,,19990,нет в наличии
 Gazer Mazda 3 (BL) (2010-2014) (CM6008-BL),11:42_17-12-2021,,19990,нет в наличии
" Gazer Mazda CX-5 (KE), 6 (GJ) (2012- 2016) (CM6008-KE)",11:42_17-12-2021,,7989,нет в наличии
 Gazer Mazda CX-7 (ER) (2006-2012) (CM6007-ER),11:42_17-12-2021,,21990,нет в наличии
" Gazer ММ-система Gazer Nissan Tiida, Qashqai, X-Trail , Patrol (CM5006-SC11)",11:42_17-12-2021,,13899,нет в наличии
 Gazer Kia Carens (FG) (2013-2017) (CM6509-RP),11:42_17-12-2021,,8469,нет в наличии
 Gazer Skoda Fabia (NJ) (2015-2017) (CM5509-NJ),11:42_17-12-2021,,7069,нет в наличии
" Gazer Skoda Octavia A5, Fabia, Super b (2005-2012) (CM6007-1Z3)",11:42_17-12-2021,,21990,нет в наличии
 Gazer Skoda Rapid (NK3) (2013-2016) (CM6008-NK3),11:42_17-12-2021,,9499,нет в наличии
 Gazer ММ-система Gazer Subaru Forester (S12) (2007-2012) (CM5007-S12),11:42_17-12-2021,,6809,нет в наличии
 Gazer Suzuki SX-4 (JY) (2013-2016) (CM5008-JY),11:42_17-12-2021,,15612,нет в наличии
 Gazer ММ-система Gazer СM5510-V70 (CM5510-V70),11:42_17-12-2021,,15899,нет в наличии
 Gazer Toyota LC 200 (J200N) (2016-2017) (CM5009-J200N),11:42_17-12-2021,,17899,нет в наличии
 Gazer Toyota Corolla (E150) (2013-2016) (CM5009-E150),11:42_17-12-2021,,15899,нет в наличии
 Gazer CM5007-C6,11:42_17-12-2021,,15899,нет в наличии
 Gazer CM6510-E21 CM6510-E21 (CM6510-E21),11:42_17-12-2021,,23525,нет в наличии
 видеонаблюдения Gazer SVC CF204/4 (CF204/4),11:42_17-12-2021,,1567,нет в наличии
 видеонаблюдения Gazer SVC CF214 (CF214),11:42_17-12-2021,,3834,нет в наличии
 видеонаблюдения Gazer SVC CF234 (CF234),11:42_17-12-2021,,1833,нет в наличии
 видеонаблюдения Gazer CS226,11:42_17-12-2021,,2381,нет в наличии
 для видеонаблюдения Gazer NF308me,11:42_17-12-2021,,10355,нет в наличии
 для видеонаблюдения Gazer NP404m,11:42_17-12-2021,,3301,нет в наличии
 для видеонаблюдения Gazer NP416mp,11:42_17-12-2021,,8211,нет в наличии
 для видеонаблюдения Gazer MS504rw/MS504re,11:42_17-12-2021,,10769,нет в наличии
Null,11:42_17-12-2021,,-,-
 для видеонаблюдения Gazer NS108,11:42_17-12-2021,,4688,нет в наличии
 Gazer S514,11:42_17-12-2021,,907,нет в наличии
 Gazer H714,11:42_17-12-2021,,1999,нет в наличии
 Gazer F150g,11:42_17-12-2021,,4840,нет в наличии
 Gazer F720,11:42_17-12-2021,,3999,нет в наличии
 Gazer AUDI A3 (2003-2008) (CM5007-8P),11:42_17-12-2021,,15899,нет в наличии
 Gazer BMW 3 (E46) (1998-2004) (CM5007-E46),11:42_17-12-2021,,13899,нет в наличии
" Gazer Chery A3 (M11) A5, Tiggo (T11) (2005-2014) (CM5006-M11)",11:42_17-12-2021,,6269,нет в наличии
 Gazer Chevrolet Aveo (T300) (2011-2016) (CM6008-T300),11:42_17-12-2021,,8499,нет в наличии
 Gazer Ford F150 (XII) (2009-2014) (CM6008-XII),11:42_17-12-2021,,23398,нет в наличии
 Gazer Ford Fiesta (JJ) (2008-2014) (CM6007-JJ),11:42_17-12-2021,,21990,нет в наличии
 Gazer Ford Focus (BM) (2012-2016) (CM7010-BM),11:42_17-12-2021,,9750,нет в наличии
" Gazer Ford Mondeo (BA7), Focus (DB) (2007-2012) (CM6007-BA7)",11:42_17-12-2021,,19990,нет в наличии
" Gazer Ford Mondeo (BA7), Focus (DB) (2007-2012) (CM7010-BA7)",11:42_17-12-2021,,27990,нет в наличии
" Gazer Ford Tourneo, Transit (F150) ( 2013-2016) (CM6009-F150)",11:42_17-12-2021,,24990,нет в наличии
 Gazer ММ-система Gazer Honda CRV (RE) (2006-2011) (CM5007-RE),11:42_17-12-2021,,11119,нет в наличии
 Gazer Honda CRV (RE) (2006-2011) (CM6008-RE),11:42_17-12-2021,,21990,нет в наличии
 Gazer Honda Civic (FA) (2006-2011) (CM6007-FA),11:42_17-12-2021,,19300,нет в наличии
 Gazer ММ-система Gazer Hyundai Accent (RB) (2010-2015 ) (CM5007-RB),11:42_17-12-2021,,13899,нет в наличии
 Gazer ММ-система Gazer Hyundai Santa Fe (CM) (2006-20 12) (CM5006-CM),11:42_17-12-2021,,7069,нет в наличии
 Gazer ММ-система Gazer Hyundai Sonata (NF) (2009-2010 ) (CM5006-NF),11:42_17-12-2021,,5949,нет в наличии
 Gazer Hyundai Sonata (NF) (2009-2010) (CM6006-NF),11:42_17-12-2021,,7473,нет в наличии
 Gazer Jeep Compass (MK49) (2007-2016) (CM5510-MK49),11:42_17-12-2021,,15589,нет в наличии
 Gazer Jeep Compass (MK49) (2007-2016) (CM6510-MK49),11:42_17-12-2021,,20900,нет в наличии
Null,11:42_17-12-2021,,-,-
 Gazer Kia Carens (FG) (2013-2017) (CM5008-RP),11:42_17-12-2021,,15899,нет в наличии
 Gazer Kia Sorento (XM) (2013-2015) (CM5008-XM),11:42_17-12-2021,,7079,нет в наличии
 Gazer Kia Sorento (XM) (2013-2015) (CM6008-XM),11:42_17-12-2021,,19990,нет в наличии
 Gazer Mazda CX-9 (TB) (2006-2012) (CM6007-TB),11:42_17-12-2021,,19990,нет в наличии
" Gazer Mercedes A, B, Vito, Viano, Sp rinter (2003-2012) (CM5007-W169)",11:42_17-12-2021,,17899,нет в наличии
 Gazer Mercedes E (W211) (2002-2011) (CM6007-W211),11:42_17-12-2021,,24990,нет в наличии
 Gazer Mercedes ML (W164) (2005-2013) (CM6007-W164),11:42_17-12-2021,,24990,нет в наличии
 Gazer ММ-система Gazer Mitsubishi Pajero (V8W) (2006- 2015) (CM5007-V8W),11:42_17-12-2021,,15899,нет в наличии
" Gazer Nissan Qashqai, X-Trail (2013- 2016) (CM5008-J11)",11:42_17-12-2021,,15899,нет в наличии
" Gazer Nissan Qashqai, X-Trail (2013-2016) (CM5510-J11)",11:42_17-12-2021,,14999,нет в наличии
" Gazer Opel Astra H, Vectra C, Zafira B (2004-2009) (CM6007-L48)",11:42_17-12-2021,,21990,нет в наличии
 Gazer ММ-система Gazer Renault Megane (BMO) (2002-200 9) (CM5007-BMO),11:42_17-12-2021,,15899,нет в наличии
 Gazer Renault Megane III (DZO) (2008 -2016) (CM6007-DZO),11:42_17-12-2021,,21438,нет в наличии
 Gazer ММ-система Gazer Toyota Prado (J120) (2002-2009) (CM5007-TYT),11:42_17-12-2021,,15899,нет в наличии
 Gazer Toyota Prado (J150) (2010-2013) (CM6510-J150),11:42_17-12-2021,,24990,нет в наличии
 Gazer Toyota Venza (GV10) (2008-2016) (CM6007-GV10),11:42_17-12-2021,,21990,нет в наличии
 Gazer VW Tiguan (5N2) (2013-2016) (CM5510-5N2),11:42_17-12-2021,,13899,нет в наличии
 Gazer CM6007-GAB,11:42_17-12-2021,,14659,нет в наличии
 Gazer CM6509-CW6,11:42_17-12-2021,,21990,нет в наличии
 Gazer CM6510-CR,11:42_17-12-2021,,21990,нет в наличии
