,Date,Name,Price,Nal
531,16:03_24-11-2021," Gazer Opel Astra H, Vectra C, Zafira B (2004-2009) (CM6007-L48)",21990,нет в наличии
532,16:03_24-11-2021, Gazer ММ-система Gazer Renault Megane (BMO) (2002-200 9) (CM5007-BMO),15899,нет в наличии
533,16:03_24-11-2021, Gazer Renault Megane III (DZO) (2008 -2016) (CM6007-DZO),21438,нет в наличии
534,16:03_24-11-2021," Gazer ММ-система Gazer Skoda Octavia A5, Fabia, Super b (2005-2012 (CM5007-1Z3)",14999,нет в наличии
535,16:03_24-11-2021, Gazer Toyota Highlander (XU40) (2008 -2015) (CM6008-XU40),19124,нет в наличии
536,16:03_24-11-2021, Gazer ММ-система Gazer Toyota Prado (J120) (2002-2009) (CM5007-TYT),15899,нет в наличии
537,16:03_24-11-2021, Gazer Toyota Prado (J150) (2010-2013) (CM6510-J150),24990,нет в наличии
538,16:03_24-11-2021," Gazer Mitsubishi Lancer (2007-2013), ASX (2007-2010) (CM6510-ASX10)",21990,нет в наличии
539,16:03_24-11-2021, Gazer Universal 7 Full touch - 178x100 (CM5507-100H),9825,нет в наличии
540,16:03_24-11-2021, Gazer CM6007-GAB,14659,нет в наличии
541,16:03_24-11-2021, Gazer CM6510-CR,21990,нет в наличии
542,16:03_24-11-2021, Gazer CM5507-QV,17027,нет в наличии
543,16:03_24-11-2021,Парктроник Gazer PA40R,2899,нет в наличии
544,16:03_24-11-2021, заднего вида Gazer CC207,1599,нет в наличии
545,16:03_24-11-2021, заднего вида Gazer СС120,1599,нет в наличии
546,16:03_24-11-2021, видеонаблюдения Gazer SVC CI221/4 (CI221/4),2560,нет в наличии
547,16:03_24-11-2021, видеонаблюдения Gazer SVC CI232 (CI232),4290,нет в наличии
548,16:03_24-11-2021, видеонаблюдения Gazer SVC CS205 (CS205),1061,нет в наличии
549,16:03_24-11-2021,Null,-,-
550,16:03_24-11-2021, видеонаблюдения Gazer SVC СF104 (F104),2675,нет в наличии
551,16:03_24-11-2021, видеонаблюдения Gazer CS216,2351,нет в наличии
552,16:03_24-11-2021, видеонаблюдения Gazer CI202a,2612,нет в наличии
553,16:03_24-11-2021, для видеонаблюдения Gazer NS216r,3184,нет в наличии
554,16:03_24-11-2021, для видеонаблюдения Gazer NS2208r,6343,нет в наличии
555,16:03_24-11-2021, для видеонаблюдения Gazer NF308r,10264,нет в наличии
556,16:03_24-11-2021, для видеонаблюдения Gazer NF316r,36636,нет в наличии
557,16:03_24-11-2021, для видеонаблюдения Gazer NI408m,3247,нет в наличии
558,16:03_24-11-2021, для видеонаблюдения Gazer NI408mp,5118,нет в наличии
559,16:03_24-11-2021, для видеонаблюдения Gazer NI4416m,9721,нет в наличии
560,16:03_24-11-2021, для видеонаблюдения Gazer NP404mp,4459,нет в наличии
561,16:03_24-11-2021, для видеонаблюдения Gazer NA208f,5940,нет в наличии
562,16:03_24-11-2021, Gazer TV43-FS2G,11499,нет в наличии
563,16:03_24-11-2021, Gazer F140,4120,нет в наличии
564,16:03_24-11-2021, Gazer F225,9455,нет в наличии
565,16:03_24-11-2021, Gazer F150,3999,нет в наличии
566,16:03_24-11-2021,GPS-модуль Gazer ACG-OBD,1199,нет в наличии
567,16:03_24-11-2021, Gazer CM6006-100D,10276,нет в наличии
568,16:03_24-11-2021, Gazer Hyundai Sonata (YF) (2010-2015) (CM5509-YF),15899,нет в наличии
569,16:03_24-11-2021, Gazer Hyundai Sonata (YF) (2010-2015) (CM6008-YF),8243,нет в наличии
570,16:03_24-11-2021, Gazer AUDI TT (2006-2011) (CM6007-8J),21838,нет в наличии
571,16:03_24-11-2021, Gazer Hyundai Accent (RB) (2010-2015) (CM6509-RB),17400,нет в наличии
572,16:03_24-11-2021, Gazer Hyundai Elantra (UD) (2016-2017) (CM5008-UD),15899,нет в наличии
573,16:03_24-11-2021, Gazer Hyundai Santa Fe (CM) (2006-2012) (CM6007-CM),17499,нет в наличии
574,16:03_24-11-2021,Null,-,-
575,16:03_24-11-2021, Gazer Hyundai Tucson (TL) (2015-2017) (CM5008-TL),13899,нет в наличии
576,16:03_24-11-2021, Gazer Jeep Commander (XKN) (2016-2017) (CM6510-XKN),8528,нет в наличии
577,16:03_24-11-2021, Gazer ММ-система Gazer Kia Ceed (ED) (2007-2012) (CM5007-ED),15899,нет в наличии
578,16:03_24-11-2021, Gazer Kia Optima (TF) (2010-2015) (CM5008-TF),14999,нет в наличии
579,16:03_24-11-2021, Gazer Kia Rio (UB15) (2015-2017) (CM5008-UB15),17710,нет в наличии
580,16:03_24-11-2021, Gazer Kia Sorento (UM) (2015-2017) (CM6510-UM),21990,нет в наличии
581,16:03_24-11-2021, Gazer ММ-система Gazer Kia Soul (PS) (2012-2014) (CM5006-PS),13899,нет в наличии
582,16:03_24-11-2021," Gazer Mercedes A (W168), C (W203), E (W210), CLK(W209) (CM6007-W163)",22668,нет в наличии
583,16:03_24-11-2021, Gazer Mercedes C (W203) (2004-2007) (CM6007-W203),24990,нет в наличии
584,16:03_24-11-2021, Gazer Mercedes S (W220) (1998-2005) (CM5007-W220),17899,нет в наличии
585,16:03_24-11-2021, Gazer Mitsubishi Lancer (CYA) (2007- 2013) (CM6008-CYA),21990,нет в наличии
586,16:03_24-11-2021," Gazer Nissan Qashqai, X-Trail (2013- 2016) (CM6008-J11)",21990,нет в наличии
587,16:03_24-11-2021, Gazer Renault Captur Clio (KR0) - au to conditioner 2011-2015 (CM6509-KR0),19990,нет в наличии
588,16:03_24-11-2021, Gazer Skoda Yeti (5L) - manual condi tioner (2009-2013) (CM5510-5LM),16848,нет в наличии
589,16:03_24-11-2021, Gazer Subaru Forester (SJ) (2013-2014) (CM6509-SJ),21990,нет в наличии
590,16:03_24-11-2021, Gazer Suzuki SX-4 (EYB) (2006-2013) (CM6008-EYB),21990,нет в наличии
591,16:03_24-11-2021, Gazer Toyota Camry (V40) (2007-2011) (CM5008-V40),15899,нет в наличии
592,16:03_24-11-2021, Gazer Toyota Camry (V40) (2007-2011) (CM6008-V40F),19399,нет в наличии
593,16:03_24-11-2021, Gazer Toyota Highlander (XU40) (2008 -2015) (CM5008-XU40),15899,нет в наличии
594,16:03_24-11-2021, Gazer Toyota Highlander (XU40) (2008 -2015) (CM5510-XU40),15899,нет в наличии
595,16:03_24-11-2021, Gazer Toyota LC 200 (J200N) (2016-2017) (CM6009-J200N),24990,нет в наличии
596,16:03_24-11-2021, Gazer Toyota LC 200 (J200N) (2016-2017) (CM6510-J200N),22668,нет в наличии
597,16:03_24-11-2021, Gazer ММ-система Gazer Toyota Prius C (NHP10) (2011-2 014) (CM5006-NHP10),13899,нет в наличии
598,16:03_24-11-2021, Gazer Universal 6.95 Full touch - 17 8x100 (CM5507-100F),6859,нет в наличии
599,16:03_24-11-2021,Null,-,-
600,16:03_24-11-2021, Gazer Mitsubishi Pajero Sport (KHW) (2008-2015) (CM5008-KHW),15899,нет в наличии
601,16:03_24-11-2021, Gazer Universal 7 Full touch - 178x100 (CM6507-100H),14000,нет в наличии
602,16:03_24-11-2021, Gazer ММ-система Gazer CM6510-GFW (CM6510-GFW),17592,нет в наличии
603,16:03_24-11-2021," Gazer Renault Captur, Clio (KR0) - AC (2011-2015) CM6509-KR0A (CM6509-KR0A)",23525,нет в наличии
604,16:03_24-11-2021, Gazer CM6510-A50 CM6510-A50 (CM6510-A50),23525,нет в наличии
605,16:03_24-11-2021,Парктроник Gazer PA40F,2899,нет в наличии
606,16:03_24-11-2021,Null,-,-
