Name,Data,,Price,Nal
 Gazer CM5508-CYA CM5508-CYA (CM5508-CYA),11:42_17-12-2021,,17027,нет в наличии
 Gazer CM5507-QV,11:42_17-12-2021,,17027,нет в наличии
 для видеонаблюдения Gazer NS216r,11:42_17-12-2021,,3232,нет в наличии
 для видеонаблюдения Gazer NS2208r,11:42_17-12-2021,,6438,нет в наличии
Null,11:42_17-12-2021,,-,-
 для видеонаблюдения Gazer NF308r,11:42_17-12-2021,,10417,нет в наличии
 для видеонаблюдения Gazer NF316r,11:42_17-12-2021,,37183,нет в наличии
 для видеонаблюдения Gazer NI408m,11:42_17-12-2021,,3295,нет в наличии
 для видеонаблюдения Gazer NI408mp,11:42_17-12-2021,,5194,нет в наличии
 для видеонаблюдения Gazer NI4416m,11:42_17-12-2021,,9866,нет в наличии
 для видеонаблюдения Gazer NP404mp,11:42_17-12-2021,,4525,нет в наличии
 видеонаблюдения Gazer SVC CI221/4 (CI221/4),11:42_17-12-2021,,2598,нет в наличии
 видеонаблюдения Gazer SVC CI232 (CI232),11:42_17-12-2021,,4354,нет в наличии
 видеонаблюдения Gazer SVC CS205 (CS205),11:42_17-12-2021,,1077,нет в наличии
 видеонаблюдения Gazer SVC СF104 (F104),11:42_17-12-2021,,2715,нет в наличии
 видеонаблюдения Gazer CS216,11:42_17-12-2021,,2351,нет в наличии
 видеонаблюдения Gazer CI202a,11:42_17-12-2021,,2612,нет в наличии
 Gazer TV43-FS2G,11:42_17-12-2021,,11499,нет в наличии
 Gazer F225,11:42_17-12-2021,,9455,нет в наличии
 Gazer F150,11:42_17-12-2021,,3999,нет в наличии
 Gazer CM6006-100D,11:42_17-12-2021,,10476,нет в наличии
 Gazer Hyundai Sonata (YF) (2010-2015) (CM5509-YF),11:42_17-12-2021,,15899,нет в наличии
 Gazer AUDI TT (2006-2011) (CM6007-8J),11:42_17-12-2021,,21838,нет в наличии
 Gazer Hyundai Accent (RB) (2010-2015) (CM6509-RB),11:42_17-12-2021,,17400,нет в наличии
 Gazer Hyundai Elantra (UD) (2016-2017) (CM5008-UD),11:42_17-12-2021,,15899,нет в наличии
 Gazer Hyundai Santa Fe (CM) (2006-2012) (CM6007-CM),11:42_17-12-2021,,17499,нет в наличии
 Gazer Hyundai Sonata (YF) (2010-2015) (CM7015-YF),11:42_17-12-2021,,22392,нет в наличии
 Gazer Hyundai Tucson (TL) (2015-2017) (CM5008-TL),11:42_17-12-2021,,13899,нет в наличии
 Gazer ММ-система Gazer Kia Ceed (ED) (2007-2012) (CM5007-ED),11:42_17-12-2021,,15899,нет в наличии
Null,11:42_17-12-2021,,-,-
 Gazer Kia Optima (TF) (2010-2015) (CM5008-TF),11:42_17-12-2021,,14999,нет в наличии
 Gazer Kia Rio (UB15) (2015-2017) (CM5008-UB15),11:42_17-12-2021,,17710,нет в наличии
 Gazer Kia Sorento (UM) (2015-2017) (CM6510-UM),11:42_17-12-2021,,21990,нет в наличии
 Gazer ММ-система Gazer Kia Soul (PS) (2012-2014) (CM5006-PS),11:42_17-12-2021,,13899,нет в наличии
 Gazer ММ-система Gazer Mazda CX-9 (TB) (2006-2012) (CM5007-TB),11:42_17-12-2021,,7099,нет в наличии
" Gazer Mercedes A (W168), C (W203), E (W210), CLK(W209) (CM6007-W163)",11:42_17-12-2021,,22668,нет в наличии
 Gazer Mercedes C (W203) (2004-2007) (CM6007-W203),11:42_17-12-2021,,24990,нет в наличии
 Gazer Mercedes S (W220) (1998-2005) (CM5007-W220),11:42_17-12-2021,,17899,нет в наличии
 Gazer Mitsubishi Lancer (CYA) (2007- 2013) (CM6008-CYA),11:42_17-12-2021,,21990,нет в наличии
" Gazer Nissan Qashqai, X-Trail (2013- 2016) (CM6008-J11)",11:42_17-12-2021,,21990,нет в наличии
 Gazer Nissan Teana (J32) (2008-2013) (CM6510-J32),11:42_17-12-2021,,19990,нет в наличии
 Gazer Renault Captur Clio (KR0) - au to conditioner 2011-2015 (CM6509-KR0),11:42_17-12-2021,,19990,нет в наличии
 Gazer Renault Sandero (FS) (2008-2012) (CM5009-FS),11:42_17-12-2021,,7130,нет в наличии
 Gazer Skoda Yeti (5L) - manual condi tioner (2009-2013) (CM5510-5LM),11:42_17-12-2021,,16848,нет в наличии
 Gazer Subaru Forester (SJ) (2013-2014) (CM6509-SJ),11:42_17-12-2021,,21990,нет в наличии
 Gazer Suzuki SX-4 (EYB) (2006-2013) (CM6008-EYB),11:42_17-12-2021,,21990,нет в наличии
 Gazer Toyota Camry (V40) (2007-2011) (CM5008-V40),11:42_17-12-2021,,15899,нет в наличии
 Gazer Toyota Camry (V40) (2007-2011) (CM6008-V40F),11:42_17-12-2021,,19399,нет в наличии
 Gazer Toyota Highlander (XU40) (2008 -2015) (CM5510-XU40),11:42_17-12-2021,,15899,нет в наличии
 Gazer Toyota LC 200 (J200) (2007-2015) (CM6008-J200),11:42_17-12-2021,,8579,нет в наличии
 Gazer Toyota LC 200 (J200N) (2016-2017) (CM6009-J200N),11:42_17-12-2021,,24990,нет в наличии
 Gazer Toyota LC 200 (J200N) (2016-2017) (CM6510-J200N),11:42_17-12-2021,,22668,нет в наличии
 Gazer ММ-система Gazer Toyota Prius C (NHP10) (2011-2 014) (CM5006-NHP10),11:42_17-12-2021,,13899,нет в наличии
 Gazer Universal 6.95 Full touch - 17 8x100 (CM5507-100F),11:42_17-12-2021,,6992,нет в наличии
Null,11:42_17-12-2021,,-,-
 Gazer VW/Skoda/Seat (2008-2016) (CM6008-T5),11:42_17-12-2021,,21990,нет в наличии
 Gazer Mitsubishi Pajero Sport (KHW) (2008-2015) (CM5008-KHW),11:42_17-12-2021,,15899,нет в наличии
 Gazer Universal 7 Full touch - 178x100 (CM6507-100H),11:42_17-12-2021,,14000,нет в наличии
 Gazer ММ-система Gazer CM6510-GFW (CM6510-GFW),11:42_17-12-2021,,17592,нет в наличии
" Gazer Renault Captur, Clio (KR0) - AC (2011-2015) CM6509-KR0A (CM6509-KR0A)",11:42_17-12-2021,,23525,нет в наличии
 Gazer CM6510-A50 CM6510-A50 (CM6510-A50),11:42_17-12-2021,,23525,нет в наличии
Null,11:42_17-12-2021,,-,-
